在通用Corel图像数据集上的实验表明, 融合多特征的深度学习图像自动标注方法, 考虑图像不同特征的影响, 提高了图像自动标注的精度\Corel图像数据集\深度学习图像自动标注方法\图像自动标注的精度
在Extended Yale B等数据库上的实验结果表明, 该算法与传统的人脸识别算法和标准的栈式自动编码器相比, 对光照变化有更强的鲁棒性, 具有更好的识别效果\Extended Yale B\传统的人脸识别算法\识别效果
为了验证该模型的有效性, 选用标准图像库中的多幅纹理图像进行实验, 对实验结果进行了定性和定量分析, 在定量分析中采用图像信息熵、平均梯度、清晰度和对比度四个评价指标衡量图像增强的效果, 并与二阶微分Laplacian算子、Tiansi算子进行比较\标准图像库\Tiansi算子\对比度
针对牛津大学Mikolajczyk标准图像数据集进行了实验, 结果表明:提出的改进D-Nets算法在尺度、视差和光照变化较大的情况下平均配准精度为92.2%, 平均时间开销为2.48 s\Mikolajczyk标准图像数据集\改进D-Nets算法\平均时间开销
采用10组航空遥感海冰图像对算法进行测试, 结果表明, 相对于采用SIFT欧氏距离 (ED-SIFT) , 在匹配重复特征比较多、点集规模比较大的图像时, CEM-SIFT算法的匹配精度更高, 能够达到100%\10组航空遥感海冰图像\ CEM-SIFT算法\匹配精度
采用图像分割实例对改进布谷鸟搜索算法的有效性和优越性进行测试, 测试结果表明, 改进算法可以提高图像的分割精度, 对噪声不敏感, 获得了较其它方法更优的图像分割效果, 分割精度和速度均可以满足实际应用的要求\图像分割实例\改进布谷鸟搜索算法\速度
在3 075张蓝藻图像集上的训练和测试结果表明, DGAN在精确率、召回率及F1分数等指标上均大幅领先基于迭代的阈值分割算法;相比FCNNet (SHELHAMER E, LONG J, DARRELL T.Fully convolutional networks for semantic segmentation.IEEE Transactions on Pattern Analysis and Machine Intelligence, 2017, 39 (4) :640-651) 、Deeplab (CHEN L C, PAPANDREOU G, KOKKINOS I, et al.Semantic image segmentation with deep convolutional nets and fully connected CRFs.Computer Science, 2014 (4) :357-361) 等其他基于DNN的方法也提升了超过4个百分点, 取得了更精准的分割结果\3 075张蓝藻图像集\Deeplab\精确率
采用OMP算法能提高VOC2012数据中图像的识别率\VOC2012数据\OMP算法\识别率
实验在Scene-15图像场景数据集的基础上进行, 并将本文方法与基于尺度不变特征转换 (SIFT) 特征提取方法的几种常用经典方法进行对比实验, 实验结果表明本文方法在选取了合适的特征基元个数后, 提高了提取图像特征的速度和时间以及图像场景的分类准确率\Scene-15图像场景数据集\SIFT\时间
在Ploy U图库及自建图库上进行实验, 结果表明, NSCT-NBP算法可获得最低的EER, 分别为0.72%和0.96%, 识别时间仅为0.053 0 s和0.087 1 s, 与当前最优的基于小波变换和Gabor滤波器的掌纹掌脉融合方法相比, 在两个图库上EER分别降低了4%和36.8%\Ploy U图库\Gabor滤波器\EER
通过在Movie Lens数据集上的对比实验, 结果表明, 相比于传统的协同过滤推荐算法, 改进算法具有更高的推荐准确度\Movie Lens数据集\协同过滤推荐算法\推荐准确度
该算法首先利用基于“用户-项目-标签”的三部图物质扩散推荐算法来计算用户之间的相似度, 并引入“用户-用户兴趣标签图”二元关系, 通过用户的兴趣标签图来发掘用户的兴趣主题;然后根据用户主题分布, 利用KL距离来计算用户之间的相似度;最后将两组结果采用调和平均数方式融合得到用户间的综合相似度, 并进行好友的推荐\“用户-用户兴趣标签图”二元关系\三部图物质扩散推荐算法\KL距离
通过在Delicious和Last.fm数据集上的实验证明, 该算法能有效提高Top-N推荐的准确率和召回率, 同时通过在学术社交网站——学者网数据集上进行的学者推荐实验表明, 该算法能有效提高核心用户的推荐度\学者网数据集\Top-N推荐\召回率
在真实的Movie Lens 1M数据集上进行的大量实验表明, 与当前具有代表性的推荐算法相比, 算法显著提高了推荐精度\Movie Lens 1M数据集\推荐算法\推荐精度
在UCI数据集上的实验结果表明, 相较于其它特征选择算法, 该算法能有效地提高各数据集在libSVM、J48、Nave Bayes以及KNN分类器上的分类准确率\UCI数据集\KNN分类器\分类准确率
所提方法在Kodak数据库上的平均标注准确率达到了35.81%, 与标准的支持向量机 (S-SVM) 领域适应支持向量机 (DASVM) 、异构直推式迁移学习 (HTTL) 、跨领域的结构化模型 (CDSM) 、领域选择机 (DSM) 、异构源域下的多领域适应 (MDA-HS) 和判别性相关分析 (DCA) 方法相比分别提高了58.03%、23.06%、45.04%、6.70%、15.52%、13.07%和6.74%;而在哥伦比亚用户视频 (CCV) 数据库上达到了20.73%, 分别相对提高了133.71%、37.28%、14.34%、24.88%、16.40%、20.73%和12.48%\CCV\判别性相关分析 \准确率
基于人工合成数据集和真实数据集的实验表明, 在同等标注代价下, 基于自适应稀疏邻域重构的主动学习算法在分类精度和鲁棒性上具有较高的性能\真实数据集\自适应稀疏邻域重构的主动学习算法\鲁棒性
通过对国际公共数据集MESSIDOR进行糖网分级评估实验, 所提方法获得平均准确率为90.2%, 与经典的半监督学习的Co-training方法相比提高了4.9个百分点\国际公共数据集MESSIDOR\半监督学习的Co-training方法\平均准确率
该算法在数据集20-Newsgroups上分别与传统的KNN算法和改进的KNN算法做对比实验, 实验结果表明, 该算法能够明显提高KNN算法的分类性能和分类速度\数据集20-Newsgroups\KNN算法\分类速度
首先, 根据用户对位置访问的频次设置频繁位置并为每个用户建立频繁位置集合;然后按照背景知识的不同, 将频繁位置的子集组成超边, 把不满足匿名参数k的超边以用户偏离和位置偏离最小值为优化目标进行超边重组;最后, 通过仿真实验表明, 与 (k, m) -anonymity算法相比, 在频繁位置为3的情况下, 该算法在Gowalla数据集上用户偏离度以及位置偏离度分别平均降低了约19.1%和8.3%, 在Brightkite数据集上分别平均降低了约22.2%和10.7%, 因此所提算法能够有效保护频繁位置的同时降低用户和位置偏离度\Brightkite数据集\(k, m) -anonymity算法\位置偏离度
所提方法在Blind数据集上的等误率比传统的动态时间规划 (DTW) 方法降低了约14.4%\Blind数据集\DTW\等误率
该模型首先对SQL代码进行了预处理, 分析语义结构进而提取出代码的特征, 同时进行分词处理;然后构建SQL代码的同义库, 根据同义库将分词后的代码片段进行同义转换;之后运用最长公共子串算法对代码片段进行相似度匹配, 进而赋予各个片段影响因子, 得到代码总的相似度;最后分析人工评分数据制定相应的自动评分策略, 从而评定出SQL代码的分数\SQL代码的同义库\最长公共子串算法\相似度
在Extended Yale B, UMBDB和AR 3个人脸数据库上的实验结果表明, 相对于基于K-SVD字典学习方法的GRRC, 基于SVD字典学习方法的GRRC在各种情形下都具有更好的时间性能和识别性能\AR\GRRC\识别性能
在FGNET数据库子集上提出的人脸年龄估计方法的平均绝对误差为4.1岁, 相对于已有的年龄估计方法, 性能得到提升\FGNET数据库子集\年龄估计方法\绝对误差
基于第3个假设和代表点分值, 构建了一种快速的自适应聚类算法, 该算法将所有样本按照其代表点分值从大到小排序, 形成代表点候选集;然后从代表点候选集中逐个选择代表点, 利用其邻域不断传递标签至整个压缩集;最后采用同样的方法将压缩集中样本的标签扩散至整个数据集, 在此过程中引入抽样, 提高标签传播速度\压缩集\自适应聚类算法\代表点分值
在典型数据集上进行的实验发现, 相较于传统K-means算法, OICC K-means算法拥有更强的聚类能力, 在准确率、召回率和F-测量值方面均有明显提高\典型数据集\OICC K-means算法\F-测量值
实验结果表明, 在UCI数据集和模拟数据集上, 该算法与原始的密度峰聚类算法相比, 准确率、标准化互信息 (NMI) 和F-Measure指标分别平均提高约22.3%、35.7%和16.6%\模拟数据集\原始的密度峰聚类算法\F-Measure指标
通过在桂林市2015年的微博签到数据集上进行实验, 相比其他聚类算法, 本文提出的算法在准确率、覆盖率等指标上均有提高\微博签到数据集\聚类算法\覆盖率
本文通过10个UCI数据集和ORL人脸数据库来做对比实验, 然后从准确率、算法时间、聚类个数三个维度去分析, 最终实验结果证明本文所提出的GKAAP聚类准确性更好, 算法时间复杂度更低\ORL人脸数据库\GKAAP聚类\聚类个数
实验中采用标准测试函数对CQPSO算法进行仿真对比, 验证了CQPSO算法性能优于量子PSO算法;采用UCI标准数据库的典型例子进行属性约简测试, 结果表明提出的属性约简方法优于现有约简方法, 其计算速度快、识别精度高\UCI标准数据库\属性约简方法\识别精度
对TSPLIB标准库中若干经典实例进行测试并与粒子群和遗传算法进行对比分析, 结果表明设计的离散蝙蝠算法无论在求解质量还是求解效率上都有明显优势, 是一种高效的优化算法\TSPLIB标准库\离散蝙蝠算法\求解效率
在实证研究中, 以NASA的11个数据集为实验对象, 采用逻辑回归算法构建预测模型, 并采用AUC指标度量不同预测模型的分类性能\NASA的11个数据集\逻辑回归算法\AUC指标
