利用Helen数据集训练得到具有194个特征点的人脸主动形状模型, 结合haar级联检测得到精确的人脸和眼睛轮廓区域;通过光流法实现对人脸及上下眼睑特征点的有效跟踪, 获得每帧图像的头部姿态及眼睛睁开度, 实现对眼睛疲劳状态识别;结合正负图像训练得到的支持向量机判定驾驶员是否属于重度疲劳情况下的低头行为\Helen数据集\支持向量机\光流法
实验阶段, IFSFOA使用SVM, J48和KNN分类器指导学习过程, 通过机器学习数据库UCI上的小维、中维、高维数据集进行测试\小维、中维、高维数据集\IFSFOA\KNN
在TREC数据集上的实验显示, 将词向量模型进行扩展词选择的方法与传统的TF-IDF扩展词选择方法相融合, 可以有效提高查询扩展模型的性能, 对于理解用户的查询意图有着很好的促进作用\TREC数据集\词向量模型\查询扩展模型
该方法从文档集中运用FP-Growth算法挖掘出频繁词集, 运用频繁词集来表示每个文本从而大大降低了文本维度, 根据文本间相似度建立文本网络, 运用社区划分的算法对网络进行划分, 从而达到文本聚类的目的\频繁词集\文本网络\运用社区划分的算法
分别采用k近邻法和softmax回归建立统计模型, 实验结果表明, 新方法在NPB测试集和大型科学计算程序上实现了较好的预测性能\NPB测试集\softmax\k近邻法
针对上述问题, 基于采样方法利用决策树建立软件可维护性预测模型, 并通过UIMS和QUES数据集对模型进行实验验证\QUES数据集\软件可维护性预测模型\决策树
