针对PHP应用程序中的SQL注入行为, 提出了一种基于污点分析的SQL注入行为检测模型\SQL注入\基于污点分析的SQL注入行为检测模型
针对传统机器学习方法在车辆检测应用中易受光照、目标尺度和图像质量等因素影响, 效率低下且泛化能力较差的问题, 提出一种基于改进的较快的基于区域卷积神经网络 (R-CNN) 模型的车辆检测方法\效率低下且泛化能力较差\R-CNN
针对当前行人检测方法计算量大, 行人特征提取复杂, 检测结果易受复杂背景影响等问题, 提出一种改进的卷积神经网络 (convolutional neural network, CNN) 模型\ 检测结果易受复杂背景影响\CNN
为此, 提出一种结合迁移学习的深度神经网络异常检测方法, 用以提高标签样本数量不足情况下的异常检测性能\提高标签样本数量不足情况下的异常检测性能\深度神经网络
为了提高行驶车辆检测与追踪的准确性、时效性, 提出了一个基于熵值法求权重的Adaboost和帧差法的混合检测模型\提高行驶车辆检测与追踪的准确性\基于熵值法求权重的Adaboost和帧差法的混合检测模型
为实现对渡船准确而快速的检测定位, 提出采用基于线性回归的方法, 根据对渡船进行初定位所得检测框与真实框 (ground truth) 之间的偏置信息进行回归训练, 进一步调整检测框的位置, 实现精确定位;另一方面利用上下文帧间信息, 采用序列NMS重打分步骤进行置信度分数调整, 减少错漏检问题\对渡船准确而快速的检测定位\线性回归
为了提高普适健康监测服务的病人护理质量, 采用贝叶斯网络对心脏病数据进行及时准确的分析, 提出从样本数据集中学习网络节点顺序的方法, 克服了传统算法需要领域专家给定网络中节点顺序的限制;另外, 引入了并行优化方法进一步提高在大数据量情况下建立心脏病诊断分析模型的速度\传统算法需要领域专家给定网络中节点顺序的限制\心脏病诊断分析模型
为了解决IP网络对业务流进行QoS路由选择时存在链路状态信息收集困难及算法复杂度较高等问题, 利用SDN网络控制器对网络集中控制的优势, 通过OpenFlow协议获取基础设施层的链路状态信息及SDN控制器提供集中式的QoS路由服务, 为业务流选择具有QoS约束的路由\IP网络对业务流进行QoS路由选择时存在链路状态信息收集困难及算法复杂度较高等问题\SDN控制器
针对BP神经网络隐含层节点数的确定问题, 提出一种“三分法”算法, 用于快速确定BP神经网络的隐含层节点数的最优解\BP神经网络隐含层节点数的确定问题\BP神经网络
针对虚拟集群节点的可用性评价, 提出了一种基于状态转移图的虚拟集群节点可用性模型\针对虚拟集群节点的可用性评价\基于状态转移图的虚拟集群节点可用性模型
针对IPv6恢复端到端通信, IPv6节点易被攻击者探测攻击等问题, 提出一种基于滑动时间窗口的IPv6地址跳变 (AHSTW) 主动防御模型\IPv6恢复端到端通信, IPv6节点易被攻击者探测攻击等\基于滑动时间窗口的IPv6地址跳变 (AHSTW) 主动防御模型
针对谣言传播过程中出现感染节点移出系统的问题, 改进经典SIR谣言传播模型的归一化条件, 提出一种动态同质网络上的SIR谣言传播模型\谣言传播过程中出现感染节点移出系统的问题\动态同质网络上的SIR谣言传播模型
针对用最少的传感器节点覆盖感兴趣区域并确保传感器节点之间连通的最优化问题, 提出了基于线性规划的传感器节点布局模型\用最少的传感器节点覆盖感兴趣区域并确保传感器节点之间连通的最优化问题\基于线性规划的传感器节点布局模型
针对物联网无线服务系统通信中易遭受数据窃听、恶意行为攻击和用户平台隐私泄露问题, 提出了一个基于可信第三方的簇间节点安全链路模型\物联网无线服务系统通信中易遭受数据窃听、恶意行为攻击和用户平台隐私泄露问题\基于可信第三方的簇间节点安全链路模型
为更有效地提升图像的超分辨率 (SR) 效果, 提出了一种多阶段级联残差卷积神经网络模型\更有效地提升图像的超分辨率 (SR) 效果\多阶段级联残差卷积神经网络模型
全变差 (TV) 理论对图像降噪处理的效果不太理想, 同时为了克服边缘的过度平滑和抑制降噪后图像易产生的“模糊现象”和“块状效应”的问题, 在四阶导数对“阶梯效应”抑制优势的基础上, 提出了一种基于四阶微分全变差的图像去噪模型\全变差 (TV) 理论对图像降噪处理的效果不太理想\基于四阶微分全变差的图像去噪模型
针对Canny算法对较高密度椒盐噪声和双阈值选取方面存在的不足, 提出一种改进方法, 采用多尺度自适应各向异性扩散方程对图像进行平滑, 有效去除较高密度脉冲信号的同时又可以更好地保留边缘轮廓信息\Canny算法对较高密度椒盐噪声和双阈值选取方面存在的不足\多尺度自适应各向异性扩散方程
为对航拍图像下的行人进行检测, 提出一种改进的卷积神经网络模型\对航拍图像下的行人进行检测\改进的卷积神经网络模型
在半诚实模型下, 直线与二次曲线位置关系的安全判定是一个尚未得到完全解决的问题\直线与二次曲线位置关系的安全判定\半诚实模型
传统的协同过滤模型存在着矩阵稀疏问题, 基于内容的推荐又不能自动抽取深层特征, 且两种推荐手段很难直接融合在一起, 无法共同提升推荐系统的性能表现\基于内容的推荐又不能自动抽取深层特征\协同过滤模型
基于此问题本文提出了一种近邻用户影响力的数学模型, 综合考虑了近邻用户对于目标用户的影响\近邻用户对于目标用户的影响\数学模型
针对用户间影响力的复杂性, 本文利用Cloud-model模型从统计学意义上考虑用户评分的相似性并以此获取目标用户的近邻, 进而将目标用户近邻的影响力整合到矩阵分解算法中\用户间影响力\Cloud-model模型
对定位出的候选车牌区域进行训练和SVM模型判断, 确定出符合车牌的区域\符合车牌的区域\SVM模型
同时对车牌进行字符分割后, 使用单独为车牌汉字训练的ANN模型进行字符识别\字符识别\ANN模型
该模型适用于大规模知识图谱的表示学习任务\表示学习任务\知识图谱
近年来, LDA (Latent Dirichlet Allocation) 主题模型通过挖掘文本的潜在语义主题进行文本表示, 为短文本的相似度计算提供了新思路\短文本的相似度\ LDA (Latent Dirichlet Allocation) 主题模型
为了提高表情识别率并降低表情识别的功耗, 提出一种基于改进深度残差网络的表情识别方法\表情识别率\改进深度残差网络的表情识别方法
为解决传统的计算机辅助诊断系统中肺结节特征提取过程复杂的问题, 提出一种基于深度信念网络的肺结节良恶性分类方法\肺结节特征提取过程复杂的问题\基于深度信念网络的肺结节良恶性分类方法
为解决在样本有限的情况下高光谱图像分类精度不高的问题, 提出一种基于卷积神经网络的高光谱遥感图像分类方法\高光谱图像分类精度不高的问题\卷积神经网络的高光谱遥感图像分类方法
通过文本检索和图像检索两组多媒体信息检索实验进行对比, 对比结果表明, 有监督词袋模型比经典词袋模型的检索精确度高、检索耗时少\图像检索\经典词袋模型
针对现有动态通行能力的评估未考虑管制员认知负荷的不足, 为了提高空中交通流量管理的准确性, 构建了基于管制员认知负荷和改进蚁群算法的扇区动态通行能力评估模型\动态通行能力的评估未考虑管制员认知负荷的不足\于管制员认知负荷和改进蚁群算法的扇区动态通行能力评估模型
考虑异构无线网和成本约束下的移动设备能源消耗, 提出异构网络HTTP/2能量成本控制的多网视频流传输模型\异构无线网和成本约束下的移动设备能源消耗\异构网络HTTP/2能量成本控制的多网视频流传输模型
针对现有基于对数正态信道模型的定位方法在各向异性环境下定位精度不理想的问题, 提出一种具有环境自适应能力的移动节点定位模型, 在传统信道模型中引入障碍物建模参数, 通过新的模型表达解决无线网络各向异性环境中的节点定位问题\无线网络各向异性环境中的节点定位问题\传统信道模型
针对深空长时延、高误码率等通信特点, 在传输过程中引入反馈信道, 研究了在深空中继协作通信模型中如何有效地利用有限的反馈信号, 提出了基于反馈式多级喷泉码的深空中继协作传输协议\高误码率\深空中继协作通信模型
LDA (latent Dirichlet allocation) 模型是一种应用非常广泛且很成熟的主题模型, 也是一个概率生成模型, 可以很好地解决多词一义和一词多义的问题\一词多义\概率生成模型
为解决OLDA模型挖掘大规模文档主题时计算效率低下和不能发现新主题的问题, 提出一种分布式的DOLDA模型 (distribute online LDA, DOLDA) \不能发现新主题\分布式的DOLDA模型
深度模型尽管性能强大, 然而由于参数数量庞大、存储和计算代价高, 依然难以部署在受限的硬件平台上 (如移动设备) \难以部署在受限的硬件平台上 \深度模型
为了克服现有信任模型中对信任的动态性刻画不足的问题, 提出一种基于认知计算的主观信任模型\动态性刻画不足\基于认知计算的主观信任模型
针对软件定义网络 (SDN) 中单一控制器容易发生过载的问题, 提出了一种基于博弈论的主控制器重选机制——博弈系统模型 (GAME-SM) \单一控制器容易发生过\博弈系统模型 (GAME-SM)
现有系统主要处理海量空间数据下订阅与事件的查询匹配问题, 其匹配模型主要是基于空间关键字之间的相似性, 鲜有研究考虑语义相关性\鲜有研究考虑语义相关性\匹配模型
为了解决在透明计算环境下, 现有虚拟磁盘镜像存储存在多用户虚拟磁盘数据冗余过度的问题, 基于写时重定向 (redirect-on-write, ROW) 思想设计了一种树状虚拟磁盘存储模型 (tree virtual disk storage model, TVDSM) \数据冗余过度\TVDSM
针对移动社交平台忽略网络状态、频繁刷新内容 (文字、图片、视频等) 造成的高能耗以及运算能力问题, 提出一种边缘计算模式下基于Markov决策过程 (Markov decision process, MDP) 的能耗优化模型\运算能力问题\能耗优化模型
在现有研究的基础上, 针对复杂软件UML模型场景消息粒度过大导致构建的Markov链使用模型描述软件的真实度不够的问题, 提出了一种基于多层嵌套组合片段UML模型的Markov链使用模型的构建方法, 最后结合实例对研究提出的模型构建方法做出应用分析, 说明了算法的可行性, 为更有效地构建Markov链使用模型提供了指导\真实度不够\Markov链使用模型
近年来, SAT求解器发展十分迅速, 且已被应用于求解基于模型诊断问题并取得了显著成果\基于模型诊断问题\ SAT求解器
传统的电力线通信和可见光通信融合信道的分析模型没有对融合系统的信道模型参数进行确定, 因此模型只能定性地描述融合信道的一般特性\定性\分析模型
同时, 传统文本表示模型存在高维的问题\高维的问题\传统文本表示模型
为了有效解决海量非规范的错误日志的聚类问题, 本文提出互联网软件错误日志聚类方法\解决海量非规范的错误日志的聚类问题\互联网软件错误日志聚类方法
密度峰聚类是一种基于密度的高效聚类方法, 但存在对全局参数dc敏感和需要人工干预决策图进行聚类中心选择的缺陷\存在对全局参数dc敏感和需要人工干预决策图进行聚类中心选择的缺陷\密度峰聚类
在聚类过程中, 针对传统的短文本向量空间模型语义信息匮乏、特征项稀疏的问题, 结合神经网络训练的词向量模型, 构建了一种基于多特征组合的短文本表示模型\传统的短文本向量空间模型语义信息匮乏、特征项稀疏的问题\多特征组合的短文本表示模型
由于轨迹数据流固有的海量、高速、偏态分布、时变进化且存在概念漂移的特性以及在线聚类的严格时空开销需求, 基于静态轨迹数据的聚类方法不能直接应用于分布式轨迹流的在线聚类分析\不能直接应用于分布式轨迹流的在线聚类分析\基于静态轨迹数据的聚类方法
针对强化模糊规则模型抗噪性能较差的问题, 提出了基于中智模糊聚类的强化模糊规则 (reinforced rule-based fuzzy model based on neutrosophic C-means clustering, NCM-RRbF) 模型\强化模糊规则模型抗噪性能较差的问题\中智模糊聚类的强化模糊规则 (reinforced rule-based fuzzy model based on neutrosophic C-means clustering, NCM-RRbF) 模型
为了制定合理的集装箱码头泊位岸桥资源调度计划, 提高码头作业效率和客户满意度, 基于离散泊位布局, 建立了以在港集装箱船总的服务成本最小为优化目标的动态泊位岸桥协调调度模型\提高码头作业效率和客户满意度\动态泊位岸桥协调调度模型
为解决基于云计算的体域网中, 数据量、通信带宽和传感器节点能耗之间的相互冲突问题, 提出进化多目标合作博弈解决方案\相互冲突问题\多目标合作博弈解决方案
针对如何选取稠密矩阵分块并行算法的关键分块参数这一问题, 建立性能优化模型\如何选取稠密矩阵分块并行算法的关键分块参数\性能优化模型
实验结果表明, 利用改进BP神经网络能够有效实现摩阻因数的准确预测, 解决了钻井过程中普遍存在的摩阻因数个体差异问题\摩阻因数个体差异\改进BP神经网络
在第二级模型中, 针对用户画像这样的多标签预测任务, 使用XGBTree模型及Stacking多模型相融合的方法提取出用户各标签属性之间的关联信息, 使得平均预测准确率进一步提高了2%左右\用户画像这样的多标签预测任务\Stacking多模型
首先, 由于数据库系统的复杂性和计算机资源的竞争, 很难精确地估计不同操作的开销;其次, 现有的研究大多没有真正预测查询的执行时间, 而是预测了类似查询优化器中开销模型生成的开销;由于查询计划结构的复杂性, 现有研究更多地使用了笼统的查询信息, 而很少利用查询计划中操作层面的信息, 并依据这些信息来获得开销模型\计算机资源的竞争\开销模型
针对出租车空载率高、司机寻客难的问题, 提出泊松-卡尔曼组合预测模型 (PKCPM) \司机寻客难\PKCPM
使用传统的BP神经网络进行预测容易发生收敛速度慢、预测精度低、陷入局部最优的可能\陷入局部最优\BP神经网络
针对传统预测模型中累积误差造成的预测精度低和算法复杂度等问题, 提出了一种基于长短时记忆神经网络 (LSTM) 和动态贝叶斯网络 (DBN) 的时间序列预测模型, 研究并证明了一种最优估计理论, 并在此基础上得到了最优的预测估计\预测精度低\基于长短时记忆神经网络 (LSTM) 和动态贝叶斯网络 (DBN) 的时间序列预测模型
为了解决生物实验试验周期长、实验数据难以利用的问题, 利用桑黄生物实验所得到的数据, 包括接种量、PH值、初始液量、温度、种龄、发酵时间和转速等参数, 利用数据挖掘的方法, 建立高产、低产的分类模型对数据进行分类\实验数据难以利用\高产、低产的分类模型
