基于KVM的原型系统实验结果表明:与现有LVS系统相比, HVLB极大地提升了数据包处理与转发性能, 并实现了64字节UDP数据包的线速转发\HVLB\LVS系统
为验证NFVNTP原型系统的有效性, 该文给出基于NFVNTP的两个试验例子:一个试验用于对工作在海空环境中的某待测网络设备进行了兼容性测试, 在该虚拟海空环境中包括了窄带数据链和同步通信卫星信道;另一个试验对两个软件定义网络 (SDN) 经广域网互连进行了性能测评, 一个实际的SDN网络中的视频能够通过NFVNTP传输到另一个实际的SDN中\软件定义网络 (SDN) \NFVNTP原型系统
对此, 在充分理解智慧园区数据分析系统功能需求、性能需求的基础上, 结合当前比较主流的数据分析方面的技术, 提出了Kettle+Hive+Tableau的智慧园区数据分析解决方案\Kettle+Hive+Tableau\智慧园区数据分析系统
分析了对象存储系统存储管理溯源信息的优势, 研究并实现了如何利用对象存储系统架构来收集和存储溯源\对象存储系统架构\对象存储系统
研究成果对异构计算系统Linpack的性能优化以及未来高效异构架构的设计具有一定的指导意义\高效异构架构\异构计算系统
提出完整的现代城市智慧照明控制系统解决方案, 从终端层、感知层、硬件层、通信层、控制层和应用层6个层次分析城市智慧照明的系统架构, 在此基础上研发一套分布式远程城市智慧照明控制系统\城市智慧照明的系统架构\分布式远程城市智慧照明控制系统
最终, 实现了支持JVM环境的高性能缓存系统U2cache\U2cache\高性能缓存系统
因此, 实现基于REST服务架构的Web系统前, 需要对该系统设计是否满足REST服务架构标准特征进行验证, 以提升基于REST服务架构的Web系统的研发质量\REST服务架构\Web系统
