仿真结果表明, 所提V1细胞模型能够基本拟合生物数据, 具有生物上的普适性;与传统的边缘检测算子相比, 该模型的性能更优, 鲁棒性更强\边缘检测算子\普适性\鲁棒性
实验结果表明, 经过线性回归与序列NMS重打分后的检测结果在保证实时性的基础上, 提高了检测的准确率\线性回归\实时性\准确率
针对传统泰语统计分词方法特征模板复杂、搜索空间大的问题, 提出融合上下文字符信息的泰语神经网络分词模型\融合上下文字符信息的泰语神经网络分词模型\泰语统计分词方法特征\搜索空间
在命名实体识别模型中融入了词法特征、词缀特征、词长特征等, 提高了模型的识别能力\命名实体识别模型\词长特征\识别能力
实验结果表明, 所构建的记忆力模型不仅准确率高达91.64%, 且具有良好的鲁棒性\记忆力模型\鲁棒性\准确率
为此, 首先分析语音帧的时序性特点, 以相对熵的形式定义了基于贝叶斯网络模型的隐写安全性\贝叶斯网络模型\隐写安全性\相对熵
超分辨率重建实验从主观评价和客观指标上验证了提出方法的有效性\超分辨率重建\有效性\客观指标
仿真实验表明, 自适应磷虾群优化Elman神经网络既保证了一定的收敛速度, 又能够使寻优精度得到明显提升, 其对测试集的预测结果优于传统Elman神经网络和基本磷虾群优化Elman神经网络, 从而验证了算法模型在目标威胁评估中的可行性、有效性\基本磷虾群优化Elman神经网络\有效性\收敛速度
