对比一些基于FPGA设计的卷积计算算法, 算法的计算器件的平均性能是它们的1\基于FPGA设计的卷积计算算法\平均性能
实验结果证明:op CD-k算法在保证语音识别正确率的前提下, 可以显著提升DBN模型的训练速度\DBN模型\训练速度
仿真结果表明, 在低信噪比 (SNR) 情况下, 与SAMP算法相比, 信道估计精度均有提高, 特别是信噪比在010 d B时, 其估计精度提升4 d B, 算法的运行时间减少约61%\SAMP算法\算法的运行时间
实验结果表明, 在非平稳噪声和低信噪比 (小于0 d B) 条件下, 该算法较好地削弱了噪声的变化对算法性能的影响, 不仅有较高的信源失真率 (SDR) , 提高了11.5个数量级, 而且运算速度也有一定程度的提高, 使得基于非负矩阵分解的语音增强算法更实用\语音增强算法\信源失真率
但是, 用现有的图分割算法处理非均衡图数据会造成各个子图之间通信量不均衡, 从而影响了计算效率\图分割算法\计算效率
为提高鲁棒性, 引入了一种基于L1范数度量的FLDA及其优化求解算法\基于L1范数度量的FLDA及其优化求解算法\鲁棒性
实验结果表明:在很多情形下, 相比于传统的L2范数FLDA, L1范数FLDA具有更好的分类精度和鲁棒性\L1范数FLDA\鲁棒性
首先推导了Lasso的对偶问题, 根据对偶问题的特性得出基于对偶多面投影的Screening加速技巧, 最后将Screening加速技巧引入Lasso特征选择算法, 并在多个高维数据集上进行实验, 通过加速比、识别率以及算法运行时间三个指标验证了Screening加速技巧在Lasso算法上的良好性能\Lasso算法\算法运行时间
该模型用L1范数来约束正反向重构误差, 通过利用加速逼近梯度 (APG) 算法求得正反稀疏系数矩阵, 根据目标正负模板集和候选模板集之间的距离度量得到权重矩阵\APG\距离度量
该算法在复杂环境视频序列下, 相比传统目标跟踪算法具有较高的鲁棒性\目标跟踪算法\鲁棒性
实验结果表明, 与传统DTW算法相比, 该算法在保证识别精度不变的前提下, 能大幅减少孤立词语音识别系统的计算开销, 有效提高孤立词语音识别系统的识别效率\DTW算法\识别精度
仿真实验结果 表明, 采用优化的稳定匹配算法来初始化将部署容器时, 不仅SLA违规较低, 而且比FirstFit, MostFull以及Random算法分别约节能12.8%, 34.6%和30.87%, 其中使用欧氏距离作为稳定匹配算法偏好规则的节能效果最好\稳定匹配算法\欧氏距离
结合TF-IDF算法思想, 提出了特征频率、森林频率以及伪梯度提升决策树, 解决了梯度提升决策树随着迭代次数的增加, 错误数据被边缘化的问题\伪梯度提升决策树\森林频率
为此, 文中提出了MPDG (Mining distinguishing sequence Patterns based on Density and Gap constraint) 算法, 该算法应用网树结构挖掘满足密度约束和间隙约束的对比模式, 在仅需扫描一遍序列库的情况下, 该算法可计算当前模式的所有超模式的支持度, 从而提高挖掘效率\Mining distinguishing sequence Patterns based on Density and Gap constraint\支持度
基于核范数的矩阵回归方法 (Nuclear norm based Matrix Regression, NMR) 对人脸图像中因遮挡和光照变化等噪声引发的误差具有很强的鲁棒性\NMR\鲁棒性
最后, 在不同网络条件下实验验证了启发式算法的性能, 并且在模拟网络环境中所提可生存SFC映射方法能保证SFC的成功运行率在59\可生存SFC映射方法\成功运行率
采用SPEC2006、Graph500、CFD算法测试数据进行测试, 压缩后的网络包数据量平均减少32.8%48.7%\CFD算法\网络包数据量
选取均方根误差作为性能评价指标, 将该方法和具有代表性的两种算法, 即传统的最小二乘法和经典的Chan算法进行了比较, 利用实测的五组场景下的总计6 000组定位数据进行了训练与验证\Chan算法\均方根误差
传统的Apriori算法通过支持度阈值和置信度阈值的筛选来挖掘强关联规则, 所挖掘出来的强关联规则并不都是有趣的, 也忽略了负关联规则的挖掘, 失去了负关联规则在决策分析中的重要作用\Apriori算法\置信度阈值
结果显示, 以提出的兴趣度度量为基础进行正负关联规则的挖掘是可行的, 其结果比经典的Apriori算法挖掘方法更实用更有效\Apriori算法\兴趣度度量
仿真结果及性能分析表明, 相比于基于完全频谱感知的资源分配算法, 所提算法对MU造成的干扰更小, 并且获得了更优的吞吐量性能\资源分配算法\吞吐量性能
针对5种常见的数字调制信号进行仿真分析, 结果表明, 在SNR=0dB的信噪比条件下, 基于ST-RFT算法的数字调制信号识别方法的平均识别率可以达到90%, 比基于谱图时频分析法的识别率提高了10.4%;特别是相比于基于瞬时幅度和瞬时频率的特征方法, 4FSK调制信号的识别率可提高9%\基于谱图时频分析法\识别率
通过改进排序算法、基于Multi-stream隐藏通讯时间、解耦数据依赖并实现细粒度并行等优化方法, CUDA版本的VaR计算性能比优化后的CPU单核性能提升了42.6倍, 为快速计算超大数量债券的VaR提供了有效的解决方案\排序算法\计算性能
为了提高分析的准确性, 将第三方SDK的demo应用作为分析对象, 并使用了在分析Android应用中有效的分析方法 (例如静态污点追踪、动态污点追踪、动态二进制插桩等) 和分析工具 (例如flowdroid、droidbox等) \动态二进制插桩\准确性
通过采用多种负载对该方法进行验证实验, 实验结果表明IRR-FTL相比DFTL缓存命中率提高29\DFTL\缓存命中率
实验结果表明, 在20台普通PC机搭建的内存云集群中, 实施数据存储优化策略的系统比原系统在存储处理数据时提高了0.5%, 此外, 提出的数据存储优化策略在不影响系统性能的前提下, 还有效节约了系统在存储处理数据时的内存空间, 并且提高了存储效率\数据存储优化策略\内存空间
仿真结果表明, 相比其他现有的缓存方案, Adaptive缓存放置策略配合改进的E-COOP缓存发现策略, 在查询延迟、能量损耗、数据吞吐量等方面具有显著优势\E-COOP缓存发现策略\数据吞吐量
为了提高云环境下任务的执行效率、降低执行费用, 提出了一种基于相关性的并行任务调度策略\并行任务调度策略\执行费用
实验表明, MAO-DRLS策略能够有效地提升数据副本的利用率, 缩短系统的响应时间\MAO-DRLS策略\响应时间
针对立体视频单个视点中的整帧丢失问题, 提出基于平面运动视差不变性的差错隐藏方案\差错隐藏方案\整帧丢失
通过国产及商用多环境实验, 加速比分别是3.6和5.9, 验证了PIDW算法的性能提升能力\PIDW算法\加速比
通过图像分割实验显示, 本文提出的方法 AGCT＿acc与AGCT在不同数据集上最终生成的云概念参数几乎相同, 即分割效果很接近, 而AGCT＿acc的时间损耗却比AGCT减少很多\AGCT\时间损耗
在真实网络拓扑中进行了链路故障诊断仿真实验, 实验结果表明, 所提方法与现有的经典启发式算法——TOMO相比, 降低了5%30%的误诊率\TOMO\误诊率
仿真结果表明, 与基于生成矩阵满秩上下界计算方法相比较, 基于概率转移函数方法对于均匀度分布码字的性能衡量最大误差降低到0.012 4, 一般码字计算复杂度降低到O (k2) \基于概率转移函数方法\复杂度
首先将输入信号通过部分匹配滤波器进行处理, 当本地伪码和输入信号伪码相位对齐时, 输出信号仅剩下了残余多普勒频偏;然后将该信号进行级联随机共振, 从而提高信号的输入信噪比;最后通过快速傅里叶变换 (FFT) 谱分析, 可以在频谱上得到清晰的谱峰, 进而求出多普勒频偏值\FFT\信噪比
在KDD CUP99数据集上, 对所提算法进行入侵检测仿真, 实验结果证明该算法检测率高, 误检率低, 能够有效提高入侵检测的准确率\KDD CUP99数据集\误检率
具体来讲, 该算法在运算大规模数据时精度优于k均值算法, 并且在保证精度的情况下运行速度远快于基于图松弛优化聚类算法\图松弛优化聚类算法\运行速度
实验结果表明, 与局部敏感哈希、谱哈希等哈希算法相比, 本文算法在准确性和效率上均具有一定的优势\谱哈希\效率
根据DBSCAN算法中的密度参数, 保留各子簇的边界特征样本, 使子簇合并过程的计算效率进一步提高\DBSCAN算法\计算效率
实验结果表明, 相较于一般的K均值聚类算法, 全局K均值聚类算法得到了更好的聚类效果, 同时提升了算法的稳定性\全局K均值聚类算法\稳定性
针对近邻传播算法的偏向参数以及聚类类数对聚类结果准确性的影响\近邻传播算法\准确性
实验结果表明:相对于传统的改进K-medoids算法, IKmedoids算法在有效缩短分类时间的同时保证了聚类准确率, 为进一步分析飞行过程中的燃油消耗提供了新视角\IKmedoids算法\准确率
首先, 定义了Cell网格概念, 并提出了基于Cell的距离分析理论, 利用该距离分析, 无需距离计算, 可快速确定高密度区域的核心点和密度相连关系;其次, 给出了网格簇定义, 将基于位置点的密度簇映射成基于网格的密度簇, 利用排他网格与相邻网格的密度关系, 可快速确定网格簇的包含网格;第三, 利用基于Cell的距离分析理论和网格簇概念, 实现了一个快速密度聚类算法, 将DBSCAN基于数据点的密度扩展聚类转换成基于Cell的密度扩展聚类, 极大地减少高密度区域的距离计算, 利用位置数据的内在特性提高了聚类效率;最后, 在基准测试数据上验证了所提算法的聚类效果, 在位置大数据上的实验结果统计显示, 与DBSCAN、PR-Tree索引和Grid索引优化的DBSCAN相比, CBSCAN分别平均提升了525倍、30倍和11倍效率\ CBSCAN\聚类效果
在此基础上, 以减少通信开销提高分布式轨迹流聚类效率为目标, 提出了一个在线处理分布式轨迹数据流的增量聚类算法 (OCluDTS) \在线处理分布式轨迹数据流的增量聚类算法\分布式轨迹流聚类效率
此外, 为了进一步降低OCluDTS算法的总执行开销, 提出了仅限于聚类更新的远程节点传输聚类结果给协调者节点以及基于协调者节点相似性计算的剪枝策略等优化措施\OCluDTS算法\执行开销
实验结果表明RWNAMOA*dr算法比NAMOA*dr算法的运行时间平均减少了50.69%, 占用的空间平均减少了约10%, 能够为现实生活中加速多目标路径搜索提供理论支撑\NAMOA*dr算法\占用的空间
针对确定性算法难于求解的各项的重量系数和价值系数在大范围内取值的折扣{0-1}背包问题 (D{0-1}KP) , 提出了基于差分演化策略的混沌乌鸦算法 (DECCSA) \DECCSA\价值系数
首先, 采用混沌映射生成初始乌鸦种群;然后, 采用混合编码方式和贪心修复与优化策略 (GROS) 解决了D{0-1}KP的编码问题;最后, 引入差分演化策略提高算法的收敛速度\差分演化策略\收敛速度
对4类大规模D{0-1}KP实例的计算结果表明:DECCSA比遗传算法、细菌觅食算法和变异蝙蝠算法求得的最好值和平均值更优, 能得到最优解或更好的近似解, 非常适于求解D{0-1}KP\变异蝙蝠算法\平均值
该方法通过遗传算法寻优获取几组较优解, 经过计算后作为二进制蚁群算法的初始启发式信息, 利用二进制蚁群算法的全局搜索获取最优解;另一方面, 为充分利用影像的光谱与空间信息, 将波段组合的光谱特征与改进二进制蚁群算法选择的纹理特征融合进行分类, 可以获得更高的分类精度\二进制蚁群算法\分类精度
实验结果表明, 改进二进制蚁群算法与遗传算法、蚁群算法、二进制蚁群算法相比全局搜索能力更强, 且该方法分类精度达到95.63%\二进制蚁群算法\分类精度
采用拥挤距离评价非劣解的优劣, 保留了优秀个体, 并通过精英选择策略, 将非劣解作为遗传操作的个体, 引导算法向最优方向收敛\精英选择策略\拥挤距离
最后在MATLAB环境中, 用实际网络数据进行对比实验验证, 结果表明, 改进的CCN算法在社团划分效率和Q值结果上有更理想的效果\改进的CCN算法\Q值
DPACO算法通过改变参数在不同阶段的值来使算法获得更快的收敛效率, 加入特殊蚂蚁使得算法更好地跳出局部最优解获得全局最优解\DPACO算法\收敛效率
最后通过钢铁锻造任务的云制造资源优选将DPACO算法与原始ACO、PSO、DE算法作比较, 实验结果表明, DPACO算法在求解云制造服务组合问题上能够更好地获得全局最优解, 并具有较高的收敛效率\DPACO算法\收敛效率
但是, 在面对计算机围棋这种复杂的决策过程时, 简单的蒙特卡洛树搜索过程往往由于计算量大, 收敛速度非常慢\蒙特卡洛树搜索\计算量
实验结果说明, 所提算法显著改进了蒙特卡洛树搜索的准确性和效率\蒙特卡洛树搜索\效率
在有向切换网络是周期强连通的且对应的邻接矩阵是随机的而非双随机的条件下, 利用非二次李雅普诺夫函数方法证明了所提多个体分布式次梯度优化算法的收敛性\多个体分布式次梯度优化算法\收敛性
首先, 考虑货物重量、出入库频率和出入库时间等因素, 以货架重心低、出入库频率高、货物离出入库口近等为原则建立货位分配优化模型;然后, 提出一种精英多策略差分进化算法, 通过提取部分精英个体的信息指导变异, 并根据精英个体的拥挤度变化对不同的阶段使用不同的策略, 从而产生高质量的解, 同时加快算法的收敛速度;最后, 通过10个经典测试函数验证了所提算法的有效性, 并基于该方法对某智能制造企业的成品库进行了优化, 得到了满意的货位分配方案\精英多策略差分进化算法\有效性
鸡群优化算法 (Chicken Swarm Optimization, CSO) 是一个全新的群智能优化算法, 简单且具有良好的扩展性\群智能优化算法\扩展性
仿真实验结果表明, 在解决高维问题时, 改进的鸡群优化算法避免了陷入局部极值, 提高了收敛精度, 在DTI-FA图像配准中提高了图像的配准精确度\改进的鸡群优化算法\配准精确度
为提高算法在优质区域的开采能力和算法的收敛速度, 提出一种基于最优解集距离的改进JADE算法 (db-JADE) \基于最优解集距离的改进JADE算法\收敛速度
根据目标个体与最优解集中的最优个体距离确定参与变异的最优粒子概率, 增强对已探测的多个最优区域的勘探能力;采用线性减少的可变规模种群策略, 增强算法前期的全局开采能力和后期的局部探测能力\可变规模种群策略\局部探测能力
借鉴混合蛙跳算法 (SFLA) 的进化机制, 将蜂群划分为多个模因组, 使每个新个体与自身所在模因组的最坏个体进行优劣比较, 能够更加容易保存群体中的“新生”个体, 改善群体的整体质量, 增加算法的深度搜索能力\SFLA\深度搜索能力
通过7个测试函数进行实验, 统计结果表明了SABC算法在求解函数优化问题时具有较好的算法性能\SABC算法\算法性能
首先使用SFM从输入图像中提取稀疏种子点;然后直接在固定的世界坐标系中从所有种子点出发向其邻近三维空间扩展, 得到生长点的初始位置和方向, 并通过优化确定生长点的最终位置和方向, 在优化前和优化中根据生长点的当前位置和方向不断选取和更换最佳主、副图, 提高优化质量;再利用邻域已重建点云有条件地矫正生长点的位置和方向, 并以此作为初值再次优化, 避免优化收敛到局部极值, 提高生长点的重建精度;最后设计光滑、深度和方向三方面的自适应一致性滤波, 在减少误删的同时及时删除误差点, 防止误差蔓延\SFM\重建精度
实验结果表明, 文中算法的重建精度和完整度均明显超过当前流行的PMVS算法;与高精度DAISY算法相比, 在完整度大大提高的前提下, 该算法的精度与其基本持平\高精度DAISY算法\精度
基于非支配排序的多目标优化算法 (NSGA-II) 由于其优异的鲁棒性在过去的十年里已经成为了一种非常受欢迎的多目标优化算法\基于非支配排序的多目标优化算法\鲁棒性
例如, 非支配排序本身具有较高的时间复杂度;在处理高维多目标优化问题时, 传统的非支配排序会面临选择压力丧失的缺陷\非支配排序\时间复杂度
因此, 提出一种NSGA-II的改进算法, 先搜索优化问题的近似极值点, 然后通过极值点将目标空间进行划分, 空间划分后, 只对内部空间的解采用传统的非支配排序和拥挤度距离选择精英解, 以此来提升算法的收敛效率\非支配排序\拥挤度距离
鉴于全局搜索和单原子选择的逼近方式是导致图像稀疏分解贪婪算法复杂度高的主要原因, 对传统的匹配追踪 (MP) 算法进行改进, 提出基于局部字典搜索和多原子匹配追踪 (LMMP) 的逼近算法\逼近算法\复杂度
采用基于二维快速哈莱特变换的内积批量计算方法, 实验计算发现核原子在MP算法相邻代中的位序基本稳定, 最佳原子只需在排序靠前的原子组成的局部字典中搜索, 一次迭代搜索多个非相干原子, 进一步提高匹配追踪算法速度, 逐原子依次更新残差可减小逼近误差\基于二维快速哈莱特变换的内积批量计算方法\逼近误差
理论分析表明, LMMP算法是收敛的, 且时间复杂度比MP算法低数个数量级\MP算法\时间复杂度
从实验结果看出, LMMP算法与其他全局搜索算法相比, 在运算速度和逼近性能上有明显优势\全局搜索算法\逼近性能
在全局迭代过程中采取精英群自学习进化机制, 以对精英空间进行精细搜索, 获得更优解, 进一步提升算法的全局寻优能力, 正确导向算法的进化\精英群自学习进化机制\全局寻优能力
首先, 借鉴过滤法的思路, 通过计算互信息指标, 依据互信息最值过滤原则 (MIMVFC) 获得特征基因候选子集 (FGCS) , 缩小分类操作的范围, 提高特征基因被覆盖的概率;接着, 对粒子群优化 (PSO) 算法进行改进, 引入惯性权重实现自调节可变惯性权重粒子群优化 (IWPSO) 算法, 使得在算法迭代初期有着快速的全局优化能力, 而在算法后期具有较强的局部搜索能力;最后, 运用IWPSO从FGCS中提取核心信息基因子集 (CFGS) , 并基于CFGS对样本进行肿瘤与正常组织的分类\IWPSO\局部搜索能力
基于相同的FGCS, 与目前效果较好的二进制粒子群优化与防治基因算法 (BPSO-CGA) 相比, IWPSO的运算耗时有所增加, 但所获得的CFGS规模减小, 准确率提高;而与经典PSO相比, 所获得的CFGS规模减小、运算耗时减少、准确率提高\经典PSO\准确率
SLTLBO算法为学生构建了更加完善的学习框架, 学生在完成常规“教”阶段与“学”阶段的学习行为之外, 将进一步对比自己与教师、最差学生的差异, 自主完成多样化的学习操作, 以提高自己的知识水平, 提高算法的收敛精度;同时学生通过高斯搜索的自主学习反思行为跳出局部区域, 实现更好的全局搜索\SLTLBO算法\收敛精度
传统的人工蜂群算法 (Artificial Bee Colony algorithm, ABC) 及其在多目标上的扩展 (Multi Objective Artificial Bee Colony algorithm, MOABC) 存在着在高维、多峰函数情况下收敛速度变慢、后期容易陷入局部最优以及寻优精度丢失等问题\MOABC\收敛速度
首先通过改进量子粒子群算法优化的粗糙集对得到的特征向量进行属性约简, 然后经过改进量子粒子群算法优化支持向量机参数\改进量子粒子群算法\支持向量机参数
该算法引入免疫进化理论对野草种群中的最优个体进行免疫进化迭代计算, 并且充分利用最优个体引导不同野草个体进行局部搜索和全局搜索, 能够有效避免算法陷入局部极值, 并且以更高的精度逼近全局最优解\免疫进化理论\精度
首先, 根据问题建立相应的模型, 并将遗传算法运用到问题求解当中;然后, 通过添加算子调节等操作来改进遗传算法, 增加了算法的适用范围, 加快了算法的收敛速度, 提高了算法的效率;最后, 将算法应用于实际生活当中, 并与传统的遗传算法进行对比\遗传算法\效率
实验结果表明, 提出的EIW-PSO算法具有更快的收敛速度和更高的求解精度\PSO算法\解精度
通过对11个标准函数进行仿真实验, 并与标准粒子群和其他改进算法进行对比, 结果表明, 基于健康度的自适应过滤粒子群算法寻优精度高, 收敛速度快\基于健康度的自适应过滤粒子群算法\ 收敛速度
为了改进算法的搜索效率, 还提出了改进的有限圆族法, 用于装填物之间的干涉性判断和干涉量计算\改进的有限圆族法\搜索效率
本文首次将自适应差分进化算法用于软件测试数据的产生, 并与传统软件测试数据产生的算法进行了比较, 实验表明本文算法能够有效地提高自动产生测试数据的效率和性能\传统软件测试数据产生的算法\性能
遗传算法求解多峰函数极值需进行反复多次的迭代运算, 面对大数据样本时会出现运算效率过低的现象, 这极大地限制了遗传算法的实际应用\遗传算法\运算效率
首先, 根据均匀设计理论建立局部搜索算子, 对FA的搜索过程进行改进, 以提升算法的局部开采能力和收敛速度;其次, 利用可变步长策略, 动态地调整算法搜索步长, 以平衡全局和局部的勘探能力和开采能力;最后将均匀局部搜索算子和可变步长进行融合\可变步长策略\开采能力
通过对12个标准测试函数进行仿真实验, 结果表明, UVFA的目标函数均值均明显优于FA、明智步长策略的萤火虫算法 (WSSFA) 、可变步长萤火虫算法 (VSSFA) 和基于均匀局部搜索的萤火虫优化算法 (UFA) , 并且时间复杂度明显降低, 并且在低维和高维问题中均显示出了较好的质量, 具有良好的鲁棒性\UFA\鲁棒性
首先, 运用边收缩方法的启发式策略生成高质量的初始解, 并将其作为种子植入到初始种群中;然后, 利用IGA对模型进行求解, 在提升搜索效率的同时进一步提高解的质量;最后, 运用真实数据和仿真数据进行对比实验\IGA\解的质量
为飞蛾捕焰引入纵横交叉机制和混沌算子, 通过横向全方位交叉寻优减少搜索盲点, 纵向维交叉开发和混沌映射增强跳出局部最优的能力, 火焰信息在种群中纵横交叉呈链式反应传播, 加快收敛速度和避免算法早熟\混沌算子\收敛速度
该算法通过引入模拟退火操作进一步优化参考集中的解, 以提高获得全局最优解的概率\模拟退火\获得全局最优解的概率
通过选择、交叉和变异操作, 实现目标函数的最小化, 大大缩减了车辆行驶距离, 优化了配送路线, 并根据数学模型利用实验数据进行仿真实验, 结果表明混合遗传算法相对于原有的遗传算法提高了全局寻优能力和算法的收敛速度\遗传算法\算法的收敛速度
该算法采用自适应权重法改进了粒子群优化算法, 相较于标准粒子群优化及遗传等传统启发式算法有更快的收敛速度;并采用GPU加速, 实现了高性能的并行计算, 大幅加快了计算速度\传统启发式算法\计算速度
在设计算法中, 引入精英保留机制, 提高收敛速度;引入Levy飞行算子, 避免陷入局部次优\Levy飞行算子\收敛速度
基于虚拟力的无线传感器网络覆盖算法易陷入局部最优, 导致覆盖率低、收敛速度慢\基于虚拟力的无线传感器网络覆盖算法\收敛速度
通过虚拟力方案尽可能分散节点, 提高监测区域的覆盖率, 采用集合划分泰森多边形方案和Minmax算法减少虚拟力末端中覆盖率下降的情况, 使用质心算法提高虚拟力算法的收敛速度\质心算法\覆盖率
相比基于虚拟力的网络覆盖算法, VFVP算法提高了5%左右的覆盖率\VFVP算法\覆盖率
采用基于排列的编码策略, 设计两种局部搜索策略, 提高算法求解性能\局部搜索策略\算法求解性能
实验结果相比自适应蚁群算法和混合遗传算法, 求解质量分别提高13\混合遗传算法\求解质量
实验结果表明, DACQPSO算法在覆盖率指标上比标准粒子群、量子粒子群、混沌量子粒子群算法分别提高了3.350 1%、2.650 2%和1.900 0%, 有效地提高了WSN的覆盖性能\混沌量子粒子群算法\覆盖率指标
仿真实验结果表明, 提出的改进算法在收敛速度和寻优精度上较基本FOA及其几种改进算法有更好的寻优性能\基本FOA\寻优性能
基于分枝限界的完备算法通过定义上下界及剪枝操作, 有效地降低了算法的计算复杂度\基于分枝限界的完备算法\计算复杂度
实验结果表明, 野草猴群算法的求解精度较简易猴群算法有大幅提高\简易猴群算法\求解精度
