该算法将种群分为精英和普通两个子群:普通子群采用传统分子动理论优化算法搜索策略进行大范围搜索, 而精英子群则通过协同合作实现精细化搜索, 以提高算法收敛精度;基于个体迁移实现子群间的信息交流, 两个子群通过分工合作共同完成搜索过程\传统分子动理论优化算法\收敛精度
然后对两条改进策略进行了可行性分析, 提出了带观察策略的多目标灰狼算法并进行了算法复杂度分析\带观察策略的多目标灰狼算法\算法复杂度
为了验证该算法的性能, 选择几个高维的经典函数进行实验, 结果表明, 改进的新型蝙蝠算法同基本的蝙蝠算法和粒子群算法相比提高了寻优性能\粒子群算法\寻优性能
结果表明, MOEGA算法不仅可以满足工作流截止时间约束, 而且在降低任务执行跨度与执行代价的综合性能方面也优于其他算法\MOEGA算法\执行代价的综合性能
实验结果表明, UDEPSO算法在优化收敛精度和效率上具有较强的优势\UDEPSO算法\效率
实验结果表明, 双适应度动态遗传算法在耗时和耗能上都具有优异表现, 代价函数可以选出适应于不同调度问题的权值\双适应度动态遗传算法\耗能
使用随机概率变异算子提高算法的收敛速度, 使用随机性强的惯性权重因子提高搜索效率, 加入限幅滤波算法提高学习精度\限幅滤波算法\学习精度
本文通过设计基于特征树子树的新交叉算子, 使得交叉算子环节不再引入新的约束违反项, 实验表明这种方法能显著的提高最终解集的有效产品率, 在超体积指标和有效产品率指标间找到平衡\交叉算子\有效产品率指标
实验结果表明, 与几种经典的启发式算法相比, HMBBO算法具有寻优能力强、收敛速度快、求解质量高的特点, 为解决云计算环境中任务调度问题提供了一种新思路\HMBBO算法\求解质量
采用改进的遗传算法求解上述优化模型, 将某一分块参数组合 (种群个体) 所对应的稠密矩阵乘法的性能值作为该个体的适应度, 通过不断迭代地进行选择、交叉、变异操作, 找到最优的分块参数组合, 使得稠密矩阵运算的性能值最优\遗传算法\运算的性能值
数值实验表明, 基于遗传算法求解得出最优分块参数下的GEMM性能值优于默认分块参数下的性能值, 达到了优化的目的\遗传算法\GEMM性能值
新算法将果蝇种群均匀划分为多个子群, 并引入粒子群算法中的惯性权重和学习因子, 协同调节果蝇移动方向和步长;每隔一定迭代次数重新划分子群, 避免种群单一化, 使算法更易跳出局部最优;对子群最优个体进行SQP搜索, 提高局部寻优性能\粒子群算法\局部寻优性能
云计算的仿真实验结果表明, 与基本的ACO算法、SFLA、改进后的粒子群优化 (IPSO) 算法、改进的人工蜂群算法 (IABC) 相比, 所提算法在QoS的4个指标中有最少的完成时间、最低的消耗成本、最高的满意度和最低的异常数值, 表明所提算法能够有效地运用在云计算资源调度中\IABC\异常数值
其利用SVP算法快速收敛的特性, 提升了SP算法的收敛速度, 且能得到更优的解\SP算法\收敛速度
由实验数据可见, 与SSDM极小化策略相比, 其优点是缩减了求解空间和迭代求解次数, 尤其当求解规模较大问题时, 其极小化效率越高\SSDM极小化策略\极小化效率
实验结果表明, 对于一些较大的实例, 与目前效率最好的Boolean方法相比, SAT-MHS方法高效且易于实现, 求解速度能提高10～20倍, DOEC极小化策略对比传统SSDM极小化策略能达到40倍左右\传统SSDM极小化策略\求解速度
实验结果和分析结果表明, 这些策略均能提高收敛速率和搜索效率, 其中, 生长细胞到入侵细胞的转换策略和死亡细胞到入侵细胞转换策略在一定程度上减少了计算时间, 生长细胞的生长步长调整策略能强化D-ITGO的搜索效率\D-ITGO\搜索效率
为增强生物地理学优化 (Biogeography-based optimization, BBO) 算法的优化性能, 降低其运行时间, 提出了一种差分迁移和趋优变异的生物地理学优化算法 (DGBBO) \DGBBO\运行时间
首先, 将两种差分扰动操作与BBO算法的迁移操作有机融合, 形成差分迁移算子, 提升全局搜索能力并平衡探索和开采;其次, 将趋优操作融入到BBO算法的变异算子中, 替换原变异操作, 形成趋优变异算子, 克服了原变异算子存在的缺陷, 加快收敛速度;此外, 还从多个角度降低算法的计算复杂度\趋优变异算子\计算复杂度
其次, 在粒子学习过程中, 引入烟花爆炸机制, 加强种群粒子的搜索能力\烟花爆炸机制\搜索能力
同时, 引入粒子反向学习理论, 显著提高了服务组合全局寻优能力\粒子反向学习理论\全局寻优能力
首先, 根据标准帝国竞争算法 (ICA) 的流程特性, 设计了自适应参数的改进, 可提高算法的收敛速度;然后, 引入帝国和殖民地双改革变异, 并针对工序排序和选择机器的不同阶段提出多变异改革策略, 可提高算法的局部搜索效率;最后, 创建大陆间国家交流合作机制, 促进优秀国家对外信息交流, 可提高算法全局搜索能力\多变异改革策略\全局搜索能力
算例表明, 与粒子群优化 (PSO) 和两阶段启发式算法相比, 利用并列选择遗传算法进行计算, 目标函数中所有需求点的资源满足程度的方差分别减小了93.88%、89.88%, 成本分别减少了5%、0.15%\并列选择遗传算法\成本
最后, 通过对比实验从规划航路的质量和算法耗时两个角度将所提方法与A*算法、蚁群算法、粒子群航路规划方法进行对比\粒子群航路规划方法\算法耗时
对于优解, 利用全局搜索策略进行预处理, 这样能提高算法的收敛速度和收敛精度\全局搜索策略\收敛精度
对于劣解, 则利用随机搜索策略进行预处理, 这样能扩大搜索范围, 增强搜索能力\随机搜索策略\搜索能力
通过标准测试函数对所提算法进行测试, 结果表明改进策略能够有效提高连续域蚁群优化算法的收敛速度并改善解的质量\连续域蚁群优化算法\解的质量
为鲸鱼的觅食加入信息交流强化机制, 并在捕食引入正余混沌双弦机制, 通过正弦全局搜索减少寻优盲点, 余弦局部开发加快收敛速度, 以及混沌算子增强跳出局部最优的能力, 个体信息在种群中双弦混沌交叉快速传播\余弦局部开发\收敛速度
通过对测试函数结果验证表明, 改进的果蝇算法比FOA算法具有更高的搜索精度和更快的收敛速度\FOA算法\收敛速度
仿真实验结果表明, 与基本鸡群算法和粒子群算法等相比, 改进后的鸡群算法能有效提高算法的收敛精度和收敛速度\改进后的鸡群算法\收敛速度
大规模虚拟机放置是云计算中的一个关键问题, 好的虚拟机放置策略不仅可以提高数据中心的性能、资源利用率, 同时也可以减少数据中心的能耗与维护费用\虚拟机放置策略\性能
实验结果证明, 该放置策略可以使数据中心的能耗降低6%20%, 同时也可使通信的总流量与主干网流量降低5%30%\放置策略\主干网流量
实验结果表明, 与传统调度算法相比, 所提算法能够更快地达到全局收敛, 并得到更加稳定的寻优结果, 提高了寻优的质量和效率;同时, 该算法不仅减少了总任务时间开销, 而且使虚拟机的平均资源利用率稳定在99%以上, 负载也更加均衡\传统调度算法\平均资源利用率
为提高算法的运行效率, 采用狼群算法来搜索最优阈值, 每匹人工狼代表一个可行的二维阈值向量, 狼群通过游走、召唤、围攻这三种智能行为的不断迭代以及狼群间的信息交互来获取最佳阈值\狼群算法\运行效率
仿真结果表明, 与标准粒子群优化二维Otsu算法和传统二维Otsu算法相比, 狼群优化算法降低了分割时间并提高了图像分割精度\狼群优化算法\分割时间
与其它进化算法的对比实验结果表明, 本文的差分进化算法有效提高了benchmark函数的最优值精度, 加快了收敛速度\差分进化算法\收敛速度
为了验证HTPSO的性能, 与利用正弦函数改进惯性权重的粒子群优化算法 (Sin PSO) 、自适应粒子群优化算法 (Sel PSO) 、基于自适应惯性权重的均值粒子群优化算法 (MAWPSO) 和简化粒子群优化算法 (SPSO) 在不同维度下解决8个常用基准函数, 并根据T-test、成功率和平均迭代次数分析了各算法的优化结果\SPSO\平均迭代次数
实验结果表明, HTPSO具有较优秀的收敛能力, 且粒子运动非常灵活\HTPSO\收敛能力
为提高分布式在线优化算法的收敛速度, 对底层网络拓扑依次添边, 提出一种快速的一阶分布式在线对偶平均优化 (FODD) 算法\FODD\收敛速度
最后的数值仿真表明:和ODDA算法相比, 所提出的FODD算法具有更快的收敛速度\FODD算法\收敛速度
仿真结果表明, 与基于传统PSO算法的混合预编码方案相比, 所提改进方案在收敛速度与和速率上都得到优化;其收敛速度提高约100%, 且性能可以达到全数字预编码方案的90%, 因此, 该改进方案能够有效提升系统性能且加快收敛\基于传统PSO算法的混合预编码方案\性能
首先, 在每一次迭代中, 由当前点和前一个点的线性组合构成加速算子重新进行梯度估计, 更新迭代点;其次, 为了改变迭代步长固定的限制, 引入割线线性搜索, 动态确定每次最优迭代步长;最后, 将改进的迭代收缩阈值算法用于求解离焦深度恢复动态优化问题, 加快算法的收敛速度、提高微观3D形貌重建的精度\改进的迭代收缩阈值算法\微观3D形貌重建的精度
在对标准500 nm尺度栅格的深度信息重建实验中, 与ISTA、快速ISTA (FISTA) 和单调快速ISTA (MFISTA) 相比, FL-ISTA收敛速度均有所提升, 重建的深度信息值下降了10个百分点, 更接近标准500 nm栅格尺度;与ISTA相比, FL-ISTA重建的微观3D形貌均方差 (MSE) 和平均误差分别下降了18个百分点和40个百分点\ISTA\重建的深度信息值
通过4种科学工作流的仿真实验结果表明, CGAA算法得到的调度方案在满足工作流调度截止时间约束与降低任务执行代价的综合性能方面优于同类型算法\CGAA算法\执行代价
在算法的第一阶段, 集中计算资源搜索优化问题的极值点, 通过优先选择内部空间的解来提高基于支配算法的收敛性能\支配算法\收敛性能
水波优化算法 (Water Wave Optimization, WWO) 是受浅水波理论启发而提出的一种新兴群体智能算法, 其具有控制参数少、种群规模小、实现简单、计算开销小等优点, 但依然存在局部搜索能力不强、收敛速度较慢等缺陷\水波优化算法\收敛速度
以标准的SATLAB库中变量个数从20250的3 700个不同规模的标准Uniform Random-3-SAT问题对新的算法的性能进行了合理的测试, 并与高效和普通性能改进的GSAT算法的结果作了比较, 结果表明, 该算法具有更高的成功率和更少的翻转次数\GSAT算法\成功率
对此, 提出了一种混合测试用例自动生成算法, 将群体爬山算法思想混合并融入花朵授粉算法中, 保留了寻优精度高等优点, 同时提高了标准花朵授粉算法的脱困能力和运算效率\标准花朵授粉算法\运算效率
实验结果表明, 该算法在测试用例自动生成上精度较高, 同时在收敛速度和计算效率方面比标准花朵授粉算法、粒子群算法有较大提高\粒子群算法\计算效率
提出一种分散功率算法DPM, 用于分布式计算样本协方差矩阵的最大特征值, 通过将平均共识和迭代功率法相结合, 在相对少量样本和有限次数迭代的条件下, 实现了协方差矩阵最大特征值的较快收敛速度和较高精度估计\分散功率算法DPM\精度
对比MECD算法和DST算法, 仿真结果表明, 新算法有效减少了信号样本数和迭代次数, 收敛速度较快, 可获得更高的检测精度\DST算法\检测精度
仿真实验表明, CBCSA具有良好的全局寻优能力和收敛速度, 能快速求得最优解, 且混沌序列的第一映射方式比第二映射方式性能更佳\CBCSA\收敛速度
以系统能效作为优化目标, 利用遗传算法较强的随机搜索能力和优化性能对PBS发射功率进行优化, 改进遗传算法的交叉概率和变异概率, 避免较优解丢失的同时加快算法的收敛速度\ 改进遗传算法\收敛速度
实验选择6个典型的基准开源项目, 以语句、分支和方法作为程序实体, 实验结果表明佳点集遗传算法收敛速度快、稳定性好, 为回归测试提供了一个有效的测试用例优先排序方法, 有助于尽早发现软件缺陷, 降低测试成本\测试用例优先排序方法\稳定性
在蚁群算法迭代过程中, 引入细菌觅食算法的复制操作, 以加快算法的收敛速度;引入细菌觅食算法的趋向操作, 以增强算法的全局搜索能力\细菌觅食算法\全局搜索能力
为了利用改进的FWA优化粒子滤波, 改进了FWA烟花选择策略, 使得烟花选择策略的时间复杂度由O (N2) 降为O (N) \FWA烟花选择策略\时间复杂度
首先, MSW-SDCOA基于数据依赖关系压缩科学工作流, 减少任务节点数从而节省了调度开销;并通过改进HEFT (heterogeneous earliest-finish-time) 算法形成调度序列, 以实现全局多目标优化调度;最后, 通过优化ACO (ant colony optimization) 中信息素更新策略和启发式信息, 进一步改善费用优化效果\ACO\费用优化效果
实验结果表明, CERMW和CERLC&MW相对于先前的#SAT求解算法在求解效率和求解能力上都有显著的提高\#SAT求解算法\求解能力
在求解效率方面, CERMW和CERLC&MW的求解速度是其他算法的1\CERMW\求解效率
在求解能力方面, CERMW和CERLC&MW在限定时间内可解的测试用例更多\ CERMW\求解能力
借助自适应协方差矩阵进化策略的思想, 充分利用进化过程中累积的种群分布信息, 同时, 由于自适应协方差矩阵存在收敛早熟、易陷入局部最优的缺点, 先后对变异和交叉操作进行相应改进, 以平衡算法的全局搜索能力和局部搜索能力\自适应协方差矩阵进化策略\局部搜索能力
仿真实验结果表明:该算法收敛速度快, 求解数值精度高, 对初值的依赖程度低, 在SVM参数优化中具有更好的性能、更高的分类准确率, 是一个极其有效的参数优化方法\SVM\分类准确率
元启发式算法相比较启发式算法求解精度高, 但算法运行时间长, 基于精英策略的蚁群算法虽能加快收敛速度却易陷入局部最优\基于精英策略的蚁群算法\收敛速度
实验证明改进后的蚁群算法降低了最大完成时间和不平衡程度, 提高了云资源的利用率\改进后的蚁群算法\云资源的利用率
仿真结果表明, 在一定条件下, 与自适应的二四叉树相比, 改进后的算法可以在减少空闲时隙数的同时提高算法的吞吐率\自适应的二四叉树\空闲时隙数
为进一步提高萤火虫算法 (firefly algorithm, FA) 的收敛速度和计算精度, 提出一种布谷鸟算法 (cuckoo search, CS) 初始化萤火虫初始种群的算法 (CSFA) \CSFA\CS
最后将CSFA算法应用到压力容器设计问题中, 应用结果表明CSFA算法不管是最优值、最差值还是平均值和标准差都要好于SBSM算法, CPSO算法, HPSO算法, TVDFPA算法对压力容器问题的求解值\TVDFPA算法\标准差
对待预测事件已知的热度时间序列进行缩放变化, 并使用最小二乘法选取类模型库中均方误差和最小的模型对该事件进行预测\最小二乘法\均方误差和
实验结果表明, 相比CIA和GoDIN这两种完全基于PPI网络的方法, HPMM的精确度与F值更高\HPMM\精确度
实验仿真结果表明, 与当前预测性能较好的、基于最小二乘局部预测的可逆图像水印算法相比, 所提算法在嵌入相同的数据时拥有更高的峰值信噪比 (PSNR) \基于最小二乘局部预测的可逆图像水印算法\PSNR
将深度堆叠森林应用于Eclipse数据集的缺陷预测中, 实验结果表明, 该算法在预测性能和时间效率上均比深度森林有明显的提升\深度森林\预测性能
