大多数空间co-location模式挖掘将距离阈值作为衡量不同对象实例间邻近关系的标准, 进而挖掘出频繁co-location模式, 并没有考虑具有邻近关系的实例间的相互影响和模式的增益率问题\没有考虑具有邻近关系的实例间的相互影响和模式的增益率问题
针对变换域通信系统 (TDCS) 在复杂电磁环境下面临的通信干扰问题, 提出一种基于存储转发机制的远距航空通信TDCS模型\通信干扰问题
针对传统虚拟机整合 (VMC) 方法难以保持主机工作负载长期稳定的问题, 提出一种基于高斯混合模型的高效虚拟机整合 (GMM-VMC) 方法\传统虚拟机整合 (VMC) 方法难以保持主机工作负载长期稳定的问题
针对云资源弹性调度问题, 结合Ceph数据存储的特点, 提出一种基于Docker容器的云资源弹性调度策略\云资源弹性调度问题
电商平台的刷单行为在一定程度上提高了店铺收益, 但是刷单行为一方面抬高了电商平台的推广成本, 导致了严重的信誉安全问题;另一方面, 虚假的刷单信息致使消费者易受误导, 从而造成财产损失\信誉安全问题
电商平台的刷单行为在一定程度上提高了店铺收益, 但是刷单行为一方面抬高了电商平台的推广成本, 导致了严重的信誉安全问题;另一方面, 虚假的刷单信息致使消费者易受误导, 从而造成财产损失\消费者易受误导
电商平台的刷单行为在一定程度上提高了店铺收益, 但是刷单行为一方面抬高了电商平台的推广成本, 导致了严重的信誉安全问题;另一方面, 虚假的刷单信息致使消费者易受误导, 从而造成财产损失\财产损失
大规模的数模混合电路所含故障模式众多, 电路故障状态复杂, 且易发生传播, 因而电路故障诊断难度较大\故障模式众多
大规模的数模混合电路所含故障模式众多, 电路故障状态复杂, 且易发生传播, 因而电路故障诊断难度较大\电路故障状态复杂
大规模的数模混合电路所含故障模式众多, 电路故障状态复杂, 且易发生传播, 因而电路故障诊断难度较大\易发生传播
大规模的数模混合电路所含故障模式众多, 电路故障状态复杂, 且易发生传播, 因而电路故障诊断难度较大\电路故障诊断难度较大
针对射电天文信号观测中传统的信号采集电路存储数据需较大的存储空间的问题, 提出一种基于调制宽带转换器 (MWC) 的低频射电天文信号采集的硬件电路设计方法\传统的信号采集电路存储数据需较大的存储空间的问题
传统算法无法满足现代大规模、多变量、多约束的复杂问题求解, 使得智能算法的应用越来越广泛\无法满足现代大规模、多变量、多约束的复杂问题求解
针对已有调度算法在不同负载特征下自适应性不足的问题, 提出了一种基于强化学习方法的ALHS算法, 通过对访存调度中页命中优先时的连续页命中上限次数进行自适应调整, 习得最优策略\不同负载特征下自适应性不足的问题,
随着操作系统安全问题增多, 用户对于操作系统的安全需求不断涌现, 但是目前能够将用户的安全需求转换成现有操作系统上可配置的安全策略的方法很少\操作系统安全问题
随着操作系统安全问题增多, 用户对于操作系统的安全需求不断涌现, 但是目前能够将用户的安全需求转换成现有操作系统上可配置的安全策略的方法很少\将用户的安全需求转换成现有操作系统上可配置的安全策略的方法很少
设计了反映空战态势的鲁棒隶属函数, 并基于此设计鲁棒多目标决策函数;针对动作库在机动决策中的不完备性与传统优化方法求解时效性缺陷, 运用基于自适应和精英反向学习策略改进的共生生物算法, 对控制量进行优化进而完成机动决策;仿真结果表明, 鲁棒机动决策结果更具优势且改进算法求解具有实时性, 满足机动决策需求\不完备性
设计了反映空战态势的鲁棒隶属函数, 并基于此设计鲁棒多目标决策函数;针对动作库在机动决策中的不完备性与传统优化方法求解时效性缺陷, 运用基于自适应和精英反向学习策略改进的共生生物算法, 对控制量进行优化进而完成机动决策;仿真结果表明, 鲁棒机动决策结果更具优势且改进算法求解具有实时性, 满足机动决策需求\时效性缺陷
针对压缩视频码流在无线信道传输过程中由于运动矢量失配导致重构图像质量的问题, 提出了一种基于平面拟合恢复运动矢量的错误隐藏算法\重构图像质量的问题
针对监控大规模分布式NFC读写器人力成本高的问题, 设计并实现了一种对大量读写器进行监控的高效能管理系统\人力成本高的问题
大型软件通常由多个模块组成, 在软件开发过程中软件联调是一个十分重要的环节\软件开发
为增强漫游的真实感, 避免视觉抖动和场景跳跃现象, 对场景漫游路径进行优化设计\视觉抖动
为增强漫游的真实感, 避免视觉抖动和场景跳跃现象, 对场景漫游路径进行优化设计\场景跳跃现象
气象数值预报产品数据日益增长, 传统的关系型数据库对其存储和管理能力不足, 查询规模较大的历史数据时效率较低\统的关系型数据库对其存储和管理能力不足
气象数值预报产品数据日益增长, 传统的关系型数据库对其存储和管理能力不足, 查询规模较大的历史数据时效率较低\查询规模较大的历史数据时效率较低
因HBase对Rowkey的一级索引支持较好, 而对多条件查询支持不足, 需辅助Solr索引加以优化\对多条件查询支持不足
LDA (latent Dirichlet allocation) 模型是一种应用非常广泛且很成熟的主题模型, 也是一个概率生成模型, 可以很好地解决多词一义和一词多义的问题\多词一义
LDA (latent Dirichlet allocation) 模型是一种应用非常广泛且很成熟的主题模型, 也是一个概率生成模型, 可以很好地解决多词一义和一词多义的问题\一词多义
目前, 效率问题是区块链中共识算法面临的主要问题之一\效率问题
针对鉴别的局部中值保持投影 (DLMPP) 在小样本情况下面临的类内散布矩阵奇异的问题, 提出了广义的鉴别局部中值保持投影 (GDLMPP) 算法\类内散布矩阵奇异的问题
实验结果表明, 该算法可以快速、有效地解决频繁通信关系的挖掘问题\频繁通信关系的挖掘问题
社群化制造作为一种适应未来社会化、服务化和大规模个性化制造环境的新型制造模式, 将解决未来制造业中多参与主体资源共享、协作与交互等问题, 因此对其进行研究具有重要意义\多参与主体资源共享
社群化制造作为一种适应未来社会化、服务化和大规模个性化制造环境的新型制造模式, 将解决未来制造业中多参与主体资源共享、协作与交互等问题, 因此对其进行研究具有重要意义\协作与交互
首先定义了“t-时隙k-覆盖”群智感知任务, 以最小代价完成该类任务是NP-hard问题\NP-hard问题
通过特殊的构造技巧, 在问题规模较小时可以用线性规划进行求解, 但随着问题规模的增大, 线性规划越来越力不从心, 因此提出了基于贪心策略的参与者选择算法\随着问题规模的增大, 线性规划越来越力不从心
针对现有能量捕获技术存在能量来源不稳定、储能设备容量有限等特点, 提出了一种基于超级电容和电池的混合储能结构, 并建模分析其相应的通信信道容量性能\能量捕获技术存在能量来源不稳定
针对现有能量捕获技术存在能量来源不稳定、储能设备容量有限等特点, 提出了一种基于超级电容和电池的混合储能结构, 并建模分析其相应的通信信道容量性能\储能设备容量有限
近年来, 随着Android系统的迅猛发展, 其安全面临着极大的挑战\安全面临着极大的挑战
随着逆向工程的不断发展, 软件产业的利益在很长一段时间内受到了来自盗版产业和恶意行为的破坏\受到了来自盗版产业和恶意行为的破坏
但是, 现存的大多数混淆方法都是语言相关或者依赖目标平台的, 对逆向的作用往往极其有限\对逆向的作用往往极其有限
集成电路在测试过程中的测试功耗通常会远远高于集成电路正常工作时的功耗, 而过高的测试功耗可能会造成电路损坏或是芯片烧毁\集成电路在测试过程中的测试功耗通常会远远高于集成电路正常工作时的功耗
针对现有方法无法有效处理不确定数据的障碍k聚集最近邻查询问题的不足, 提出了基于不确定Voronoi图的概率障碍k聚集最近邻查询 (probabilistic obstacle k aggregate nearest neighbor query, POk ANN) 方法\现有方法无法有效处理不确定数据的障碍k聚集最近邻查询问题的不足
针对以往攻击图分析方法复杂度较高, 风险判别标准单一, 生成的策略加固代价较高, 难以适用于大规模网络环境等问题, 提出了一种面向大规模网络安全加固的启发式攻击图分析方法\攻击图分析方法复杂度较高
针对以往攻击图分析方法复杂度较高, 风险判别标准单一, 生成的策略加固代价较高, 难以适用于大规模网络环境等问题, 提出了一种面向大规模网络安全加固的启发式攻击图分析方法\风险判别标准单一
针对以往攻击图分析方法复杂度较高, 风险判别标准单一, 生成的策略加固代价较高, 难以适用于大规模网络环境等问题, 提出了一种面向大规模网络安全加固的启发式攻击图分析方法\生成的策略加固代价较高
针对以往攻击图分析方法复杂度较高, 风险判别标准单一, 生成的策略加固代价较高, 难以适用于大规模网络环境等问题, 提出了一种面向大规模网络安全加固的启发式攻击图分析方法\难以适用于大规模网络环境
针对传统漏洞修复策略存在难以确定同一危害等级漏洞修复优先次序的问题, 提出了一种基于漏洞类型聚类的层次化漏洞修复 (vulnerability remediation based on vulnerability type clustering, VR-VTC) 模型\存在难以确定同一危害等级漏洞修复优先次序
为解决多载波码分多址 (MC-CDMA) 信号子载波参数估计问题, 提出四阶循环累积量算法\多载波码分多址 (MC-CDMA) 信号子载波参数估计问题
针对多路径并发传输流传输控制协议在实际应用中, 因数据乱序造成有效吞吐量远低于各路径的有效带宽总和的问题, 提出一种多路径并行传输系统有效吞吐量的优化方法 SCTP-CDD (controlling the difference of delay) \有效吞吐量远低于各路径的有效带宽总和
由于车联网 (vehicular ad hoc networks, VANETs) 的高动态的网络拓扑, 给视频数据流的共享服务提出挑战\高动态的网络拓扑
针对EPON中的动态带宽分配问题, 提出一种介于在线动态带宽分配算法和离线动态带宽分配算法之间的中间算法\EPON中的动态带宽分配问题
基于经典图着色算法的LTE PCI分配方法对小区间干扰未予以考虑\对小区间干扰未予以考虑
为有效解决内存云主要存储器件DRAM面临能耗损失大、数据可靠性差、断电易失等问题, 提出使用非易失性存储器件PCM替换部分DRAM器件构成混合内存云架构\内存云主要存储器件DRAM面临能耗损失大
为有效解决内存云主要存储器件DRAM面临能耗损失大、数据可靠性差、断电易失等问题, 提出使用非易失性存储器件PCM替换部分DRAM器件构成混合内存云架构\数据可靠性差
为有效解决内存云主要存储器件DRAM面临能耗损失大、数据可靠性差、断电易失等问题, 提出使用非易失性存储器件PCM替换部分DRAM器件构成混合内存云架构\断电易失
针对局部立体匹配算法精度不高等问题, 提出一种代价可变的S-census变换 (variable cost S-census transform, VSC) 算法\局部立体匹配算法精度不高等问题
利用云模型在不确定性处理中的优势, 对程序时间性能进行定量评价与定性评价之间的转化, 改善传统的程序时间性能评价方法在复杂运行环境中和程序规模较大时存在的不足, 能够很好地适用于各类程序的时间性能评价\复杂运行环境中和程序规模较大时存在的不足
为解决OLDA模型挖掘大规模文档主题时计算效率低下和不能发现新主题的问题, 提出一种分布式的DOLDA模型 (distribute online LDA, DOLDA) \计算效率低下
为解决OLDA模型挖掘大规模文档主题时计算效率低下和不能发现新主题的问题, 提出一种分布式的DOLDA模型 (distribute online LDA, DOLDA) \不能发现新主题
为解决现有故障注入工具缺乏对虚拟化系统特有故障进行测试的问题, 提出一种面向虚拟化系统的故障注入工具架构\现有故障注入工具缺乏对虚拟化系统特有故障进行测试的问题
针对目前ICP算法存在因初始变换矩阵的不确定性造成收敛速度较慢、点云间对应点难以精准匹配造成计算复杂度高的问题, 提出一种利用点云局部坐标系, 以关键点的邻域内点集的旋转体积为特征对关键点进行表述的描述子\存在因初始变换矩阵的不确定性造成收敛速度较慢
针对目前ICP算法存在因初始变换矩阵的不确定性造成收敛速度较慢、点云间对应点难以精准匹配造成计算复杂度高的问题, 提出一种利用点云局部坐标系, 以关键点的邻域内点集的旋转体积为特征对关键点进行表述的描述子\点云间对应点难以精准匹配造成计算复杂度高的问题
在嵌入式平台下, 针对局部二值模式 (local binary pattern, LBP) 算法不能在较远距离快速实现人脸识别的问题, 设计先利用ViBe (visual background extractor) 算法实现背景建模, 再对检测到的目标区域进行LBP人脸识别的方法\不能在较远距离快速实现人脸识别
测试结果表明, 相对于传统视频监控系统存在的效率低下、资源浪费、被动监控等问题, 该系统功能完整、经济实用, 能远距离快速识别非法闯入者, 及时通知用户采取防范措施, 具有广泛的应用前景\效率低下
测试结果表明, 相对于传统视频监控系统存在的效率低下、资源浪费、被动监控等问题, 该系统功能完整、经济实用, 能远距离快速识别非法闯入者, 及时通知用户采取防范措施, 具有广泛的应用前景\资源浪费
测试结果表明, 相对于传统视频监控系统存在的效率低下、资源浪费、被动监控等问题, 该系统功能完整、经济实用, 能远距离快速识别非法闯入者, 及时通知用户采取防范措施, 具有广泛的应用前景\被动监控
深度模型尽管性能强大, 然而由于参数数量庞大、存储和计算代价高, 依然难以部署在受限的硬件平台上 (如移动设备) \参数数量庞大
深度模型尽管性能强大, 然而由于参数数量庞大、存储和计算代价高, 依然难以部署在受限的硬件平台上 (如移动设备) \存储和计算代价高
深度模型尽管性能强大, 然而由于参数数量庞大、存储和计算代价高, 依然难以部署在受限的硬件平台上 (如移动设备) \难以部署在受限的硬件平台上 
策略梯度作为一种能够有效解决连续空间决策问题的方法得到了广泛研究, 但由于在策略估计过程中存在较大方差, 因此, 基于策略梯度的方法往往受到样本利用率低、收敛速度慢等限制\受到样本利用率低
策略梯度作为一种能够有效解决连续空间决策问题的方法得到了广泛研究, 但由于在策略估计过程中存在较大方差, 因此, 基于策略梯度的方法往往受到样本利用率低、收敛速度慢等限制\收敛速度慢等限制
策略梯度作为一种能够有效解决连续空间决策问题的方法得到了广泛研究, 但由于在策略估计过程中存在较大方差, 因此, 基于策略梯度的方法往往受到样本利用率低、收敛速度慢等限制\在策略估计过程中存在较大方差
为了充分利用Web服务并解决单个Web服务功能有限的问题, 业界将多个原子Web服务按照一定的规则和业务逻辑进行组合, 以提供更多功能更强大的服务, 实现了Web服务的增值和复用\单个Web服务功能有限
此外, 还对Web服务组合测试中有待研究的问题进行了分析和展望\Web服务组合测试中有待研究的问题
情景感知 (context aware) 的应用是当前的一个研究热点, 但是, 由于情景的复杂性和不确定性, 如何获取这些应用的需求面临着巨大挑战, 需求工程领域出现了大量的研究来解决这一挑战\情景感知 (context aware) 的应用
带有间隙约束的模式匹配问题是序列模式挖掘的关键问题之一\带有间隙约束的模式匹配问题
目前, 大多数系统的推理主要基于批处理的方式实现, 并不适用于在线查询场景\不适用于在线查询场景
然而, 由于流程日志间存在着执行实例的多对多匹配关系、融合所需信息可能缺失等问题, 导致事件日志融合问题具有较高的挑战性\融合所需信息可能缺失
然而, 由于流程日志间存在着执行实例的多对多匹配关系、融合所需信息可能缺失等问题, 导致事件日志融合问题具有较高的挑战性\存在着执行实例的多对多匹配关系
对事件日志融合问题进行了形式化定义, 指出该问题是一个搜索优化问题, 并提出了一种基于混合人工免疫算法的事件日志融合方法:以启发式方法生成初始种群, 以人工免疫系统的克隆选择理论作为基础, 通过免疫进化获得“最佳”的融合解, 从而支持包含多对多的实例匹配关系的日志融合;考虑两个实例级别的因素——流程执行路径出现的频次和流程实例间的时间匹配关系, 分别从“量”匹配和“时间”匹配两个维度来评价进化中的个体;通过设置免疫记忆库、引入模拟退火机制, 保证新一代种群的多样性, 减少进化早熟几率\搜索优化问题
然而, 有针对性地对观点挖掘中的方面提取与观点提取进行综述总结的成果较少\有针对性地对观点挖掘中的方面提取与观点提取进行综述总结的成果较少
然而TB级别的内存不但造成了服务器成本的上升, 也促进了功耗的增长\成本的上升
然而TB级别的内存不但造成了服务器成本的上升, 也促进了功耗的增长\功耗的增长
由于DRAM的功耗、容量密度受限于工艺瓶颈, 无法满足内存计算快速增长的内存需求, 因此研发人员将目光逐渐移向了新型的非易失性内存 (non-volatile memory, NVM) \工艺瓶颈,
该框架可以通过有效利用异质内存来满足内存计算不断增长的计算规模\内存计算不断增长的计算规模
随着图的规模增大, 相对大小局限的GPU的设备访存空间逐渐不能满足缓存整个图数据的应用需求, 也催生了大量以单节点上外存I/O优化 (out-of-core graph) 为主要研究方向的大规模图数据处理系统\ 相对大小局限的GPU的设备访存空间逐渐不能满足缓存整个图数据的应用需求
然而, 传统的硬件加速器 (如GPU, FPGA和定制的加速器) 和内存是相互分离的, 加速器和内存之间的数据移动难以避免, 这使得如何降低加速器和内存之间数据移动的开销成为极具挑战性的问题\传统的硬件加速器 (如GPU, FPGA和定制的加速器) 和内存是相互分离
然而, 传统的硬件加速器 (如GPU, FPGA和定制的加速器) 和内存是相互分离的, 加速器和内存之间的数据移动难以避免, 这使得如何降低加速器和内存之间数据移动的开销成为极具挑战性的问题\加速器和内存之间的数据移动难以避免
ACID事务在数据库中非常有价值, 但由于数据库事务通常较大, 其面临的挑战是HTM固有的容量限制和争用水平\HTM固有的容量限制
ACID事务在数据库中非常有价值, 但由于数据库事务通常较大, 其面临的挑战是HTM固有的容量限制和争用水平\争用水平
使用2种方法来消除PHTM的局限性:1) 持久化混合事务内存 (persistent hybrid TM, PHyTM) , 允许PHTM事务与支持任意大小的纯软件事务 (software transactional memory, STM) 并发执行;2) 分离事务执行 (split transaction execution, STE) 算法, 该算法为关系数据库事务量身定制, 解决了大多数事务超过PHTM的容量限制的问题\PHTM的局限性
使用2种方法来消除PHTM的局限性:1) 持久化混合事务内存 (persistent hybrid TM, PHyTM) , 允许PHTM事务与支持任意大小的纯软件事务 (software transactional memory, STM) 并发执行;2) 分离事务执行 (split transaction execution, STE) 算法, 该算法为关系数据库事务量身定制, 解决了大多数事务超过PHTM的容量限制的问题\大多数事务超过PHTM的容量限制
分布式虚拟化环境的动态性与异构性, 随时会导致运行在其上的服务组合中出现失效等情况, 从而导致整个业务流程中断, 极大影响整个系统的可信性\导致运行在其上的服务组合中出现失效
分布式虚拟化环境的动态性与异构性, 随时会导致运行在其上的服务组合中出现失效等情况, 从而导致整个业务流程中断, 极大影响整个系统的可信性\导致整个业务流程中断
分布式虚拟化环境的动态性与异构性, 随时会导致运行在其上的服务组合中出现失效等情况, 从而导致整个业务流程中断, 极大影响整个系统的可信性\影响整个系统的可信性
作为应对服务失效最常用的方法, 现有的服务替换方法由于缺少事务支持, 会导致替换后的服务组合的一致性与正确性缺乏保障\缺少事务支持
作为应对服务失效最常用的方法, 现有的服务替换方法由于缺少事务支持, 会导致替换后的服务组合的一致性与正确性缺乏保障\一致性与正确性缺乏保障
为了避免GPU存储空间不足的问题, 设计了自适应并行框架\GPU存储空间不足
目前, 它们在硬件实现时, 大都采用分离的、各自独立的设计方式, 这造成了硬件逻辑资源的浪费\硬件逻辑资源的浪费
在高性能计算环境中, 并行文件系统面临百万量级的客户端, 这些客户端往往在同一时间段内发出大量并发I/O请求, 使元数据服务器承载巨大的压力\元数据服务器承载巨大的压力
另一方面, 这些客户端发出的并发读写请求往往指向同一目录, 导致很难将元数据负载调度到多个服务器上\难将元数据负载调度到多个服务器上
以往的云游戏系统为了最大化用户的游戏体验, 都是直接部署在物理服务器上, 导致资源不能动态分配\资源不能动态分配
信任是人类解决复杂社会问题的有效机制之一, 受到多个研究领域的高度重视\信任
为了克服现有信任模型中对信任的动态性刻画不足的问题, 提出一种基于认知计算的主观信任模型\动态性刻画不足
信任关系研究一直是解决人类复杂社会问题的有效手段\人类复杂社会问题
针对关键词查询中存在的高存储空间和低查找效率, 提出了一种双索引机制的RDF数据图查询方法\高存储空间
针对关键词查询中存在的高存储空间和低查找效率, 提出了一种双索引机制的RDF数据图查询方法\低查找效率
为克服原始扩展目标高斯混合概率假设密度滤波算法 (Extended Target Gaussian Mixture Probability Hypothesis Density, ET-GM PHD) 不能解决机动目标跟踪问题, 将交互多模型 (Interacting M ultiple M odel, IM M) 的思想引入到高斯混合概率假设密度滤波框架下, 提出一种交互多模型扩展高斯混合概率假设密度滤波算法 (IMM-ET-GMPHD) \不能解决机动目标跟踪
针对传统多表连接查询算法不能有效解决数据倾斜导致的性能瓶颈问题, 设计并实现统计倾斜轮询分区连接查询优化算法, 该算法以HDFS作为数据存储层, 通过统计倾斜与轮询分区策略有效将数据分发到Hadoop集群各个计算节点\数据倾斜导致的性能瓶颈问题
随着数据体量不断增大、用户需求不断增多, 规划时的数据平台规模很可能不能满足不断变化的需求\不能满足不断变化的需求
能耗是目前高性能计算系统性能提升的一大挑战\能耗
随着现代电网规模的不断扩大和谐波污染的不断加深, 对电力系统中的谐波进行仿真分析的需求越来越迫切\谐波污染
考试者监测是在线考试面临的主要难题之一\考试者监测
传统监测方案主要集中在考试者的身份识别方面, 缺乏对考试者异常行为的有效识别\缺乏对考试者异常行为的有效识别
同时, 针对单一的动作事件判别方法存在的虚警率高的问题, 提出利用多维度体感信息识别考试者行为的新思路\虚警率高
针对智能服务制定与提供过程中时间语义处理难的问题, 提出一种面向智能服务系统的时间语义信息理解模型\时间语义处理难
