传统的最大间隔准则在计算类间离散度矩阵时往往忽略了类别之间的差异, 但是对于人脸年龄估计, 不同年龄标签之间的差异性是非常显著的\类别之间的差异
尿沉渣空间环境的复杂性, 导致采集的有形成分图像存在较多冗余信息, 提取有效的图像信息变得较为困难, 进而使得识别系统需要处理的数据量十分巨大\冗余信息
尿沉渣空间环境的复杂性, 导致采集的有形成分图像存在较多冗余信息, 提取有效的图像信息变得较为困难, 进而使得识别系统需要处理的数据量十分巨大\数据量十分巨大
它采用并行优化框架, 同步高效地对数据进行加速处理;同时, 以GPU计算和测试平台为硬件系统支持, 无论是在硬件指标、数据传输及总线技术还是软硬件的兼容性方面, 都有助于解决算法中时常出现的负载不均衡的问题\负载不均衡
实验数据充分说明, 优化并行框架的GPU处理系统中相关的逻辑数据、地址数据和线性寻程的函数映射关系均能相互动态分配对接并优化算法架构, 实现软件到硬件系统的最优比映射, 最终解决由于线程间负载不均衡导致的性能瓶颈问题, 从而有效地化解了医学领域实时检测中的时效性这一难题\性能瓶颈
实验数据充分说明, 优化并行框架的GPU处理系统中相关的逻辑数据、地址数据和线性寻程的函数映射关系均能相互动态分配对接并优化算法架构, 实现软件到硬件系统的最优比映射, 最终解决由于线程间负载不均衡导致的性能瓶颈问题, 从而有效地化解了医学领域实时检测中的时效性这一难题\时效性
针对现有的启发式划分方法对不同特征的程序采用的策略划分, 导致部分程序划分效果较差的问题, 提出利用机器学习方法从TLS样本集中学习线程划分的知识, 并根据程序的特征预测其划分方案, 并利用此划分方案对其进行划分\效果较差
图着色问题一直是计算机科学和数学领域最著名和经典的研究问题之一\图着色问题
由于目前图数据规模的不断增加, 单机图着色算法性能受到限制\性能
针对深度图中穷尽模式搜索开销大, 采用DMMs (depth modeling modes) 模式几率小, 以及分段直流残差编码模式 (segment-wise DC coding, SDC) 判断复杂的问题, 通过计算当前预测单元 (prediction unit, PU) 的梯度和 (sum-of-gradient, SOG) 来预判编码单元 (coding unit, CU) 的类型 (平坦/非平坦) , 并根据CU类型进行两方面的优化:一方面, 选择性地跳过DMMs模式的检查, 并提前终止CU的分割;另一方面, 只对全率失真列表中平坦预测模式进行SDC编码, 跳过其他候选模式的SDC编码\搜索开销大
在设计中采用基于前导序列的符号同步算法, 实现精确的符号同步, 避免同步点靠后而产生符号间干扰\符号间干扰
分析电容失配对权重的影响, 为减小高精度ADC的面积开销, 采用冗余结构的分段电容阵列, 降低对电容失配的要求, 为校正提供条件, 设计基于LMS算法的结合DEM技术的校正方法\面积开销
为有效解决静态程序分析中函数指针指向信息获取不够准确和库函数调用信息处理不够完善的问题, 提出一种在LLVM平台下静态程序信息的过程间分析方法\不够准确
为有效解决静态程序分析中函数指针指向信息获取不够准确和库函数调用信息处理不够完善的问题, 提出一种在LLVM平台下静态程序信息的过程间分析方法\不够完善
针对现场可编程逻辑门阵列 (FPGA) 实现BP神经网络仍存在的激活函数实现困难及输入输出吞吐量不够等几个关键性问题, 采用平滑插值法对S型激活函数做进一步改进, 在中间数据存储中提出采用寄存器循环缓存方式, 在网络搭建中利用高效的FPGA深度流水线技术实现网络的串并联\实现困难
针对现场可编程逻辑门阵列 (FPGA) 实现BP神经网络仍存在的激活函数实现困难及输入输出吞吐量不够等几个关键性问题, 采用平滑插值法对S型激活函数做进一步改进, 在中间数据存储中提出采用寄存器循环缓存方式, 在网络搭建中利用高效的FPGA深度流水线技术实现网络的串并联\吞吐量不够
目前病理标本大多采用人工管理模式, 费时费力, 容易出现标本错检漏检的情况\费时费力
目前病理标本大多采用人工管理模式, 费时费力, 容易出现标本错检漏检的情况\错检漏检
现有存储类隐蔽信道一直存在隐蔽安全性疑问, 而时间类信道较多选择网络及以下层协议作为载体, 需额外提供复杂编码方法以降低误码率, 且难以提供足够的传输速率\传输速率
基于信任机制的安全管理给云安全问题提供了全新的思路\云安全问题
硬盘信息安全不仅关系到个人隐私、企业密码, 更是关系到国家安全\硬盘信息安全
现有基于Hash学习二进制编码方法通常学习一组用于数据投影的超平面, 并且简单地对来自每个超平面划分的结果进行二值化编码, 而忽视了信息可能不均匀地分布在整个投影中且每一维投影中数据取值范围可能不一样的事实\不均匀
但是, 由于该算法缺乏神经节点之间细粒度结构并行的能力, 当遇到数据维度较高、网络节点较多时, 性能还显不足\性能还显不足
绝大多数企业结合行业特点开发了数据质量检测系统来解决自身数据质量问题\数据质量
云平台RESTful接口往往暴露在Internet上, 为保证云资源的安全, 防止数据泄露和非授权访问, 必须实施安全策略对这些接口进行访问控制\数据泄露
云平台RESTful接口往往暴露在Internet上, 为保证云资源的安全, 防止数据泄露和非授权访问, 必须实施安全策略对这些接口进行访问控制\非授权访问
然而, 目前RESTful接口缺乏统一的访问控制策略描述语言及相应的权限划分机制\缺乏
6%的策略设计成本\设计成本
该文从云服务本身、云服务接口和网络接口三个方面研究了云计算平台存在的安全威胁\安全威胁
然而, 云计算系统规模巨大, 结构复杂, 大量的监测数据需要搜集、传输、存储和分析, 给系统带来巨大性能开销\巨大性能开销
那么, 如何在提高故障检测的准确性和及时性的同时, 减少监测开销成为亟待解决的问题\监测开销
然后, 针对现有的MRSE (Multi-keyword Ranked Search over Encrypted cloud data) 方案效率不高的缺陷, 将创建的文档向量分块, 生成维数较小的标记向量\效率不高
如何让消费者在评分信息不完整, 消费者偏好不一致和评价标准不一致的情况下从海量在线商品中做出正确选择, 成为消费者关注的问题\分信息不完整
如何让消费者在评分信息不完整, 消费者偏好不一致和评价标准不一致的情况下从海量在线商品中做出正确选择, 成为消费者关注的问题\标准不一致
由于不同的漏洞编制出不同的沉默型P2P蠕虫对于网络可能造成巨大危害性\危害性
针对高度不确定环境下的多准则群体决策问题, 提出一种基于梯形区间二型模糊的多重处理隶属函数中模糊不确定信息的群决策综合比较法\多准则群体决策问题
但是, 尺度空间的划分方式通常却被主观地判定\主观地判定
针对传统的遥感影像处理中存在单节点故障、扩展性低和处理效率低等问题, 提出了一种基于HBase的遥感数据分布式存储与查询方案\单节点故障
针对传统的遥感影像处理中存在单节点故障、扩展性低和处理效率低等问题, 提出了一种基于HBase的遥感数据分布式存储与查询方案\扩展性低
针对传统的遥感影像处理中存在单节点故障、扩展性低和处理效率低等问题, 提出了一种基于HBase的遥感数据分布式存储与查询方案\处理效率低
隐私保护问题已成为信息安全领域研究的重点方向\隐私保护问题
传统的电力线通信和可见光通信融合信道的分析模型没有对融合系统的信道模型参数进行确定, 因此模型只能定性地描述融合信道的一般特性\定性
现有的服务组合描述途径不能有效地验证和测试组合正确性, 针对这一问题, 提出了一个代数规约方法, 引入规约包机制扩展面向服务代数规约语言SOFIA以支持该方法\不能有效地验证和测试
然而, 随着Web应用程序规模的扩大, 无效访问状态和无效迁移路径的增加导致测试用例空间爆炸\测试用例空间爆炸
当前REST服务架构广泛应用于大规模、可扩展的分布式Web系统中, 若应用REST服务架构时不遵循其标准特征, 则可能导致基于REST服务架构的Web系统出现性能下降、可扩展性低等问题\性能下降
当前REST服务架构广泛应用于大规模、可扩展的分布式Web系统中, 若应用REST服务架构时不遵循其标准特征, 则可能导致基于REST服务架构的Web系统出现性能下降、可扩展性低等问题\可扩展性低
针对软件定义网络 (SDN) 的数据平面数据泄露问题、提出一种新的基于OpenFlow协议的数据安全处理机制\数据泄露
由于链路带宽存在随机性, 已有的基于超文本传输协议的动态自适应流媒体传输技术 (DASH) 的码率自适应算法不能很好解决播放流畅性和视频质量之间的矛盾\矛盾
针对基于压缩感知 (CS) 的磁共振成像 (MRI) 稀疏重建中存在的两个非平滑正则项问题, 提出了一种基于Moreau包络的近似平滑迭代算法 (PSIA) \非平滑正则项
基于CS的经典MRI稀疏重建是求解一个由最小二乘保真项、小波变换稀疏正则项和总变分 (TV) 正则项线性组合成的目标函数最小化问题\经典MRI稀疏重建
Storm作为开源的分布式实时计算系统在业界得到了广泛应用, 针对Storm自带调度策略忽略了Topology组件任务间的逻辑耦合性, 从而引起大量tuple传输产生较大网络时延问题, 结合进程代数将Topology等效简化为具有明显局部可串行化特征的逻辑进程系统模型, 并基于该模型采用最大本地化调度策略\网络时延
针对网络化控制系统的滤波器参数存在摄动的问题, 考虑到传感器-滤波器存在随机时延和丢包, 设计对系统待估信号进行估计的加性非脆弱耗散滤波器, 其中滤波器参数具有范数有界不确定性\时延
针对网络化控制系统的滤波器参数存在摄动的问题, 考虑到传感器-滤波器存在随机时延和丢包, 设计对系统待估信号进行估计的加性非脆弱耗散滤波器, 其中滤波器参数具有范数有界不确定性\丢包
针对主流网络仿真器在场景建模方面存在效率不高和灵活性不够的问题, 提出一种基于统一描述和中间件适配的高效可扩展的场景建模机制\效率不高
针对主流网络仿真器在场景建模方面存在效率不高和灵活性不够的问题, 提出一种基于统一描述和中间件适配的高效可扩展的场景建模机制\灵活性不够
该算法通过适当增大判断滤波发散的阈值, 从而有效地降低了误判滤波发散的概率, 增强了滤波器对系统状态的跟踪性能, 并能够根据不同维数的量测方程确定弱化因子的取值, 从而有效避免了凭经验选取弱化因子, 具有较强的操作性\误判
传统的基于频繁模式增长的并行关联规则算法在处理动态更新的数据集时, 需要把更新后的数据集全部压缩到频繁模式树中, 消耗了大量时间和存储空间, 且没有充分考虑头表分组过程中组间负载量不同的问题\时间
传统的基于频繁模式增长的并行关联规则算法在处理动态更新的数据集时, 需要把更新后的数据集全部压缩到频繁模式树中, 消耗了大量时间和存储空间, 且没有充分考虑头表分组过程中组间负载量不同的问题\存储空间
传统的基于频繁模式增长的并行关联规则算法在处理动态更新的数据集时, 需要把更新后的数据集全部压缩到频繁模式树中, 消耗了大量时间和存储空间, 且没有充分考虑头表分组过程中组间负载量不同的问题\负载量不同
针对在关联规则的实际挖掘过程中, 数据集快速增长所造成的增量更新问题, 基于并行频繁模式增长PFP-tree算法, 结合Spark分布式并行处理框架, 提出一种改进的并行关联规则增量更新算法\增量更新问题
信息共享时代下, 数据发布与数据挖掘中存在的隐私保护问题一直是信息安全领域研究的重点\隐私保护问题
传统的音频信号分析设备功能全、精度高, 但这些设备不但体积大、结构复杂、反应速度慢、适应范围窄, 而且造价非常昂贵, 影响了它在小型化系统中的应用\体积大
传统的音频信号分析设备功能全、精度高, 但这些设备不但体积大、结构复杂、反应速度慢、适应范围窄, 而且造价非常昂贵, 影响了它在小型化系统中的应用\结构复杂
传统的音频信号分析设备功能全、精度高, 但这些设备不但体积大、结构复杂、反应速度慢、适应范围窄, 而且造价非常昂贵, 影响了它在小型化系统中的应用\反应速度慢
传统的音频信号分析设备功能全、精度高, 但这些设备不但体积大、结构复杂、反应速度慢、适应范围窄, 而且造价非常昂贵, 影响了它在小型化系统中的应用\适应范围窄
传统的音频信号分析设备功能全、精度高, 但这些设备不但体积大、结构复杂、反应速度慢、适应范围窄, 而且造价非常昂贵, 影响了它在小型化系统中的应用\造价非常昂贵
随着机动车保有量的飞速增长, 由此带来的交通安全问题以及如何有效地监控交通运输车辆和分析车辆轨迹行为成为当前社会关注的热点之一\交通安全问题
提出了在物理网卡和LWIP协议栈传递数据、外部应用程序和LWIP协议栈传递数据时的改进方法, 避免了数据的两次拷贝, 从而实现了数据从物理层直达应用层, 提高了系统的传输效率和并发性能\两次拷贝
NVM器件本身的耐久性有限, 频繁对某一位置进行写操作时会造成该位置磨损, 从而缩短设备的寿命;同时, 由于具有非易失性, NVM被用作内存时, 断电后数据不会丢失, 攻击者可以通过窃取数据来提取敏感信息或对数据进行篡改;当NVM与DRAM构成混合内存时, 可能会产生指针指向不明等问题;NVM作为SCM时, 应用程序通过存取 (load/store) 接口直接对其进行访问, 绕过了文件系统等权限管理和一致性管理机制\缩短设备的寿命
NVM器件本身的耐久性有限, 频繁对某一位置进行写操作时会造成该位置磨损, 从而缩短设备的寿命;同时, 由于具有非易失性, NVM被用作内存时, 断电后数据不会丢失, 攻击者可以通过窃取数据来提取敏感信息或对数据进行篡改;当NVM与DRAM构成混合内存时, 可能会产生指针指向不明等问题;NVM作为SCM时, 应用程序通过存取 (load/store) 接口直接对其进行访问, 绕过了文件系统等权限管理和一致性管理机制\指针指向不明
现有以信息为中心的网络 (Information-Centric Network, ICN) 缓存的内容的时空分布不够合理, 存在无效缓存及同质化缓存等问题\时空分布
现有以信息为中心的网络 (Information-Centric Network, ICN) 缓存的内容的时空分布不够合理, 存在无效缓存及同质化缓存等问题\无效缓存
现有以信息为中心的网络 (Information-Centric Network, ICN) 缓存的内容的时空分布不够合理, 存在无效缓存及同质化缓存等问题\同质化缓存
实验结果表明, 相较于传统的Camshift目标跟踪算法和改进的复杂特征融合的Meanshift算法, 所提方法能够更有效地克服颜色干扰、目标重叠遮挡对跟踪效果的影响, 避免了目标在跟踪过程中丢失的问题, 突破了传统方法的局限性\颜色干扰
实验结果表明, 相较于传统的Camshift目标跟踪算法和改进的复杂特征融合的Meanshift算法, 所提方法能够更有效地克服颜色干扰、目标重叠遮挡对跟踪效果的影响, 避免了目标在跟踪过程中丢失的问题, 突破了传统方法的局限性\目标重叠遮挡
实验结果表明, 相较于传统的Camshift目标跟踪算法和改进的复杂特征融合的Meanshift算法, 所提方法能够更有效地克服颜色干扰、目标重叠遮挡对跟踪效果的影响, 避免了目标在跟踪过程中丢失的问题, 突破了传统方法的局限性\丢失
针对传统串行迭代法求解大波数Helmholtz方程存在效率低下且受限于单机内存的问题, 提出了一种基于消息传递接口 (Message Passing Interface, MPI) 的并行预条件迭代法\效率低下
针对传统串行迭代法求解大波数Helmholtz方程存在效率低下且受限于单机内存的问题, 提出了一种基于消息传递接口 (Message Passing Interface, MPI) 的并行预条件迭代法\单机内存
在分析工作流时, Petri网是一种有效的建模工具, 但在处理复杂的工作流时, 其易引发“状态空间爆炸”问题\状态空间爆炸
在激励更多感知用户参与感知任务并提供真实数据的同时如何更好地保护感知数据和感知平台的隐私安全成为一个突出而紧迫的关键问题\保护感知数据和感知平台的隐私安全
然而, 如何保障这些时空敏感数据的安全成为了一个挑战\安全
提出的设计流程解决了2个关键问题:MCSs自动枚举问题和MCSs自动选择问题\MCSs自动枚举问题
提出的设计流程解决了2个关键问题:MCSs自动枚举问题和MCSs自动选择问题\MCSs自动选择问题
针对经典的多模式匹配算法如AC算法等计算复杂度高、效率低, 同时不能适用于具有二元性的比特流数据这些问题, 该文采用一种基于AC-IM (Improved AC) 算法的链路层比特流数据频繁统计方法, 算法能在避免漏检的情况下, 使模式树的最大跳跃距离为最短模式串长度加3\计算复杂度高
针对经典的多模式匹配算法如AC算法等计算复杂度高、效率低, 同时不能适用于具有二元性的比特流数据这些问题, 该文采用一种基于AC-IM (Improved AC) 算法的链路层比特流数据频繁统计方法, 算法能在避免漏检的情况下, 使模式树的最大跳跃距离为最短模式串长度加3\效率低
针对云服务信任评估问题, 提出一种区间数多属性决策的云服务信任评估方法\信任评估问题
实验结果表明, 该方法能够客观、有效地对云服务信任做出评估, 避免了信任评估中常见的滞后、串谋和恶意评价问题\滞后
实验结果表明, 该方法能够客观、有效地对云服务信任做出评估, 避免了信任评估中常见的滞后、串谋和恶意评价问题\串谋
实验结果表明, 该方法能够客观、有效地对云服务信任做出评估, 避免了信任评估中常见的滞后、串谋和恶意评价问题\恶意评价
随着数据中心规模的扩大, 提升资源利用率的问题日益凸显\资源利用率
针对公共场合紧急情况下人群疏散困难和效果有限的问题, 提出一种基于人机社会力模型的机器人疏散人群的方法\疏散困难
针对公共场合紧急情况下人群疏散困难和效果有限的问题, 提出一种基于人机社会力模型的机器人疏散人群的方法\效果有限
相变存储器 (PCM) 凭借低功耗的优势有望成为新一代主存储器, 但是耐受性的缺陷成为其广泛应用的重要障碍\耐受性的缺陷
针对单水印存在功能单一的问题, 提出一种基于离散小波变换 (DWT) 和四元数离散余弦变换 (QDCT) 的彩色图像多功能水印算法\功能单一
针对物联网 (Io T) 传感器网络无线资源的稀缺和信道不完美带来的误差问题, 提出了一种在不完美信道状态信息 (CSI) 下为次级Io T设备 (SID) 用户分配带宽和功率的方法\资源的稀缺
针对物联网 (Io T) 传感器网络无线资源的稀缺和信道不完美带来的误差问题, 提出了一种在不完美信道状态信息 (CSI) 下为次级Io T设备 (SID) 用户分配带宽和功率的方法\信道不完美
针对多输入多输出 (MIMO) 系统获取信道信息过程中存在估计误差、反馈延迟等问题, 为了提高低信噪比 (SNR) 时的系统性能, 提出了一种基于权值可调的稳健干扰对齐算法\估计误差
针对多输入多输出 (MIMO) 系统获取信道信息过程中存在估计误差、反馈延迟等问题, 为了提高低信噪比 (SNR) 时的系统性能, 提出了一种基于权值可调的稳健干扰对齐算法\反馈延迟
针对当前互联网中多匹配域流表规模不断膨胀、匹配宽度不断增大, 导致硬件存储压力过大的问题, 提出了一种基于独立规则子集位提取 (BEIS) 的压缩方案\硬件存储压力过大
针对复调音乐中不同声源的相互干扰而导致同一声源音高序列的不连续, 从而降低音高估计精度的问题, 提出改进音高轮廓创建和选择的旋律提取算法\估计精度
与确定时间序列相比, 不确定时间序列在每个时间点上的取值不是一个确定的值, 而是一个可能值的集合, 这种不确定给时间数据的降维处理带来了巨大的挑战\降维处理
但是随着数据量和维数的增加, HDSJ的计算成本将呈指数增加\计算成本
在单一管理域的应用场景下, SDN能够方便地为应用提供转发路径, 但是当应用流需要跨越多个管理域时, 由于当前互联网域间路由协议BGP的分布式部署, 以及管理域间缺乏协商, 将难以提供跨域路径\缺乏协商
目前各行业信息系统中数据积累规模迅速增长, 传统的数据存储、处理以及应用服务难以适应持续增长的数据应用需求, 各级部门无法有效跨单位获取重要数据信息, 进而不能帮助上级机关做出重要辅助决策\增长的数据应用需求
通过在互联网中进行浏览, 避免了在实地景点游览体验度低的问题, 可获得整体景区的宏观场景可视效果, 方便游客有针对性的游览, 有助于减轻景区压力、保护景区生态人文环境\体验度低
现今主流的相机位姿精度评估方法是与GPS进行比较, 由于照片自带的GPS标签存在噪声, 且不同坐标系之间的转换存在误差, 将照片标签中的GPS作为真实值评估恢复的相机位姿精度不够客观\存在噪声
现今主流的相机位姿精度评估方法是与GPS进行比较, 由于照片自带的GPS标签存在噪声, 且不同坐标系之间的转换存在误差, 将照片标签中的GPS作为真实值评估恢复的相机位姿精度不够客观\误差
现今主流的相机位姿精度评估方法是与GPS进行比较, 由于照片自带的GPS标签存在噪声, 且不同坐标系之间的转换存在误差, 将照片标签中的GPS作为真实值评估恢复的相机位姿精度不够客观\位姿精度不够客观
架构的每个模块采用不同卷积核的多列结构, 可以拟合不同远近的个体信息;并结合前后两层的特征信息, 减少了梯度消失造成的精度下降损失\精度下降损失
现有回填算法因考虑的指标过于单一, 回填性能不佳, 导致最终完成时间较长、任务时延较大的问题\指标过于单一
现有回填算法因考虑的指标过于单一, 回填性能不佳, 导致最终完成时间较长、任务时延较大的问题\回填性能不
现有回填算法因考虑的指标过于单一, 回填性能不佳, 导致最终完成时间较长、任务时延较大的问题\时间较长
现有回填算法因考虑的指标过于单一, 回填性能不佳, 导致最终完成时间较长、任务时延较大的问题\任务时延较大
传统单一阈值的邻域粗糙集不能有效降低信息的不确定性\不能有效降低
互联网与电子商务的高速发展带来了物流业的颠覆性变革, 但目前我国物流业存在总成本偏高、技术装备偏低、配送系统效率低下的缺点\总成本偏高
互联网与电子商务的高速发展带来了物流业的颠覆性变革, 但目前我国物流业存在总成本偏高、技术装备偏低、配送系统效率低下的缺点\技术装备偏低
互联网与电子商务的高速发展带来了物流业的颠覆性变革, 但目前我国物流业存在总成本偏高、技术装备偏低、配送系统效率低下的缺点\配送系统效率低下
针对传统的三维Otsu分割算法计算量大、运算时间长等问题, 提出一种利用一维Otsu来减小迭代空间和搜索空间, 并用布谷鸟搜索算法进行寻优的算法\计算量大
针对传统的三维Otsu分割算法计算量大、运算时间长等问题, 提出一种利用一维Otsu来减小迭代空间和搜索空间, 并用布谷鸟搜索算法进行寻优的算法\运算时间长
然而, 现有的增量匹配算法处理规模较大的模式图时效率会降低\效率会降低
然而在实际开发中, 编程人员往往缺乏统一的注释规范, 大部分的注释决策都取决于个人经验以及领域知识\注释规范
对于新手程序员来说, 注释决策显然成为一项重要而艰巨的任务\注释决策
