针对Android恶意软件持续大幅增加的现状以及恶意软件检测能力不足这一问题, 提出了一种基于非用户操作序列的静态检测方法\Android恶意软件持续大幅增加
针对Android恶意软件持续大幅增加的现状以及恶意软件检测能力不足这一问题, 提出了一种基于非用户操作序列的静态检测方法\恶意软件检测能力不足
针对翻录语音攻击说话人识别系统, 危害合法用户的权益问题, 提出了一种基于卷积神经网络 (CNN) 的翻录语音检测算法\翻录语音攻击说话人识别系统
针对当前基于深度学习的显著性对象检测算法不能准确保存对象边缘的区域, 从而导致检测出的显著性对象边缘区域模糊、准确率不高的问题, 提出了一种基于多任务深度学习模型的显著性对象检测算法\显著性对象边缘区域模糊
层出不穷的SQL注入攻击使Web应用面临威胁\SQL注入攻击
针对PHP应用程序中的SQL注入行为, 提出了一种基于污点分析的SQL注入行为检测模型\SQL注入
针对夜间车辆检测精度相对不高的问题, 提出通过构建车头灯对空间几何关系的高斯混合模型 (GMM) 和采用逆投影车辆样本的Ada Boost分类器准确检测夜间车辆的方法\夜间车辆检测精度相对不高
针对传统的最大稳定极值区域 (MSER) 方法无法很好地提取低对比度图像文本区域的问题, 提出一种新的基于边缘增强的场景文本检测方法\无法很好地提取低对比度图像文本区域
针对水下声发射源较多的问题, 为能准确鉴别敌我声呐发射源, 利用数字水印技术, 结合DCT (离散余弦变换) 的时频域特征, 提出了一种基于DCT的声呐水印方法, 通过在离散余弦变换域的时频系数中嵌入数字水印, 并且综合考虑信道特性来产生数字水印, 结合二维DCT的酉矩阵特性改变水印嵌入位置和水印个数进行仿真分析测试\水下声发射源较多
针对多车辆、低分辨率等复杂环境下的车牌定位问题, 提出了一种基于人眼视觉特性的车牌识别方法\多车辆、低分辨率等复杂环境下的车牌定位问题
针对传统计算机辅助诊断系统中肺部结节检出过程复杂, 检出结果依赖于分类前期每个步骤的性能, 以及存在假阳性率高的问题, 提出了一种基于卷积神经网络的端到端的肺结节检测方法\肺部结节检出过程复杂
针对传统计算机辅助诊断系统中肺部结节检出过程复杂, 检出结果依赖于分类前期每个步骤的性能, 以及存在假阳性率高的问题, 提出了一种基于卷积神经网络的端到端的肺结节检测方法\检出结果依赖于分类前期
目前, 工业控制系统 (Industrial Control Systems, ICS) 网络安全已经成为信息安全领域的重点问题, 而检测篡改行为数据及控制程序等攻击是ICS网络安全的难点问题, 据此提出了基于行为模型的工控异常检测方法\检测篡改行为数据及控制程序
Nicholas提出了绕防方法, 但它存在可用gadget数量少、实现难度大等问题\可用gadget数量少、实现难度大
在异步请求过程中, 由于程序代码设计不合理和网络延迟等原因, 会引发异步请求错误\异步请求错误
目前的研究提出了静态和动态的分析方法检测AJAX错误, 然而忽略了返回数据中包含可能存在事件操作的异步请求, 同样可以引发异步请求错误\异步请求错误
为解决传统渗流裂缝检测方法速度较慢的问题, 提出一种样本方差与相似点判断相结合的图像裂缝检测算法\传统渗流裂缝检测方法速度较慢的问题
为改善当前金属工件装配检测存在的成本高、效率低等问题, 提出一种对复杂圆形金属工件适应性更高的零件检测方法\金属工件装配检测存在的成本高
为实现复杂视频中前景目标的分割, 需要解决前景目标准确提取难题, 但在光照情况下, 会受到阴影影响\前景目标准确提取难题,
Android组件间通信为应用程序带来了便利性的同时也增加了安全隐患, 可能导致多个应用程序协作进行共谋攻击\多个应用程序协作进行共谋攻击
工控网络异常中存在部分已知通信异常行为和部分未知通信异常行为, 白名单方法能够有效地检测规则库内的已知异常行为, 但对未知通信异常行为检测率低\对未知通信异常行为检测率低
针对认知无线电系统采用传统正交频分复用 (OFDM) 技术时, 其高频谱泄露带来的邻带间干扰及造成的主用户信号检测性能下降等问题, 提出了一种基于改进离散傅里叶变换 (MDFT) 调制滤波器组的认知无线电 (CR) 多用户接入频谱检测方案, 并推导了CR系统在应用MDFT滤波器组条件下检测概率表达式\邻带间干扰
针对认知无线电系统采用传统正交频分复用 (OFDM) 技术时, 其高频谱泄露带来的邻带间干扰及造成的主用户信号检测性能下降等问题, 提出了一种基于改进离散傅里叶变换 (MDFT) 调制滤波器组的认知无线电 (CR) 多用户接入频谱检测方案, 并推导了CR系统在应用MDFT滤波器组条件下检测概率表达式\主用户信号检测性能下降
为了提高煤矿井下监控视频的目标识别准确率, 对运动目标进行有效跟踪, 将小波变换和背景差分法相结合, 对Camshift算法进行改进, 提出了适用于煤矿井下视频多目标轨迹跟踪算法\提高煤矿井下监控视频的目标识别准确率
然而, 由于缺少网络攻击的时序逻辑公式, 该方法不能检测出常见的back, ProcessTable以及Saint 3种攻击\缺少网络攻击的时序逻辑公式
为提高老人跌倒检测的准确性, 提出基于自回归模型系数和神经网络的跌倒检测算法\提高老人跌倒检测的准确性
传统克隆选择算法通过比较样本间的亲和力累加值筛选样本, 该方法具有较低的时间复杂度, 但也造成了检测器的高重叠, 影响迭代效率\检测器的高重叠
针对新一代多普勒天气雷达CINRAD在径向或切向检测风切变时容易丢失小切变的问题, 提出了一种基于模糊C均值 (FCM) 的低空风切变预警算法用于阵风锋和龙卷风引起的风切变识别中\检测风切变时容易丢失小切变的问题
针对传统机器学习方法在车辆检测应用中易受光照、目标尺度和图像质量等因素影响, 效率低下且泛化能力较差的问题, 提出一种基于改进的较快的基于区域卷积神经网络 (R-CNN) 模型的车辆检测方法\效率低下且泛化能力较差
针对Android恶意软件检测中数据不平衡导致检出率低的问题, 提出一种基于Bagging-SVM (支持向量机) 集成算法的Android恶意软件检测模型\数据不平衡导致检出率低
针对视觉同时定位与地图构建 (SLAM) 中容易由误差累积导致构建地图不一致的问题, 提出了一种基于改进闭环检测算法的视觉SLAM (V-SLAM) 系统\误差累积导致构建地图不一致
针对数字视频帧内对象被移除的篡改操作, 提出了一种基于主成分分析 (PCA) 的篡改检测算法\数字视频帧内对象被移除的篡改操作
并行化程序运行环境中资源竞争导致的竞态漏洞是当今操作系统安全的重要威胁之一, 攻击者常常间接利用竞态漏洞实施诸如远程命令执行、本地提权等攻击行为\并行化程序运行环境中资源竞争导致的竞态漏洞
针对传统背景先验方法中背景提取不精确并且背景抑制能力弱的问题, 提出了全局对比和背景先验驱动的显著目标检测方法\背景提取不精确并且背景抑制能力弱的问题
针对公路桥梁的养护和管理, 传统的人工检测方法不仅工作危险性大、作业成本高, 而且工作效率低、检测结果可靠性差\工作效率低
针对公路桥梁的养护和管理, 传统的人工检测方法不仅工作危险性大、作业成本高, 而且工作效率低、检测结果可靠性差\检测结果可靠性差
针对公路桥梁的养护和管理, 传统的人工检测方法不仅工作危险性大、作业成本高, 而且工作效率低、检测结果可靠性差\工作危险性大
针对公路桥梁的养护和管理, 传统的人工检测方法不仅工作危险性大、作业成本高, 而且工作效率低、检测结果可靠性差\作业成本高
针对桥梁裂缝细小难获取的问题, 采用无人机装配高倍变焦摄像头的方法来采集桥梁裂缝图像\桥梁裂缝细小难获取的问题
因此, 引入机器学习来优化恶意URL检测是一个主要的研究方向, 但其主要受限于URL的短文本特性, 导致提取的特征单一, 从而使得检测效果较差\检测效果较差
为消除基本宽线检测算子中的冗余计算量, 提高其运算速度, 提出了一种快速的宽线算子实现方法——自适应移动宽线算子\基本宽线检测算子中的冗余计算量
为提高车道检测与重建检测效率, 提出基于混合贝塞尔曲线的检测算法, 采用基于小区域的扩展搜索方法确定边界区间\提高车道检测与重建检测效率
为解决肺裂检测结果易受肺病症等干扰的问题, 提出基于改进随机游走算法CT (computed tomography) 影像的肺裂检测算法\肺裂检测结果易受肺病症等干扰
油管裂纹的传统检测方法存在着设备昂贵、危险性高、检测工作量大等问题, 提出将数字图像中的检测算法应用于油管裂纹检测中\设备昂贵
油管裂纹的传统检测方法存在着设备昂贵、危险性高、检测工作量大等问题, 提出将数字图像中的检测算法应用于油管裂纹检测中\危险性高
油管裂纹的传统检测方法存在着设备昂贵、危险性高、检测工作量大等问题, 提出将数字图像中的检测算法应用于油管裂纹检测中\检测工作量大
为降低当前场景文本检测算法在图像背景复杂时检测中文文本的误检率, 提出一种基于自然场景图像的中文文本检测算法TDSI\当前场景文本检测算法在图像背景复杂时检测中文文本的误检率
针对运动车辆阴影带来车辆合并及形状失真的问题, 提出一种基于Fast RCNN模型的车辆阴影检测去除算法\运动车辆阴影带来车辆合并及形状失真的问题
针对物联网中实时采集的传感数据总体质量低下的问题, 提出基于边缘计算的传感数据异常实时检测算法\物联网中实时采集的传感数据总体质量低下的问题
随着安全性成为制约人脸识别系统应用的最大瓶颈, 提高人脸识别系统的抗欺骗攻击能力已成为亟待解决的问题\人脸识别系统的抗欺骗攻击能力
研究运动指尖点检测问题, 是用户对界面内细微点命令精确执行的关键\运动指尖点检测问题
针对日益严峻的停车难问题, 提出一种基于改进卷积神经网络停车场空车位检测方法\停车难问题
为了提高移动设备人脸检测准确率, 提出一种应用于移动设备的实时人脸检测算法\提高移动设备人脸检测准确率
针对公共场所中人群监控准确性和实时性低的问题, 提出一种基于运动显著图的人群异常行为检测方法\人群监控准确性和实时性低的问题
通过多重采样形成多分辨率图像, 引入改进后的最小障碍显著性检测算法对处理后的图像进行显著性检测;在算法运行过程中, 对算法结果与背景线索图像进行梯度分析, 将这两张图像进行融合, 改善显著性区域模糊问题\改善显著性区域模糊问题
针对传统的整数阶微分图像边缘检测算子存在的边缘模糊不清、受噪声影响大等问题, 该算法从改进传统的整数阶微分Sobel算子入手, 以分数阶微分理论为基础推导出了分数阶微分Sobel算子, 结合Sobel算子边缘检测方法, 将整数阶微分Sobel算子作为滤波器与分数阶微分Sobel算子作卷积运算, 改进了整数阶微分Sobel算子\边缘模糊不清
针对传统的整数阶微分图像边缘检测算子存在的边缘模糊不清、受噪声影响大等问题, 该算法从改进传统的整数阶微分Sobel算子入手, 以分数阶微分理论为基础推导出了分数阶微分Sobel算子, 结合Sobel算子边缘检测方法, 将整数阶微分Sobel算子作为滤波器与分数阶微分Sobel算子作卷积运算, 改进了整数阶微分Sobel算子\受噪声影响大
针对基于穿戴传感器、环境传感器和计算机视觉的摔倒检测系统具有高入侵性、低精度和鲁棒性差等缺点, 提出了一种基于深度数据分析的室内独居老人摔倒检测方法\高入侵性
针对基于穿戴传感器、环境传感器和计算机视觉的摔倒检测系统具有高入侵性、低精度和鲁棒性差等缺点, 提出了一种基于深度数据分析的室内独居老人摔倒检测方法\低精度
针对基于穿戴传感器、环境传感器和计算机视觉的摔倒检测系统具有高入侵性、低精度和鲁棒性差等缺点, 提出了一种基于深度数据分析的室内独居老人摔倒检测方法\鲁棒性差
针对传统视频检测技术识别效率低和实时性差的问题, 提出基于Kinect体感设备对人体摔倒行为进行判断识别\传统视频检测技术识别效率低和实时性差的问题
针对传统马尔科夫特征计算差值矩阵的方式单一、拼接检测鲁棒性不强的问题, 提出彩色多残差马尔科夫特征拼接检测模型\计算差值矩阵的方式单一
针对传统马尔科夫特征计算差值矩阵的方式单一、拼接检测鲁棒性不强的问题, 提出彩色多残差马尔科夫特征拼接检测模型\拼接检测鲁棒性不强
将人体运动区域检测技术应用到矿井视频中可以检测矿井下矿工的运动情况, 进一步可以智能检测矿工的异常行为, 根据反馈的检测结果实现实时报警和联动控制, 减少矿井事故的发生\智能检测矿工的异常行为
现有的用户伪装入侵检测技术存在难以准确建模用户行为模式的缺陷\难以准确建模用户行为模式的缺陷
然而, 当前链路故障检测方法面临着单次探测用时过长、网络带宽占用率过高以及服务器负载过重等严峻挑战, 并不适用于构建实时性需求较高的云服务\单次探测用时过长
然而, 当前链路故障检测方法面临着单次探测用时过长、网络带宽占用率过高以及服务器负载过重等严峻挑战, 并不适用于构建实时性需求较高的云服务\网络带宽占用率过高
然而, 当前链路故障检测方法面临着单次探测用时过长、网络带宽占用率过高以及服务器负载过重等严峻挑战, 并不适用于构建实时性需求较高的云服务\服务器负载过重
针对视觉背景提取ViBe算法在前景检测中存在的鬼影现象且长时间难以消除的缺点, 提出一种改进的视觉背景提取算法\鬼影现象且长时间难以消除
针对三维注册易受环境以及目标跟踪检测算法耗时严重、精度低的影响, 提出改进KCF (IKCF) 的跟踪注册方法\三维注册易受环境以及目标跟踪检测算法耗时严重
针对三维注册易受环境以及目标跟踪检测算法耗时严重、精度低的影响, 提出改进KCF (IKCF) 的跟踪注册方法\精度低
针对均衡边缘检测精度和抗噪性能难度大的问题, 借鉴初级视皮层 (V1) 细胞的动静态感知特性, 建立具有方位选择性的V1细胞模型应用于图像边缘检测\均衡边缘检测精度和抗噪性能难度大的问题
针对电力接触线磨耗检测中效率低、实时性差和精度低的问题, 设计了一种基于线阵相机的非接触式测量系统\电力接触线磨耗检测中效率低
针对电力接触线磨耗检测中效率低、实时性差和精度低的问题, 设计了一种基于线阵相机的非接触式测量系统\实时性差和精度低
如今程序控制流错误已成为影响嵌入式计算机可靠性的主要因素之一\程序控制流错误
在现实生活中, 嵌入式系统的计算机受很多因素影响 (比如辐射、硬件故障、环境干扰等) , 从而导致程序出现控制流错误使程序不能正常运行\控制流错误
对此, 介绍了一种针对程序控制流错误的检测方法, 该方法对程序进行基本块划分, 为每个基本块设置静态标签, 采用后继块信息标签, 与程序运行时产生的动态标签进行匹配, 从而检测控制流错误\程序控制流错误
对此, 介绍了一种针对程序控制流错误的检测方法, 该方法对程序进行基本块划分, 为每个基本块设置静态标签, 采用后继块信息标签, 与程序运行时产生的动态标签进行匹配, 从而检测控制流错误\检测控制流错误
每个基本块都在起始处和结束处各进行一次检测判断, 双重检测判断可较有效地检测出控制流错误, 并且该方法能够在当前基本块发现控制流错误, 不延迟到后面的基本块, 较有效地解决了基本块间检测的滞后性问题\控制流错误
现有的基于简单点判断的三维细化算法不能保证提取骨架的连续性, 容易产生断裂\不能保证提取骨架的连续性
针对当前行人检测方法计算量大, 行人特征提取复杂, 检测结果易受复杂背景影响等问题, 提出一种改进的卷积神经网络 (convolutional neural network, CNN) 模型\计算量大
针对当前行人检测方法计算量大, 行人特征提取复杂, 检测结果易受复杂背景影响等问题, 提出一种改进的卷积神经网络 (convolutional neural network, CNN) 模型\行人特征提取复杂
针对当前行人检测方法计算量大, 行人特征提取复杂, 检测结果易受复杂背景影响等问题, 提出一种改进的卷积神经网络 (convolutional neural network, CNN) 模型\ 检测结果易受复杂背景影响
为解决传统工业网络异常检测系统具有误报率高、状态构建不够灵活等问题, 提出一种基于信息量的双层确定性有限自动机模型 (IDDFA) \误报率高
为解决传统工业网络异常检测系统具有误报率高、状态构建不够灵活等问题, 提出一种基于信息量的双层确定性有限自动机模型 (IDDFA) \状态构建不够灵活
为加快唐检测算法的检测速度, 提出基于剔除门限的唐检测改进算法\加快唐检测算法的检测速度
为解决交通车辆管理中的车牌定位问题, 提出一种基于相邻像素差异值的车牌定位算法\交通车辆管理中的车牌定位问题
为准确检测出视频的镜头边界, 有效区分突变和渐变镜头, 提出一种基于双重检测的镜头分割方法\准确检测出视频的镜头边界
为准确检测出视频的镜头边界, 有效区分突变和渐变镜头, 提出一种基于双重检测的镜头分割方法\区分突变和渐变镜头
但是, 一个含有漏洞的函数通常也包含一些与已知漏洞无关的语句, 严重影响相似度计算的结果, 从而引发误报和漏报\误报和漏报
描述了当前软件中实际存在的一种新类型的安全漏洞隐患, 称为数值稳定性相关的安全漏洞隐患\数值稳定性相关的安全漏洞隐患
面对这一挑战, 首先从数值稳定性引起软件行为改变的角度定义了数值稳定性相关的安全漏洞隐患, 并给出了对应的自动化检测方法\数值稳定性相关的安全漏洞隐患
该方法基于动静态相结合的程序分析与符号执行技术, 通过数值变量符号式提取、静态攻击流程分析以及高精度动态攻击验证这3个步骤来检测和分析软件中可能存在的数值稳定性相关安全漏洞\数值稳定性相关安全漏洞
在业界多个著名开源软件上进行了实例研究, 实验结果表明:该方法能够有效检测到实际软件中真实存在的数值稳定性相关漏洞隐患\数值稳定性相关漏洞隐患
资源泄漏是影响软件质量和可靠性的一种重要软件缺陷, 存在资源泄漏的程序长时间运行会由于资源耗尽而发生异常甚至崩溃\资源泄漏
资源泄漏是影响软件质量和可靠性的一种重要软件缺陷, 存在资源泄漏的程序长时间运行会由于资源耗尽而发生异常甚至崩溃\资源泄漏
静态代码分析是进行资源泄漏检测的一种有效的技术手段, 能够基于源代码或者二进制代码有效地发现程序中潜在的资源泄漏问题\资源泄漏问题
无人飞行系统 (unmanned aerial system, 简称UAS) 的软、硬件存在缺陷以及遇到外部恶意攻击, 会给UAS的安全性带来极大的威胁\外部恶意攻击
针对具有多个显著目标且背景较为复杂的图像, 提出了一种基于全连接图和稀疏主成分分析 (sparse principal component analysis, sPCA) 的显著性检测方法\具有多个显著目标且背景较为复杂的图像
针对以套取广告费为目的、实施恶意点击欺诈的不法发布商检测问题, 提出一种基于支持向量机 (Support Vector Machine, SVM) 集成方法的点击欺诈检测系统\实施恶意点击欺诈的不法发布商检测问题
运动目标检测是智能视频分析的一个重要环节, 现有的检测方法主要是在像素域中进行处理, 存在计算复杂度高、检测目标不完整等问题\计算复杂度高
运动目标检测是智能视频分析的一个重要环节, 现有的检测方法主要是在像素域中进行处理, 存在计算复杂度高、检测目标不完整等问题\检测目标不完整
针对人体跌倒检测算法存在错误否定率高的问题, 研究了一种基于D-S证据理论的人体跌倒检测算法\错误否定率高
对于人体行为动作中也存在作为时间序列的长期依赖问题与使用传统滑窗算法采集数据时造成的无法实时检测的问题, 将LSTM扩展应用到人体姿态检测, 提出了基于LSTM的人体姿态检测方法\无法实时检测
对于在工业生产中如何有效地识别薄壁金属罐焊缝的缺陷及其类型判别的问题, 提出了一种基于机器视觉技术的自动化焊缝缺陷检测及分类算法\识别薄壁金属罐焊缝的缺陷及其类型
设计了一种快速准确的算法, 实现了环境复杂、样本缺少情况下实时车辆检测和车型识别, 特别是对三轮车的识别\实时车辆检测和车型识别
为解决视频目标跟踪中背景噪声、目标遮挡等问题, 构建一种基于模型融合和特征关联的多目标跟踪算法\视频目标跟踪中背景噪声
为解决视频目标跟踪中背景噪声、目标遮挡等问题, 构建一种基于模型融合和特征关联的多目标跟踪算法\目标遮挡
实验结果表明, 该算法能够准确提取出运动目标轮廓, 解决目标间相互遮挡导致的跟踪失效问题, 有效地提高了多目标跟踪的准确率和鲁棒性\跟踪失效问题
基于此, 设计了一种基于图像特征分析的AOD炉炉衬风口侵蚀识别方法, 运用数字图像处理技术实现炉衬风口侵蚀面积的提取\炉衬风口侵蚀面积的提取
针对货车尺寸的快速精确测量, 提出了一种基于双目视觉的测量方法\货车尺寸的快速精确测量
由于高光谱数据的高维度增加了存储空间和数据处理的复杂度, 实时处理成为了目标检测面临的重要问题\实时处理
为提高裁断橡胶轮胎长度的精确度, 设计一种基于机器视觉技术的轮胎胎面检测系统\提高裁断橡胶轮胎长度的精确度
针对基于用户行为的应用层DDoS检测算法中样本训练过程繁琐以及模型更新困难2个难点, 提出一种基于改进AP聚类算法的自学习应用层DDoS检测方法\样本训练过程繁琐以及模型更新困难
通过检测突变驱动通路研究癌症的发病机理是当前癌症基础性研究的关键问题之一\检测突变驱动通路研究癌症的发病机理
针对智能监控领域精确运动检测的高实时性的需求, 本文提出两种基于RPCA背景建模方法\精确运动检测的高实时性的需求
为此, 提出一种结合迁移学习的深度神经网络异常检测方法, 用以提高标签样本数量不足情况下的异常检测性能\提高标签样本数量不足情况下的异常检测性能
为了解决特征码匹配技术对于未知或多态shellcode检测效率较低的问题, 提出一种基于人工免疫系统的shellcode检测算法AIS-SDA\特征码匹配技术对于未知或多态shellcode检测效率较低
传统粗糙集的离群点检测方法不能有效处理数值型属性数据, 故提出邻域粗糙集中基于序列的混合型属性离群点检测方法\不能有效处理数值型属性数据
针对现有海量非平衡数据集中少数类别样本入侵检测率低的问题, 提出了一种基于合成少数类过采样技术 (SMOTE) 和深度信念网络 (DBN) 的异常检测 (SMOTE-DBN) 方法\海量非平衡数据集中少数类别样本入侵检测率低
针对当前振动检测系统延迟大、传感网络可控性差、检测精度低等问题, 提出了一种基于过程现场总线 (Profibus) 技术的振动检测系统\振动检测系统延迟大
针对当前振动检测系统延迟大、传感网络可控性差、检测精度低等问题, 提出了一种基于过程现场总线 (Profibus) 技术的振动检测系统\传感网络可控性差
针对当前振动检测系统延迟大、传感网络可控性差、检测精度低等问题, 提出了一种基于过程现场总线 (Profibus) 技术的振动检测系统\检测精度低
