针对现有去雾算法在估计大气光向量时, 所采用的方法包含的大气光候选点数量较少, 导致估计结果在统计意义上误差较大这一问题, 提出了基于高斯分布的大气光估计算法\现有去雾算法在估计大气光向量时
针对现有去雾算法在估计大气光向量时, 所采用的方法包含的大气光候选点数量较少, 导致估计结果在统计意义上误差较大这一问题, 提出了基于高斯分布的大气光估计算法\所采用的方法包含的大气光候选点数量较少
针对现有去雾算法在估计大气光向量时, 所采用的方法包含的大气光候选点数量较少, 导致估计结果在统计意义上误差较大这一问题, 提出了基于高斯分布的大气光估计算法\估计结果在统计意义上误差较大这一问题
基于稀疏表示的图像超分辨率重建算法以近似随机抽取的方式选取字典中的原子来拟合图像片, 而实际中的字典原子的选择体现出了很强的结构稀疏性, 从而导致算法计算复杂且引入了大量的误差, 影响重建图像的质量\算法计算复杂
基于稀疏表示的图像超分辨率重建算法以近似随机抽取的方式选取字典中的原子来拟合图像片, 而实际中的字典原子的选择体现出了很强的结构稀疏性, 从而导致算法计算复杂且引入了大量的误差, 影响重建图像的质量\引入了大量的误差
基于稀疏表示的图像超分辨率重建算法以近似随机抽取的方式选取字典中的原子来拟合图像片, 而实际中的字典原子的选择体现出了很强的结构稀疏性, 从而导致算法计算复杂且引入了大量的误差, 影响重建图像的质量\影响重建图像的质量
为了提高脑肿瘤分割的精确性和鲁棒性, 提出一种结合卷积神经网络和模糊推理系统的全自动脑肿瘤MRI图像分割算法\提高脑肿瘤分割的精确性
为了提高脑肿瘤分割的精确性和鲁棒性, 提出一种结合卷积神经网络和模糊推理系统的全自动脑肿瘤MRI图像分割算法\鲁棒性
为了提高半脆弱图像水印算法的认证能力, 提出了基于边缘检测与Zernike不变矩的半脆弱图像水印认证算法\提高半脆弱图像水印算法的认证能力
针对目前Direct Send图像合成方法中存在的不足, 提出一种通信开销最小的Direct Send并行图像合成方法, 该方法首先使用GPU多线程方式统计各个绘制节点图像的有效像素前缀和, 再利用动态规划方法计算有效像素前缀和列表的最佳分割位置, 使并行图像合成的通信开销最小\目前Direct Send图像合成方法中存在的不足
针对传统的自适应分数阶偏微分方程图像增强算法对图像暗区纹理区域的增强不足的缺点, 考虑到人眼对光感的敏感程度不同, 将亮度对视觉的影响因素考虑进传统的自适应分数阶偏微分方程图像增强算法\传统的自适应分数阶偏微分方程图像增强算法对图像暗区纹理区域的增强不足
该模型改善了传统算法对暗区图像增强不足的缺点, 图像增强后的平均梯度提升明显, 很好地改善了图像的视觉效果\传统算法对暗区图像增强不足
为了有效改进图像的加密效果及安全性, 在对已有的图像加密算法进行分析的基础上, 提出基于混沌映射的位变换和DNA序列的图像加密算法\有效改进图像的加密效果及安全性
为了解决传感器雾天条件下捕获的遥感影像出现模糊, 色彩偏移, 地物信息丢失严重等问题, 结合饱和度运算和暗通道理论提出一种遥感图像去雾算法 (简称RSIDA算法) \解决传感器雾天条件下捕获的遥感影像出现模糊
为了解决传感器雾天条件下捕获的遥感影像出现模糊, 色彩偏移, 地物信息丢失严重等问题, 结合饱和度运算和暗通道理论提出一种遥感图像去雾算法 (简称RSIDA算法) \色彩偏移
为了解决传感器雾天条件下捕获的遥感影像出现模糊, 色彩偏移, 地物信息丢失严重等问题, 结合饱和度运算和暗通道理论提出一种遥感图像去雾算法 (简称RSIDA算法) \地物信息丢失严重等问题
针对基于双向深度图像绘制技术 (Double-sided Depth-Image Based Rendering, Double-sided DIBR) 中产生的空洞、重采样、重叠问题, 为提高虚拟图像的合成质量, 提出一种改进的正反向映射技术\产生的空洞
针对基于双向深度图像绘制技术 (Double-sided Depth-Image Based Rendering, Double-sided DIBR) 中产生的空洞、重采样、重叠问题, 为提高虚拟图像的合成质量, 提出一种改进的正反向映射技术\重采样
针对基于双向深度图像绘制技术 (Double-sided Depth-Image Based Rendering, Double-sided DIBR) 中产生的空洞、重采样、重叠问题, 为提高虚拟图像的合成质量, 提出一种改进的正反向映射技术\重叠问题
针对变压器套管工况识别难度大的实际, 提出了基于图像匹配的变压器套管工况识别方法\变压器套管工况识别难度大
针对去除周期性噪声的同时容易造成图像的失真或降噪效果不理想的问题, 提出了一种基于权重自适应形态学的周期性噪声去除方法\去除周期性噪声的同时容易造成图像的失真
针对去除周期性噪声的同时容易造成图像的失真或降噪效果不理想的问题, 提出了一种基于权重自适应形态学的周期性噪声去除方法\降噪效果不理想的问题
全变差 (TV) 理论对图像降噪处理的效果不太理想, 同时为了克服边缘的过度平滑和抑制降噪后图像易产生的“模糊现象”和“块状效应”的问题, 在四阶导数对“阶梯效应”抑制优势的基础上, 提出了一种基于四阶微分全变差的图像去噪模型\克服边缘的过度平滑
全变差 (TV) 理论对图像降噪处理的效果不太理想, 同时为了克服边缘的过度平滑和抑制降噪后图像易产生的“模糊现象”和“块状效应”的问题, 在四阶导数对“阶梯效应”抑制优势的基础上, 提出了一种基于四阶微分全变差的图像去噪模型\抑制降噪后图像易产生的“模糊现象”
全变差 (TV) 理论对图像降噪处理的效果不太理想, 同时为了克服边缘的过度平滑和抑制降噪后图像易产生的“模糊现象”和“块状效应”的问题, 在四阶导数对“阶梯效应”抑制优势的基础上, 提出了一种基于四阶微分全变差的图像去噪模型\“块状效应”的问题
全变差 (TV) 理论对图像降噪处理的效果不太理想, 同时为了克服边缘的过度平滑和抑制降噪后图像易产生的“模糊现象”和“块状效应”的问题, 在四阶导数对“阶梯效应”抑制优势的基础上, 提出了一种基于四阶微分全变差的图像去噪模型\全变差 (TV) 理论对图像降噪处理的效果不太理想
然而, 指纹在采集和传输的过程中会不可避免地受到外界噪声的污染, 从而影响指纹识别系统的准确性\指纹在采集和传输的过程中会不可避免地受到外界噪声的污染
随着计算机并行计算技术的快速发展, 需要处理的数据量越来越大, 提升并行计算的能力成为亟待解决的一个问题\提升并行计算的能力
对于视频监控图像模糊难以辨别的情况, 提出了基于C++AMP的改进Canny算子的图像边缘信息处理方法\视频监控图像模糊难以辨别的情况
近年来, 数字多媒体图像出现了爆炸式的增长, 人们在互联网搜索过程中遇到的问题也越来越多, 提高图像的搜索效率极具挑战性\提高图像的搜索效率极具挑战性
为了解决海上目标航空遥感图像重复特征较多导致的匹配不一致问题, 并简化匹配过程, 文中提出了基于SIFT视觉约束能量最小化的匹配算法 (CEM-SIFT) \解决海上目标航空遥感图像重复特征较多导致的匹配不一致问题
由于由于不同b值的扩散加权图像中的信号衰减程度不同且同一b值图像内存在灰度不均匀性, 因此使用传统的配准算法会导致在将不同b值图像配准到b0图像的过程中产生较大的偏移, 尤其是在高b值的图像上\传统的配准算法会导致在将不同b值图像配准到b0图像的过程中产生较大的偏移
针对目标移除修复方法中存在的修复顺序不合理以及错误匹配问题, 提出一种基于结构稀疏度和块差异度的图像修复方法\目标移除修复方法中存在的修复顺序不合理
针对目标移除修复方法中存在的修复顺序不合理以及错误匹配问题, 提出一种基于结构稀疏度和块差异度的图像修复方法\错误匹配问题
其次, 定义目标块与样本块之间的差异度, 并在此基础上定义新的匹配规则, 不仅对已存在像素之间的相似程度进行衡量, 而且对已存在像素与填充像素之间的差异程度进行衡量, 从而有效防止错误匹配以及错误累积\防止错误匹配
其次, 定义目标块与样本块之间的差异度, 并在此基础上定义新的匹配规则, 不仅对已存在像素之间的相似程度进行衡量, 而且对已存在像素与填充像素之间的差异程度进行衡量, 从而有效防止错误匹配以及错误累积\错误累积
针对传统边缘检测方法未能在抗噪性能与边缘检测精度之间取得较好的权衡的问题, 利用鲁棒主成分分析模型良好的矩阵恢复能力与图像模糊边缘检测算法较佳的边缘检测性能, 提出一种基于RPCA的图像模糊边缘检测算法, 将图像的边缘检测问题转化为图像主成分的边缘检测问题\传统边缘检测方法未能在抗噪性能与边缘检测精度之间取得较好的权衡的问题
针对雾天条件下户外图像存在清晰度降低和色彩偏移的现象, 提出一种基于引导滤波改进的暗原色去雾算法\雾天条件下户外图像存在清晰度降低
针对雾天条件下户外图像存在清晰度降低和色彩偏移的现象, 提出一种基于引导滤波改进的暗原色去雾算法\色彩偏移的现象
针对传统自适应中值滤波算法的不足, 提出一种基于分数阶积分的自适应中值滤波算法\传统自适应中值滤波算法的不足
边缘停止函数的结构不同导致基于轮廓迭代的静态图像分割算法存在控制边缘精度的能力低、大误差轮廓演变为精确轮廓的速度慢等问题, 为此, 从改进停止函数的结构入手, 以整数阶Sobel算子为例, 引入整数阶Sobel算子, 通过建立分数阶权系数矩阵定义新的分数阶Sobel算子, 提出基于分数阶权系数矩阵的边缘停止函数\边缘停止函数的结构不同导致基于轮廓迭代的静态图像分割算法存在控制边缘精度的能力低
边缘停止函数的结构不同导致基于轮廓迭代的静态图像分割算法存在控制边缘精度的能力低、大误差轮廓演变为精确轮廓的速度慢等问题, 为此, 从改进停止函数的结构入手, 以整数阶Sobel算子为例, 引入整数阶Sobel算子, 通过建立分数阶权系数矩阵定义新的分数阶Sobel算子, 提出基于分数阶权系数矩阵的边缘停止函数\大误差轮廓演变为精确轮廓的速度慢等问题
为提高三维CT图像分割精度, 提出先验知识增强的GrabCut分割方法\提高三维CT图像分割精度
为减少图像伪造检测的计算复杂度并提高精度, 设计基于扩展块与随机样本一致性的建筑图像伪造检测方案\减少图像伪造检测的计算复杂度
为减少图像伪造检测的计算复杂度并提高精度, 设计基于扩展块与随机样本一致性的建筑图像伪造检测方案\提高精度
为解决当前图像分割算法对噪声鲁棒性差的缺陷, 改善图像分割的效果, 设计基于改进布谷鸟搜索算法的图像分割方法\当前图像分割算法对噪声鲁棒性差的缺陷
为解决当前图像分割算法对噪声鲁棒性差的缺陷, 改善图像分割的效果, 设计基于改进布谷鸟搜索算法的图像分割方法\图像分割的效果
为有效消除毫米波 (MMW) 图像中的非线性噪声, 利用T-S模糊神经网络 (T-S-FNN) 对不确定信息进行有效区分的特性, 实现MMW图像中非线性信息噪声的逼近, 达到消噪的目的\有效消除毫米波 (MMW) 图像中的非线性噪声
为克服T-S-FNN规则冗余的缺点, 考虑前件网络基于自适应模糊聚类的隶属度函数约束及后件网络的权值优化学习, 对其前件及后件的结构和学习算法进行改进, 使T-S-FNN的计算简化、鲁棒性更强\T-S-FNN规则冗余
针对偏暗、低对比度图像视觉显著性图提取效果不理想的问题, 提出一种基于改进的直方图均衡化的图像显著性图提取算法\偏暗、低对比度图像视觉显著性图提取效果不理想的问题
作者通过分析发现某些偏暗、低对比度图像的视觉显著性图提取效果不理想的主要原因是由于图像背景与前景差异不明显导致的, 因此本文提出采用直方图均衡化方法对图像的质量加以改善, 并对传统直方图均衡化算法存在的曝光过度等问题有针对性的进行了改进, 并以此提高图像前景与背景之间的差异, 使得图像的显著区域更加突出, 再对处理后的图像进行显著性图的提取\曝光过度
针对彩色图像在去噪时易产生模糊现象和伪色彩的问题, 提出多信息结合字典算法\彩色图像在去噪时易产生模糊现象
针对彩色图像在去噪时易产生模糊现象和伪色彩的问题, 提出多信息结合字典算法\伪色彩的问题
针对Canny算法对较高密度椒盐噪声和双阈值选取方面存在的不足, 提出一种改进方法, 采用多尺度自适应各向异性扩散方程对图像进行平滑, 有效去除较高密度脉冲信号的同时又可以更好地保留边缘轮廓信息\Canny算法对较高密度椒盐噪声和双阈值选取方面存在的不足
图像语义自动标注问题是现阶段一个具有挑战性的难题\图像语义自动标注问题
针对传统图像分割算法分割蓝藻图像准确率不足的问题, 提出了一种基于深度神经网络 (DNN) 和生成式对抗网络 (GAN) 思想的网络结构, 称为深度生成式对抗网络 (DGAN) \传统图像分割算法分割蓝藻图像准确率不足的问题
针对图像分辨率较低的问题, 提出了一种基于四通道卷积稀疏编码的图像超分辨率重建方法\图像分辨率较低的问题,
针对基于总变分最小化的图像修复模型容易造成阶梯效应及假边缘的问题, 提出了基于对数函数的非局部总变分图像修复模型\基于总变分最小化的图像修复模型容易造成阶梯效应及假边缘的问题
有雾图像的复原问题已经成为了机器视觉领域研究的热点\有雾图像的复原问题
为了对图像中的显著目标进行更精确的识别, 提出了一种基于边界先验和自适应区域合并的显著性检测算法\对图像中的显著目标进行更精确的识别
强噪声下核磁共振图像的脑组织分割一直是个难题, 引起很多学者的关注\强噪声下核磁共振图像的脑组织分割
其中, 一个最关键的问题是保持两幅人脸中器官特征的约束映射\保持两幅人脸中器官特征的约束映射
针对一阶导数Canny算子边缘检测图像断裂处较多以及连通性较差的问题, 研究给出了基于广度优先的边缘连接算法, 通过连接边缘检测图像的端点减少边缘检测图像的断裂处数量, 在Canny算子的基础上实现了图像边缘的优化\一阶导数Canny算子边缘检测图像断裂处较多
针对一阶导数Canny算子边缘检测图像断裂处较多以及连通性较差的问题, 研究给出了基于广度优先的边缘连接算法, 通过连接边缘检测图像的端点减少边缘检测图像的断裂处数量, 在Canny算子的基础上实现了图像边缘的优化\连通性较差的问题
随着国内机动车辆数目的不断增加, 如何对众多的机动车进行有效管理已成为当前交通管理机构面临的主要问题\如何对众多的机动车进行有效管理
为提高低照度室内烟雾的计算机视觉检测技术的可靠性, 研究低照度烟雾图像的去噪算法\提高低照度室内烟雾的计算机视觉检测技术的可靠性
为克服传统边缘函数 (edge-stop functions, ESFs) 不能停止模糊边界问题, 提出一种方法构建一组边缘停止函数的活动轮廓模型实现模糊边界的分割\克服传统边缘函数 (edge-stop functions, ESFs) 不能停止模糊边界问题
针对彩色图像边缘提取算法产生伪边缘和间断边缘的不足, 提出自适应向量总变分与色彩差异的彩图边缘提取方案\彩色图像边缘提取算法产生伪边缘和间断边缘的不足
为解决当前水印技术主要是将相同的水印容量嵌入到图像中的每个像素值, 使其水印容量较小, 以及抗失真性能不佳的不足, 设计混合进制系统与像素差异的数据水印算法\水印容量较小
为解决当前水印技术主要是将相同的水印容量嵌入到图像中的每个像素值, 使其水印容量较小, 以及抗失真性能不佳的不足, 设计混合进制系统与像素差异的数据水印算法\抗失真性能不佳
为提高加密图像的安全性和解密图像质量, 提出一种异或-置乱框架下邻域预测加密域可逆信息隐藏算法\提高加密图像的安全性
为提高加密图像的安全性和解密图像质量, 提出一种异或-置乱框架下邻域预测加密域可逆信息隐藏算法\解密图像质量
针对图像的去重面临以下三个挑战:需要支持图像模糊去重;需要对相似图像进行所有权认证;需要进行图像感知质量评价\需要支持图像模糊去重
针对图像的去重面临以下三个挑战:需要支持图像模糊去重;需要对相似图像进行所有权认证;需要进行图像感知质量评价\需要对相似图像进行所有权认证
针对图像的去重面临以下三个挑战:需要支持图像模糊去重;需要对相似图像进行所有权认证;需要进行图像感知质量评价\需要进行图像感知质量评价
针对水印图像轮廓特征的提取, 使用小波变换并不是最佳方式, 脊波变换较小波变换有着更好的逼近精度和稀疏性能\水印图像轮廓特征的提取
针对GrabCut算法图像分割效率及精度低的问题, 提出了一种改进的One-Cut交互式图像分割算法\GrabCut算法图像分割效率及精度低的问题
针对单一特征表示的局限性会导致细粒度图像分类准确度不高的问题, 提出了一种基于卷积神经网络 (CNN) 和尺度不变特征转换 (SIFT) 的多特征组合表示方法, 综合考虑对目标整体、关键部位和关键点的特征提取\单一特征表示的局限性会导致细粒度图像分类准确度不高的问题
针对传统SURF算法在构建局部特征描述符时耗时较长, 无法满足实时性要求的问题, 提出了一种改进的SURF算法\传统SURF算法在构建局部特征描述符时耗时较长
针对传统SURF算法在构建局部特征描述符时耗时较长, 无法满足实时性要求的问题, 提出了一种改进的SURF算法\无法满足实时性要求的问题
针对目前的打印文件识别方法受限于样本中必须有相同字符的问题, 提出一种基于字符图像分割的打印文件识别方法\目前的打印文件识别方法受限于样本中必须有相同字符的问题
提出了一种特征点快速稀疏提取算法, 该方法首先利用高斯拉普拉斯算子 (Laplacian of Gaussian, LoG) 提取图像梯度, 设定阈值过滤获得图像的边缘稀疏矩阵, 然后在稀疏矩阵的基础上利用改进的加速分割测试特征 (Features from Accelerated Segment Test, FAST) 检测算法, 解决了传统匹配算法提取特征点耗时的问题, 使图像实时匹配成为可能\传统匹配算法提取特征点耗时的问题
为减少误匹配对, 利用感知哈希算法对匹配对进行提纯, 并根据仿射不变性建立两个约束条件进一步验证单应性矩阵, 提高配准精度\减少误匹配对
实验结果表明, 该算法能明显改善由于相机成像环境限制等导致岩石序列图像色差不一致的问题, 全薄片拼接结果图视觉效果佳, 有利于岩石薄片的研究与保存\由于相机成像环境限制等导致岩石序列图像色差不一致的问题
为了提高二值图像的信息隐藏容量和保持载密图像良好的视觉效果, 避免图像因分块后出现“黑白孤岛点”现象, 提出一种基于分块和混沌序列的二值图像信息隐藏算法\提高二值图像的信息隐藏容量
为了提高二值图像的信息隐藏容量和保持载密图像良好的视觉效果, 避免图像因分块后出现“黑白孤岛点”现象, 提出一种基于分块和混沌序列的二值图像信息隐藏算法\保持载密图像良好的视觉效果
鉴于从噪声图像上提取的原生图块协方差矩阵的最小特征值与噪声水平值之间具有显著的相关性, 提出一种基于多项式回归技术训练非线性映射模型, 直接将原生图块最小特征值修正为最终的噪声水平预测值的快速噪声水平估计算法\从噪声图像上提取的原生图块协方差矩阵的最小特征值与噪声水平值之间具有显著的相关性
当前计算FOE的算法对噪声敏感且计算量大, 不能准确地计算铁路场景中的FOE\当前计算FOE的算法对噪声敏感且计算量大
当前计算FOE的算法对噪声敏感且计算量大, 不能准确地计算铁路场景中的FOE\不能准确地计算铁路场景中的FOE
针对目前基于单模态图像的肺部肿瘤区域分割的精度较低等问题, 综合PET和CT图像的优缺点, 提出一种全新的多模态肺部肿瘤图像分割方法\基于单模态图像的肺部肿瘤区域分割的精度较低等问题
该方法存在重现目标对比度较低的问题\重现目标对比度较低的问题
针对复杂图像易受背景干扰的问题, 提出一种基于显著性与脉冲耦合神经网络 (Saliency and Pulse Coupled Neural Network, SPCNN) 的图像分割方法\复杂图像易受背景干扰的问题
针对以往稀疏编码在图像去噪过程中存在的噪声残留和缺乏对图像的边缘与细节的本质特征的保护等问题, 提出了一种结合第二代Bandelet变换分块的字典学习图像去噪算法, 其更好地利用了图像的几何特性进行去噪\以往稀疏编码在图像去噪过程中存在的噪声残留
针对以往稀疏编码在图像去噪过程中存在的噪声残留和缺乏对图像的边缘与细节的本质特征的保护等问题, 提出了一种结合第二代Bandelet变换分块的字典学习图像去噪算法, 其更好地利用了图像的几何特性进行去噪\缺乏对图像的边缘
针对以往稀疏编码在图像去噪过程中存在的噪声残留和缺乏对图像的边缘与细节的本质特征的保护等问题, 提出了一种结合第二代Bandelet变换分块的字典学习图像去噪算法, 其更好地利用了图像的几何特性进行去噪\细节的本质特征的保护
现有的单幅散焦图像深度恢复算法大多存在算法复杂, 对图像边缘、复杂纹理及阴影区域恢复效果差等问题\单幅散焦图像深度恢复算法大多存在算法复杂
现有的单幅散焦图像深度恢复算法大多存在算法复杂, 对图像边缘、复杂纹理及阴影区域恢复效果差等问题\图像边缘、复杂纹理及阴影区域恢复效果差
许多图像分类问题具有类内相似而类间差异的特点, 然而花卉图像的分类往往存在着类间相似和类内差异的现象, 因此, 基于传统人工设计的图像特征进行花卉图像分类效果一般不够理想\基于传统人工设计的图像特征进行花卉图像分类效果一般不够理想
如何在海量的图像数据中获得想要的和有用的信息也变得越来越重要\如何在海量的图像数据中获得想要的和有用的信息
针对单幅表情图像识别缺乏表情间关联性及单分类器的局限性问题, 提出一种基于反向协同显著区域特征的人脸表情识别方法\单幅表情图像识别缺乏表情间关联性及单分类器的局限性问题
针对目前多目标服装图像存在复杂的背景以及遮挡, 导致分割准确率较低的问题, 提出一种多目标服装图像的协同分割方法\目前多目标服装图像存在复杂的背景
针对目前多目标服装图像存在复杂的背景以及遮挡, 导致分割准确率较低的问题, 提出一种多目标服装图像的协同分割方法\遮挡
针对目前多目标服装图像存在复杂的背景以及遮挡, 导致分割准确率较低的问题, 提出一种多目标服装图像的协同分割方法\导致分割准确率较低的问题
针对遥感图像空间分辨率和光谱分辨率不可兼得的情况, 结合多尺度变换与稀疏表示, 提出一种shearlet稀疏基与引导滤波共同作用的遥感图像融合算法\遥感图像空间分辨率和光谱分辨率不可兼得的情况
针对单一生物特征识别技术易受外界各种因素影响, 识别率和稳定性有待提高的问题, 提出一种掌纹掌脉图像超小波域融合识别算法NSCT-NBP\单一生物特征识别技术易受外界各种因素影响
针对单一生物特征识别技术易受外界各种因素影响, 识别率和稳定性有待提高的问题, 提出一种掌纹掌脉图像超小波域融合识别算法NSCT-NBP\识别率和稳定性有待提高的问题
