如何综合各类新型存储的特性, 设计高能效的存储架构, 实现可应对大数据、云计算所需求的新型主存系统已经成为工业界和学术界的研究热点\存储架构
提出基于高性能SOC FPGA阵列的NVM验证架构, 互联多级FPGA, 利用多层次FPGA结构扩展链接多片NVM\NVM验证架构
依据所提出的验证架构, 设计了基于多层次FPGA的主从式NVM控制器, 并完成适用于该架构的硬件原型设计\基于多层次FPGA的主从式NVM控制器
在面向服务的架构中, 软件功能通常被封装为服务, 并以开放可编程接口的方式提供应用\面向服务的架构
首先, 提出了一个支持事务级属性的层次化服务组合模型, 然后根据服务间数据依赖关系来识别服务事务粒度, 最后基于事务粒度识别与服务补偿机制, 提出了一种服务组合失效处理方法, 促使服务组合的可信性增强演化\事务粒度识别与服务补偿机制
研究成果对异构计算系统Linpack的性能优化以及未来高效异构架构的设计具有一定的指导意义\高效异构架构
提出完整的现代城市智慧照明控制系统解决方案, 从终端层、感知层、硬件层、通信层、控制层和应用层6个层次分析城市智慧照明的系统架构, 在此基础上研发一套分布式远程城市智慧照明控制系统\城市智慧照明的系统架构
采用B/S和C/S混合架构, 游览器通过WCF通道与服务器并发通信, 服务器通过GPRS网络与微型控制器建立长连接\B/S
采用B/S和C/S混合架构, 游览器通过WCF通道与服务器并发通信, 服务器通过GPRS网络与微型控制器建立长连接\C/S
边缘计算 (edge computing, EC) 是在靠近人、物或数据源头的网络边缘侧, 融合网络、计算、存储、应用核心能力的新网络架构和开放平台\新网络架构
边缘计算将传统的集中式云计算处理的方式, 改为将计算存储能力下移至网络边缘, 面向用户和终端的方式, 就近提供边缘智能服务\边缘计算
边缘计算极大地降低了由于数据回传造成的核心网和传输网的拥塞与负担, 实现较低时延, 带来较高带宽, 同时能够快速响应用户请求并提升服务质量\边缘计算
因此, 重点介绍当前边缘计算标准化的进展情况, 从欧洲电信标准化协会 (European Telecommunications Standards Institute, ETSI) 最先提出边缘计算架构开始, 到3GPP将边缘计算纳入未来5G发展的关键技术, 再到中国通信标准化协会 (China Communications Standards Association, CCSA) 中边缘计算的立项与课题研究\边缘计算架构
当前, 高计算消耗的应用和服务逐渐从集中式云计算中心向网络边缘的嵌入式环境迁移, FPGA因其灵活性和高能效特性, 使其在边缘计算的嵌入式系统中得到广泛的应用\FPGA
提出虚拟化操作系统架构, 该架构主要包含两部分: (1) 虚拟机监视器与轻量级内核相结合的虚拟化操作系统架构; (2) 支持分时复用虚拟机与空间分割虚拟机相结合的虚拟机监视器架构\虚拟化操作系统架构
面对日益增多的图数据, 分布式计算成为处理大规模图数据的有效手段\分布式计算
实验结果表明, 长波辐射过程并行计算结果正确, 在不改变原有代码结构的基础上即可获得46倍的加速比, 优化性能可比拟相同计算能力的Intel集群, 虽然较GPU加速仍有差距, 但大大增强了代码的可读性和可移植性, 且随着编译器和硬件技术的发展, OpenACC有着广阔的发展空间\GPU
为了提高企业创新能力和核心竞争力, 从产品需求策划、立项与计划、详细开发与设计、仿真与验证、工艺与试制、生产与销售、使用与维修以及报废与回收阶段的全生命周期管理概念入手, 论述了PLM的体系架构及关键技术, 通过分析PLM过程中的数据对象、核心产品BOM数据以及企业运营主题数据, 结合知识管理技术, 提出了一种基于PLM的产品数据与知识应用架构, 并在应用架构的基础上描述了基于产品数据与知识的精益研发业务蓝图, 最后展望了构建企业智慧研发生态环境, 推动企业的自主知识创新及精益管控的愿景\基于PLM的产品数据与知识应用架构
对此, 提出了一种基于物联网技术的油田节能监测平台的搭建方法\基于物联网技术的油田节能监测平台的搭建方法
雾计算架构下的任务调度与分配目前还是一个较新的研究热点\雾计算架构
在雾计算架构下采用该算法调度任务时考虑了服务等级目标 (SLO) 中响应时间的约束 (FOG-SLO-IGA) \雾计算架构
实验结果表明, FOG-SLO-IGA调度用户任务时在时延、SLO违规率以及服务提供商的花费上均低于云计算架构下采用IGA的调度 (CLOUD-IGA) ;同时, 在雾端调度任务时, IGA算法在执行速度上要快于传统SGA算法和轮询调度算法 (RRSA) \云计算架构
在分布式集群上进行内网防御的实验, 结果表明在一定规模的训练集上, 伪梯度提升决策树具有更好的预测准确度\分布式集群
多线程Java代码生成可以为SIGNAL模型在分布式和多核体系下的应用提供支撑\多核体系
多线程Java代码生成可以为SIGNAL模型在分布式和多核体系下的应用提供支撑\分布式
尽管现在已经有一些在GPU上的PIC方法的实现, 但是基于激光等离子体相互作用模拟的特点, 仍然有很多重要问题可以尝试其他解决思路\GPU
最终, 实现了支持JVM环境的高性能缓存系统U2cache\U2cache
实验结果表明, U2cache通信延迟接近RDMA底层硬件性能;对大消息而言, 相较无优化版本, 性能提高超过20%;访问SSD中的数据时, 相比通过内核I/O软件栈的方式, 访问延迟最高降低了31%\U2cache
众核处理器适应于加速高吞吐率的计算密集型应用, 而密码算法需要进行大量的数学计算, 特别需要使用高吞吐率的计算平台\众核处理器
使用MIC众核协处理器, 采用三级并行结构及任务分配机制, 提升了高吞吐率密码算法处理的并行性\MIC众核协处理器
使用MIC众核协处理器, 采用三级并行结构及任务分配机制, 提升了高吞吐率密码算法处理的并行性\三级并行结构
为了验证该算法的性能, 在Intel多核处理器上进行了并行化堆栈\并行化堆栈
针对嵌入式系统的安全问题, 在充分考虑嵌入式系统的设计约束条件的基础上, 借鉴可信计算的思想, 提出一种基于虚拟技术的嵌入式可信平台构建方案\基于虚拟技术的嵌入式可信平台构建方案
同时结合Java Script、HTML5等Web开发技术, 利用模型-视图-控制器 (model view controller, M VC) 模式, 设计了付费语音问答系统的框架和主要功能模块, 通过微信与用户对接, 最终实现了基于微信的付费语音问答系统\模型-视图-控制器
通过分析业界分布式缓存的现状和缺陷, 提出了一种分布式缓存系统架构\分布式缓存系统架构
针对软实时任务的特点, 提出一种基于抢占阈值的动态调度策略PT-STDS\动态调度策略PT-STDS
针对表述性状态传递 (REST) 架构本身安全机制不够完善的问题, 提出基于攻击图的REST架构安全分析与评估, 利用攻击图实现了对REST架构的安全性量化评估\针对表述性状态传递 (REST) 架构
首先, 对REST架构可能受到的攻击进行了预测, 据此构造了REST架构攻击图模型, 并计算了攻击可能性指标和攻击实现度指标\REST架构
然后, 针对攻击图中的攻击状态及攻击行为, 提出了安全防护措施, 据此重新构造了REST架构攻击图模型, 并计算了攻击可能性指标和攻击实现度指标\REST架构
比较结果表明, 所构造的攻击图模型能够对REST架构的安全性能进行有效的量化评估\REST架构
实验结果表明, 该框架在保证尽量少的反混淆用时前提下, 反混淆后的程序与未混淆源程序的代码相似度为96.7%, 能非常好地实现x86架构下C/C++文件的OLLVM反混淆\x86架构
在对Docker架构及组件构成简要介绍的基础上, 先从网络通信、镜像构建、容器运行、仓库存储、内核支持和软件本身六个角度对现阶段Docker存在的安全威胁进行全面分析归纳, 再从安全支撑、内核安全和数据中心安全三大层面对Docker安全防护技术进行全方位的梳理论述, 阐明了每种安全防护技术的优势及需要完善改进的不足之处, 并总结了日志审计、威胁检测和安全模型等其他安全防护技术\Docker架构
不仅呈现出当前Docker安全研究的概貌, 同时明确指出了Docker安全领域亟需解决的一些关键问题, 探讨与展望了Docker安全研究的发展趋势\Docker
该文基于OpenStack云平台给出了策略语言评估机制的参考实现, 验证了方法的可行性\OpenStack云平台
实验结果表明, 相比OpenStack原有策略, 该文策略评估开销降低了19\OpenStack
该文从软件服务工程的角度, 探索了从模型驱动架构MDA到模型交互驱动架构MiDA的演进;提出并论述了MiDA的三大内核技术, 即RGPS需求元描述、服务供给侧的O-RGPS构造元模型以及互操作性元模型框架标准系列MFI (O-RGPS) , 揭示了三者之间多个“含意三角形”模式联动的基本过程以及虚实互动的软件模型互操作过程, 阐明了MiDA与MDA的兼容性\模型驱动架构MDA
基于固态盘中存在非对齐写更新操作提出一种MFTL缓存架构, 其核心的思想是利用写更新数据存储不对齐的特性, 通过重新设计页级映射的FTL将缓存中不同逻辑数据页存在的非对齐更新数据合并为闪存页规格的大小后写回至闪存阵列中, 可以节省由于写更新操作导致的额外读取操作的同时也充分减少实际的闪存写入次数, 因而降低了底层处理请求队列的负载压力和相应增加了闪存的物理可用容量\MFTL缓存架构
实验平台采用母板/子板总体架构, 在Xilinx Zynq-7000FPGA开发板Zedboard上实现eMMC控制器, 通过FMC接口与eMMC芯片子板进行通信传输\母板/子板总体架构
当前REST服务架构广泛应用于大规模、可扩展的分布式Web系统中, 若应用REST服务架构时不遵循其标准特征, 则可能导致基于REST服务架构的Web系统出现性能下降、可扩展性低等问题\REST服务架构
当前REST服务架构广泛应用于大规模、可扩展的分布式Web系统中, 若应用REST服务架构时不遵循其标准特征, 则可能导致基于REST服务架构的Web系统出现性能下降、可扩展性低等问题\REST服务架构
当前REST服务架构广泛应用于大规模、可扩展的分布式Web系统中, 若应用REST服务架构时不遵循其标准特征, 则可能导致基于REST服务架构的Web系统出现性能下降、可扩展性低等问题\REST服务架构
因此, 实现基于REST服务架构的Web系统前, 需要对该系统设计是否满足REST服务架构标准特征进行验证, 以提升基于REST服务架构的Web系统的研发质量\REST服务架构
因此, 实现基于REST服务架构的Web系统前, 需要对该系统设计是否满足REST服务架构标准特征进行验证, 以提升基于REST服务架构的Web系统的研发质量\REST服务架构
因此, 实现基于REST服务架构的Web系统前, 需要对该系统设计是否满足REST服务架构标准特征进行验证, 以提升基于REST服务架构的Web系统的研发质量\REST服务架构
首先, 设计并定义了驾驶人行为谱的特征指标和评价指标;其次, 给出了驾驶人行为谱的特征指标分析、计算方法, 采用基于马尔可夫链蒙特卡洛采样和离群点剔除的K-means算法对驾驶人的驾驶风格进行分析, 采用回归学习对驾驶人的驾驶技能进行分析;然后, 设计了基于车联网、大数据的驾驶人行为谱的基础数据采集和预处理方法;最后, 采用Java语言、Spring MVC架构开发出驾驶人行为谱分析工具\Spring MVC架构
首先, 重构OpenFlow协议的流表结构, 设计实现包括安全匹配字段、安全动作在内的OpenFlow数据安全策略;然后, 设计中心化管理控制器, 通过开发的多个功能模块使控制器及时感知网络变化, 有效管控全局网络, 维护和下发数据加 (解) 密密钥、数据安全策略;其次, 深度重构开放虚拟交换机OVS架构, 设计实现数据安全策略匹配和数据安全处理的完整流程, 编写数据净载信息提取接口, 通过开发的多个功能模块使OVS能够根据数据安全策略细粒度匹配数据包, 并对匹配成功的数据包进行完整数据安全处理操作;最后, 搭建软硬件平台, 对该机制的加解密处理结果和延时、吞吐量以及CPU使用率进行测试\OVS架构
然后再对JBPM进行深入的研究, 主要包括JBPM系统架构、工作流引擎、流程定义工具、动态表单工具、JBPM工作流程、JBPM在工作流程设计上的不足等\JBPM系统架构
传统的基于动态随机存储 (DRAM) 的内存架构面临着容量、能耗、可靠性等方面的问题;新型非易失存储器件 (Non-Volatile Memory, NVM) 具有非易失、字节寻址、空闲能耗低等优势, 可以作为外存、内存或存储级内存 (Storage Class Memory, SCM) , 为未来存储系统的变革提供了新选择, 但同时也存在一些安全问题\内存架构
到目前为止, 这是唯一能够利用CUDA架构来加速完整蛋白质鉴定的研究工作\CUDA架构
com/dqiong/CUDA-TP\CUDA-TP
因此, 设计一种全新的混合存储架构, 结合最近最少使用 (LRU) 算法和带有时间变化的最不经常使用 (LFU-Aging) 算法提出区分数据读写倾向性的缓存策略, 并且基于布隆过滤器 (BF) 设计针对强空间局部性工作集的动态磨损均衡算法, 在有效减少冗余写操作的同时实现低空间开销的组间磨损均衡操作\混合存储架构
结合工作实践, 介绍了冒烟测试、门槛用例和基于持续集成冒烟测试的特点;叙述了冒烟测试涉及到的角色和软件测试自动化工厂;详细叙述了冒烟测试运行的系统架构和运行流程\冒烟测试运行的系统架构
在研究Hadoop云计算平台架构的基础上, 为了将车牌识别算法应用于Hadoop云计算平台, 对MapReduce数据流及Hadoop云计算平台的系统架构进行了设计\Hadoop云计算平台架构
在研究Hadoop云计算平台架构的基础上, 为了将车牌识别算法应用于Hadoop云计算平台, 对MapReduce数据流及Hadoop云计算平台的系统架构进行了设计\Hadoop云计算平台
介绍了包含侦察类、打击类、通信类、补给类、修复类以及指控类Agent的UML体系架构, 对自主开发的作战仿真原型系统及其作战想定进行了说明, 在对战役层次指控Agent认知域描述与假设的基础上, 对改进Q-learning认知决策算法的参数归一化、基于GRBF神经网络的Q离散、基于TD公式的跨步差分机制以及网络结构的学习训练过程进行了详细说明\UML体系架构
针对分布式系统架构的基于位置服务隐私保护方法在连续位置查询服务中可能会受到的差异识别攻击, 提出了一种单元格不确定性扩张的连续匿名区域隐私保护方法\分布式系统架构
目前飞行试验实时监控采用C/S架构, 数据调度软件作为遥测数据实时处理软件 (服务器端) 与监控画面之间的桥梁, 起着关键作用\C/S架构
经典Hadoop并行平台可在一定程度上提高遗传算法的运行效率, 而新一代Spark并行平台可以更加充分地发挥遗传算法的并行潜能\经典Hadoop并行平台
经典Hadoop并行平台可在一定程度上提高遗传算法的运行效率, 而新一代Spark并行平台可以更加充分地发挥遗传算法的并行潜能\新一代Spark并行平台
在2016年中国计算机学会 (CCF) 组织的大数据竞赛《大数据精准营销中搜狗用户画像挖掘》中, 所提二级融合算法框架在894支队伍中夺得了冠军\二级融合算法框架
提出了一种端到端分布式框架 (client to client distributed framework, 简称C2CDF) , 相比传统服务器-客户端架构的集中通信模式, C2CDF的各个节点间地位平等, 不存在集中通信, 集群的带宽瓶颈和压力得以减轻\传统服务器-客户端架构
