首先, 采用了软件定义车联网的分层控制结构, 由局部控制器和全局控制器组成, 实现数据转发和控制分离, 可灵活控制数据转发的方向;然后, 设计了单条路段的车辆路由机制, 该机制预测车辆节点位置并采用贪心策略, 实现数据的稳定传输;其次, 设计了多个需求间的路段路由机制, 该机制采用广度优先搜索 (BFS) 算法和边集相结合的方式, 实现多个需求间路径不相交, 缓解带宽瓶颈问题;最后, 通过仿真验证, 对比无线自组网按需平面距离向量 (AODV) 路由, 所提出的数据转发策略和路由选择算法在数据分组接收率上提高40%以上, 平均延迟时间降低60%左右\软件定义车联网
实验结果表明, 软件定义车联网的数据转发策略和路由选择技术能够提高数据转发效率, 减少平均收包延时\软件定义车联网
当前大多数软件定义网络 (SDN) 中控制器的部署方案均重点考虑正常网络状态下传播时延对性能的影响, 而忽略了链路故障状态下对时延的影响, 针对此问题, 提出了一种基于时延优化的控制层部署方案\软件定义网络 (SDN)
针对室内移动灭火机器人依靠自身传感器无法及时获取全面环境信息和缺少远程网络控制功能的问题, 提出了一种基于无线传感器网络 (WSN) 且具有远程网络控制功能的系统架构\基于无线传感器网络 (WSN) 且具有远程网络控制功能的系统架构
软件定义网络具备较好的灵活性和可编程能力, 文中结合IEEE 802.11p和4G蜂窝网络, 提出了一种基于SDN的异构车联网架构, 并引入新的路由解决方案, 致力于实现高数据包交换率和低延迟\软件定义网络
软件定义网络具备较好的灵活性和可编程能力, 文中结合IEEE 802.11p和4G蜂窝网络, 提出了一种基于SDN的异构车联网架构, 并引入新的路由解决方案, 致力于实现高数据包交换率和低延迟\基于SDN的异构车联网架构
软件定义网络 (Software Defined Networking, SDN) 采用中心化的控制平面能方便地实现对路由的精确控制\软件定义网络 (Software Defined Networking, SDN)
针对SDN网络下的多路径路由问题, 提出了基于多路广播树的路由存储结构及相应的多路径选择算法\SDN网络
为解决低功耗蓝牙 (BLE) 组网中基于星型拓扑结构不能支持多跳和基于Mesh的散射网路由和调度算法比较复杂的问题, 提出三层结构的BLE树型结构的协同网络构建\低功耗蓝牙 (BLE) 组网
软件定义网络 (software-defined networking, SDN) 是一种新型的网络体系结构, SDN网络将传统网络的数据层和控制层进行分离, 数据层由支持OpenFlow协议的交换机实现, 控制层由控制器来实现\软件定义网络 (software-defined networking, SDN)
软件定义网络 (software-defined networking, SDN) 是一种新型的网络体系结构, SDN网络将传统网络的数据层和控制层进行分离, 数据层由支持OpenFlow协议的交换机实现, 控制层由控制器来实现\SDN网络
故提出一种轻量级的符合SDN场景的防御方案——SecTopo——实现拓扑污染防御\SDN
因特网中日益增长的内容获取需求促使学术界提出了多种以信息为中心的未来网络架构\多种以信息为中心的未来网络架构
首先介绍了面向三种尺度无缝融合的网络复现体系架构, 然后重点研究了基于该体系架构的网络构建技术\网络复现体系架构
首先, 介绍空口监测分析仪整体物理架构及逻辑架构及两者之间的关系, 及架构中各模块在监测仪中的功能;然后, 设计一种监测仪中载波聚合技术的实现方案, 以及一种仪表在多载波多小区情况下对多用户的支持方案, 以满足新技术下用户及基站设备测试的需要\物理架构
首先, 介绍空口监测分析仪整体物理架构及逻辑架构及两者之间的关系, 及架构中各模块在监测仪中的功能;然后, 设计一种监测仪中载波聚合技术的实现方案, 以及一种仪表在多载波多小区情况下对多用户的支持方案, 以满足新技术下用户及基站设备测试的需要\逻辑架构
基于Open Flow的SDN架构对QoS的支持情况进行了分析, 发现在基于Open Flow的SDN架构下实现QoS比传统网络中更容易更灵活\基于Open Flow的SDN架构
基于Open Flow的SDN架构对QoS的支持情况进行了分析, 发现在基于Open Flow的SDN架构下实现QoS比传统网络中更容易更灵活\基于Open Flow的SDN架构
最后对现今基于SDN的架构下的QoS实现方案做了阐述, 并对其将会遇到的挑战和问题进行分析\基于SDN的架构
该系统的优势主要体现在以下三方面: (1) 能够让多媒体传感器同时与多个汇聚节点 (服务器) 进行通信的系统架构; (2) 能够适应多样的Wi-Fi环境和应用场景的多宿主传感器传输协议; (3) 后续的实验结果也证明了该系统和协议可以提高多媒体数据传输的可靠性\多媒体传感器同时与多个汇聚节点 (服务器) 进行通信的系统架构
首先介绍MEC的网络框架结构及其在5G中的标准化进展, 然后结合MEC的部署策略和未来5G网络架构, 提出融合MEC的未来5G移动通信网络架构\MEC的网络框架结构
首先介绍MEC的网络框架结构及其在5G中的标准化进展, 然后结合MEC的部署策略和未来5G网络架构, 提出融合MEC的未来5G移动通信网络架构\MEC
首先介绍MEC的网络框架结构及其在5G中的标准化进展, 然后结合MEC的部署策略和未来5G网络架构, 提出融合MEC的未来5G移动通信网络架构\5G网络架构
首先介绍MEC的网络框架结构及其在5G中的标准化进展, 然后结合MEC的部署策略和未来5G网络架构, 提出融合MEC的未来5G移动通信网络架构\5G移动通信网络架构
首先介绍MEC的网络框架结构及其在5G中的标准化进展, 然后结合MEC的部署策略和未来5G网络架构, 提出融合MEC的未来5G移动通信网络架构\MEC
SDN (Software Defined Networking, 软件定义网络) 是一种新型的网络架构, 是网络实现自动化部署灵活管理的一个重要方式\SDN (Software Defined Networking, 软件定义网络)
SDN技术将网络的数据平面和控制平面相分离, 从而实现了网络流量的灵活控制\SDN
随着网络规模的扩大及业务的多样化, 原有的网络架构难以满足未来发展需求, 软件定义网络 (software defined networking, SDN) 作为一种新型网络架构被提出\软件定义网络 (software defined networking, SDN) 
利用SDN的集中获取信息的特性可对网络中的安全威胁进行监督检测, 提高网络安全性\SDN
文中从SDN的各层及接口对网络安全问题进行分析, 并对现有的解决方案进行了分类, 分别从提升SDN控制器安全性、DoS/DDoS攻击防御、流规则一致性、提升应用程序安全性、北向接口标准化这5个方面进行了探讨, 进而得出结论, 并对未来进行展望\SDN
针对软件定义网络 (SDN) 中数据层的路由优化问题, 提出一种基于网络切片和整数线性规划 (ILP) 多约束优化的路由方案\软件定义网络 (SDN)
HVLB整体采用软件定义网络 (software defined networking, SDN) 思想设计, 实现调度策略制订和数据转发的有效分离\软件定义网络 (software defined networking, SDN)
在转发端基于用户空间实现多核多队列高效数据处理架构, 同时保证各处理队列间的数据访问隔离和任务处理均衡;在控制端基于网络链路和计算相结合的综合能力作为NF选择和转发策略的制订依据, 在实施业务数据准确分发的基础上保障了网络性能\基于用户空间实现多核多队列高效数据处理架构
基于KVM的原型系统实验结果表明:与现有LVS系统相比, HVLB极大地提升了数据包处理与转发性能, 并实现了64字节UDP数据包的线速转发\HVLB
面向SDN网络环境, 分析多级虚拟拓扑的关联, 基于Floyd算法思想设计了可依次迭代的多关联拓扑路由计算方法, 计算时间相对典型的路由算法显著降低\SDN
分析了当前主流数据中心的网络架构、通信协议和路由计算原理, 提出了一种基于链路状态数据库 (link state database, LSDB) 的数据中心网络异常检测方法 LSAP, 该方法通过搜集LSDB, 使用改进路由算法计算全网路由形成路由择域信息库 (routing information base, RIB) , 根据LSDB快照和RIB快照比对准确关联链路变化和路由变化, 发现链路异常、路由异常, 能够定位故障\流数据中心的网络架构
随着网络用户以及网络资源的增长, P2P网络, 一种在对等者 (peer) 之间分配任务和工作负载的分布式应用架构, 引起了广泛关注\分布式应用架构
随着网络用户以及网络资源的增长, P2P网络, 一种在对等者 (peer) 之间分配任务和工作负载的分布式应用架构, 引起了广泛关注\P2P网络
由于具有较好的可用性、可扩展性, 非结构化P2P网络成为P2P网络研究的热点\P2P网络
由于具有较好的可用性、可扩展性, 非结构化P2P网络成为P2P网络研究的热点\非结构化P2P
内容中心网络 (content-centric network, CCN) 作为一个新颖的网络构架被提出, 它将数据的内容和位置分离开来, 实现以内容为中心的网络模型, 以有效地解决IP通信的弊端\内容中心网络 (content-centric network, CCN)
为了实现网络跳变收益的最大化, 在分层跳变的架构上设计了一种网络自适应跳变算法\分层跳变的架构
因此, 提出了基于软件定义网络 (software defined networking, SDN) 和接触图的空间信息网络路由机制\软件定义网络 (software defined networking, SDN) 
对此, 提出一个基于影响力的框架, 来分析社交网络\基于影响力的框架
针对云数据中心网络存在的可扩展性和灵活性问题, 提出了一种基于SDN (Software Defined Networking) 的云数据中心弹性网络架构, 解决目前云平台存在的网络无法弹性调度和灵活分配的问题\基于SDN (Software Defined Networking) 的云数据中心弹性网络架构
基于OpenDayLight设计高性能控制器集群架构和多控制器负载均衡算法, 解决传统SDN架构中存在的控制器单点失效的问题, 保障云数据中心中多租户的高效网络按需调度和SDN网络的可靠性\高性能控制器集群架构
基于OpenDayLight设计高性能控制器集群架构和多控制器负载均衡算法, 解决传统SDN架构中存在的控制器单点失效的问题, 保障云数据中心中多租户的高效网络按需调度和SDN网络的可靠性\SDN架构
为了解决当前网络暴露出来的诸多问题, 对未来网络架构的研究已经形成一个新的领域\未来网络架构
SDN (software-defined networking, 软件定义网络) 打破了传统网络分层的思想, 它将控制和转发解耦, 通过提供开放式应用程序接口实现对网络设备的自动化配置和网络流量的实时监测, 用以满足日益变化的网络需求\SDN (software-defined networking, 软件定义网络) 
在研究了SDN架构和主要实现方式OpenFlow技术的基础上, 深入探讨了基于OpenFlow协议的底层网络拓扑发现机制和网络性能监测机制, 并搭建了实验平台进行仿真测试\SDN架构
实验结果表明, SDN架构通过逻辑上集中控制的方式实现底层网络对上层应用的透明化并根据全局网络视图进行精细的流量监测, 从而提高网络整体的服务质量\SDN架构
基于软件定义网络 (software defined network, 简称SDN) 的数据中心流量工程, 能够通过对全局视图的网络管控, 动态选择路由路径, 规避拥塞发生的风险\软件定义网络 (software defined network, 简称SDN)
SDN (Software Defined Network) 将控制和转发进行分离, SDN集中控制的特性使得SDN控制器能够获取整个网络的信息\SDN (Software Defined Network) 
在此基础上提出一种基于区块链技术的数据一致性维护三层体系架构, 有效维护区块链网络数据一致, 最后对区块链的发展前景进行展望\基于区块链技术的数据一致性维护三层体系架构
以软件定义网络 (SDN) 为代表的集中控制架构, 通过感知网络状态, 从全局视图进行路由计算并下发策略, 促使网络路由趋近最优目标\软件定义网络 (SDN)
在新兴的软件定义网络 (Software Defined Networking, SDN) 、OpenFlow交换机中, 为满足OpenFlow协议宽匹配域的需求, SDN交换设备需要更大的查找表存储容量\软件定义网络 (Software Defined Networking, SDN)
为验证NFVNTP原型系统的有效性, 该文给出基于NFVNTP的两个试验例子:一个试验用于对工作在海空环境中的某待测网络设备进行了兼容性测试, 在该虚拟海空环境中包括了窄带数据链和同步通信卫星信道;另一个试验对两个软件定义网络 (SDN) 经广域网互连进行了性能测评, 一个实际的SDN网络中的视频能够通过NFVNTP传输到另一个实际的SDN中\软件定义网络 (SDN) 
为了适应这种变化, 学术界提出了内容中心网络 (CCN) 的未来网络架构\未来网络架构
软件定义网络 (software defined network, SDN) 是一种能将基础设备的网络控制功能分离并集中地部署到控制器中的网络架构\软件定义网络 (software defined network, SDN) 
在Hadoop中引入SDN, 利用SDN的网络控制能力, 将网络中的可用剩余带宽作为任务调度的重要参数, 并提出任务调度算法RBA (residual bandwidth based algorithm) \SDN
在Hadoop中引入SDN, 利用SDN的网络控制能力, 将网络中的可用剩余带宽作为任务调度的重要参数, 并提出任务调度算法RBA (residual bandwidth based algorithm) \SDN
通过将不经意传输协议、simple和cuckoo哈希算法以及Feistel密码结构相结合, 设计一种隐私集合交集协议, 保证车联社交网用户个人隐私不被泄露\Feistel密码结构
Surge密码分组长度为64位, 使用64位、80位和128位3种密钥长度, 且基于SPN结构\SPN结构
将Surge算法在FPGA上进行了实现, 实验结果表明, 相对于目前SPN结构的轻量级密码算法, Surge算法占用的面积资源更小, 同时有着良好的加密性能;安全性实验证明了Surge可以有效抗差分与线性攻击、代数攻击\SPN结构
首先, 使用模糊提取技术提取生物特征的随机密钥参与认证, 解决了生物特征泄露导致永久不可用的问题;其次, 利用不易篡改的区块链存储生物特征公开信息, 解决了模糊提取技术易受主动攻击威胁的问题;最后, 基于区块链的分布式存储功能与联盟链架构, 实现了用户在本地和异地环境下的双因子跨域认证\区块链的分布式存储功能与联盟链架构
该方法基于MapReduce并行计算架构\MapReduce并行计算架构
使用Flume收集自动站数据, Spark Streaming对数据进行流式处理并存储到HBase数据库中, 并设计Spark框架下的自动站数据流式入库处理算法和要素极值的实时统计算法, 在Cloudera平台下实现了一个高速可靠的实时采集、处理、统计的应用系统\Cloudera平台
首先, 分析了SDN相比传统网络在网络层防护技术上的优势;其次, 针对网络攻击手段——恶意扫描, 提出了面向恶意扫描的控制层实时防护机制, 该机制在SDN集中控制式架构的基础上, 充分利用Open Day Light (ODL) 控制器所提供的表述性状态传递 (REST) 应用程序编程接口 (API) 开发外部应用, 实现了对底层交换机端口的检测、判定、防护三个环节;最后, 对给出的方案在ODL平台上进行了编程实现, 并实验测试了恶意扫描的检测防御方案\SDN集中控制式架构
以第四军医大学校园网SOC为例, 构建了决策、管理、运营和应用4个层次的SOC组织体系, 按照划分安全域的思想设计了校园网整体的安全防护架构, 探索了校园网安全态势感知平台的日常和异常网络安全运维流程\校园网整体的安全防护架构
将敏捷开发融入到跨境电商平台的架构与开发中, 这样的应用使得整个平台的项目同时高效地进行开发, 代码质量得到了进一步的提升\跨境电商平台的架构
SDN采用转发与控制分离的架构和集中的控制管理机制, 可有效满足不同网络中不同粒度的管理控制需求\SDN
但是, 在基于FPGA的可重构交换机架构和设计方法方面还缺少深入研究, 主要表现在难以实现基于模块细粒度的SDN处理流程重构, 现有工作复用程度低, 同时无法为开源的SDN数据平面设计提供技术支持\基于FPGA的可重构交换机架构
为此, 提出一种基于FPGA的SDN交换平面实现结构——RESSP (FPGA-based REconfigurable SDN Switching Pipeline) \RESSP 
RESSP将报文处理流程拆解成多个可动态加载的模块, 针对交换机具体的应用场景, 利用FPGA可编程特性对硬件功能模块进行增加、删除或替换, 从而针对实际需求设计出相应的报文处理逻辑\RESSP
动态能耗管理是一种在保证系统性能的基础上降低其能耗的有效方法, 其关键点是如何生成有效的动态能耗管理策略\动态能耗管理策略
基于命名数据网络 (named data networking, NDN) 而非传统端到端的TCP/IP体系结构提供网络视频直播, 并通过卫星广播进行内容分发, 可以以相对较低的通信开销提供大范围高质量服务\命名数据网络
为了解决该问题, 进一步提升应用效率, 在NDN的基础上进行改进, 提出了容迟未决信息表 (delay pending interest table, DPIT) \NDN
基于开源软件设计了一个数据平台架构来让用户一站式地共享数据和计算, 同时跟踪和审核代码\数据平台架构
为解决OpenStack云平台中单个节点的MySQL数据库在面临高并发访问和海量数据增长的情况下存在可靠性低、存储扩展性差、单点瓶颈等问题, 设计并实现一种以Ceph分布式文件系统为存储后端的高可用MySQL数据库集群系统\OpenStack
尤其是在大数据背景下, 传统集中调度结构的性能瓶颈被放大, 研究者开始向全新的调度结构进行探索, 应运而生了众多新思路、新结构\传统集中调度结构
同时, 作为在Qt基础上发展出来的前端技术, QML和Qt后台的衔接更为紧密, 而完全独立的前端描述技术, 最大程度地降低了前后端的耦合度, 使得软件架构层次清晰\软件架构
QML/Qt, C++软件架构方案, 比传统的MFC/C++.SQL SERVER.MYSQL, HTML+CSS+JS/php.java.net或Qt/Qt.C++逻辑更加清晰, 可扩展性和可维护性更强, 前端设计更加简洁高效\MFC/C++.SQL SERVER.MYSQL
QML/Qt, C++软件架构方案, 比传统的MFC/C++.SQL SERVER.MYSQL, HTML+CSS+JS/php.java.net或Qt/Qt.C++逻辑更加清晰, 可扩展性和可维护性更强, 前端设计更加简洁高效\QML/Qt, C++软件架构
QML/Qt, C++软件架构方案, 比传统的MFC/C++.SQL SERVER.MYSQL, HTML+CSS+JS/php.java.net或Qt/Qt.C++逻辑更加清晰, 可扩展性和可维护性更强, 前端设计更加简洁高效\HTML+CSS+JS/php.java.net
QML/Qt, C++软件架构方案, 比传统的MFC/C++.SQL SERVER.MYSQL, HTML+CSS+JS/php.java.net或Qt/Qt.C++逻辑更加清晰, 可扩展性和可维护性更强, 前端设计更加简洁高效\Qt/Qt.C++
实际测试表明, 该系统性能稳定, 软件架构逻辑清晰, 前端设计达到了艺术级的效果\软件架构
对此, 在充分理解智慧园区数据分析系统功能需求、性能需求的基础上, 结合当前比较主流的数据分析方面的技术, 提出了Kettle+Hive+Tableau的智慧园区数据分析解决方案\Kettle+Hive+Tableau
主要对Linux系统进行适当的裁剪、编译后, 移植到ARM11微处理器中, 并直接通过Linux2.6.38内核对网卡进行图形化界面的配置, 使系统能够完全支持AR9271网卡, 然后再利用hostapd应用程序与其配置文件hostapd.conf相配合, 开启AP模式, 在无需路由器的情况下即可构建一定范围内的无线局域网络, 增强了整个系统的可扩展性和移动性;同时, 在socket套接字基础上, 设计了C/S模式下的网络通信, 使远程PC与ARM 11远程服务器实现无线通信\ARM11
主要对Linux系统进行适当的裁剪、编译后, 移植到ARM11微处理器中, 并直接通过Linux2.6.38内核对网卡进行图形化界面的配置, 使系统能够完全支持AR9271网卡, 然后再利用hostapd应用程序与其配置文件hostapd.conf相配合, 开启AP模式, 在无需路由器的情况下即可构建一定范围内的无线局域网络, 增强了整个系统的可扩展性和移动性;同时, 在socket套接字基础上, 设计了C/S模式下的网络通信, 使远程PC与ARM 11远程服务器实现无线通信\AR9271
主要对Linux系统进行适当的裁剪、编译后, 移植到ARM11微处理器中, 并直接通过Linux2.6.38内核对网卡进行图形化界面的配置, 使系统能够完全支持AR9271网卡, 然后再利用hostapd应用程序与其配置文件hostapd.conf相配合, 开启AP模式, 在无需路由器的情况下即可构建一定范围内的无线局域网络, 增强了整个系统的可扩展性和移动性;同时, 在socket套接字基础上, 设计了C/S模式下的网络通信, 使远程PC与ARM 11远程服务器实现无线通信\C/S模式
主要对Linux系统进行适当的裁剪、编译后, 移植到ARM11微处理器中, 并直接通过Linux2.6.38内核对网卡进行图形化界面的配置, 使系统能够完全支持AR9271网卡, 然后再利用hostapd应用程序与其配置文件hostapd.conf相配合, 开启AP模式, 在无需路由器的情况下即可构建一定范围内的无线局域网络, 增强了整个系统的可扩展性和移动性;同时, 在socket套接字基础上, 设计了C/S模式下的网络通信, 使远程PC与ARM 11远程服务器实现无线通信\ARM 11
实验结果表明, 设置在AP模式下的ARM 11不仅能在不同场景下与远程PC构成稳定、可靠的无线网络化通信, 而且针对常见的通信弊病, 因构建的小范围局域网能够扩展通信范围, 对通信具有一定的改善效果\ARM 11
通过梳理现阶段国内外关于CPS安全问题及其防护措施的研究成果发现, 基于整体多层次统筹以及分布式架构的防护措施成为了当前的研究导向, 这与区块链技术的整体性分布式架构特征相一致\分布式架构
通过梳理现阶段国内外关于CPS安全问题及其防护措施的研究成果发现, 基于整体多层次统筹以及分布式架构的防护措施成为了当前的研究导向, 这与区块链技术的整体性分布式架构特征相一致\整体性分布式架构
在区块链分布式拓扑结构及其信息安全特性的基础上, 提出了融合区块链技术与CPS的防护思想, 论证了结合二者的可能性, 并构建了实现二者深入融合的BCCPS框架机制\区块链分布式拓扑结构
研究结果表明, 基于双链架构的医药商业资源公有区块链能够兼顾交易信息的开放性、安全性和企业信息的隐私性, 自适应地完成资源的寻租和匹配, 并大幅提高公共服务平台的公信力和系统的整体效率\双链架构
首先, 给出了动态数据存储安全问题的数学模型;其次, 分析了共识终端最大化自身收益的局部行为与保障动态数据存储系统安全性和有效性整体目标的一致性;再次, 设计了适用于动态数据存储安全的共识机制、实例系统所有权状态转移函数和动态数据存储体系结构;最后, 分析了系统随机状态模型下动态数据存储区块链的质量特性和生长特性\动态数据存储体系结构
最后, 通过对战略目标防空部署策略的风险分析来说明模型的具体应用过程\战略目标防空部署策略
分析了对象存储系统存储管理溯源信息的优势, 研究并实现了如何利用对象存储系统架构来收集和存储溯源\对象存储系统架构
在此基础上, 以JAUMIN (J adaptive unstructured mesh application infrastructure) 框架的应用为例, 设计并实现了一种面向非结构网格数值模拟应用并行程序的图形化编程工具\JAUMIN
结合LTE网络架构给出PCI冲突与混淆的分布式检测及集中式的冲突与混淆解决方案, 结合仿真结果表明该方法有效可行\LTE网络架构
为有效解决内存云主要存储器件DRAM面临能耗损失大、数据可靠性差、断电易失等问题, 提出使用非易失性存储器件PCM替换部分DRAM器件构成混合内存云架构\混合内存云架构
模拟算例结果表明, 与相同能耗的内存云架构相比, 该混合内存云架构提高了9.37%的存储能力, 断电恢复延迟减少15.87%\内存云架构
模拟算例结果表明, 与相同能耗的内存云架构相比, 该混合内存云架构提高了9.37%的存储能力, 断电恢复延迟减少15.87%\混合内存云架构
为解决现有故障注入工具缺乏对虚拟化系统特有故障进行测试的问题, 提出一种面向虚拟化系统的故障注入工具架构\面向虚拟化系统的故障注入工具架构
架构由虚拟机管理器、各虚拟机节点和前端部分组成, Xml定义的测试脚本通过前端部分传入并解析, 使得虚拟机管理器获取故障注入信息后, 根据信息将各类故障注入到虚拟机节点中, 完成一次故障注入过程\架构
